Node	ChrID	GenesCount	Genes
Anc4	Sp1(7)	280	G1 G2 G49 G48 G47 G46 G45 G44 G43 G42 G41 G40 G39 G38 G37 G36 G35 G34 G33 G32 G31 G30 G29 G28 G27 G26 G25 G24 G23 G22 G21 G20 G19 G18 G17 G16 G15 G14 G13 G12 G11 G10 G9 G8 G7 G6 G5 G4 G3 G50 G51 G52 G53 G54 G55 G56 G57 G58 G59 G60 G61 G62 G63 G64 G65 G66 G67 G68 G69 G70 G71 G72 G73 G74 G75 G76 G77 G78 G79 G80 G81 G82 G83 G84 G85 G86 G87 G88 G89 G90 G91 G92 G93 G94 G95 G96 G97 G98 G99 G100 G101 G102 G103 G104 G105 G106 G107 G108 G109 G110 G111 G112 G113 G114 G115 G116 G117 G118 G119 G120 G121 G122 G123 G124 G125 G126 G127 G128 G129 G130 G131 G132 G133 G134 G135 G136 G137 G138 G139 G140 G141 G142 G143 G144 G145 G146 G147 G148 G149 G150 G151 G152 G153 G154 G155 G156 G157 G158 G159 G160 G161 G162 G163 G164 G165 G166 G167 G168 G169 G170 G171 G172 G173 G174 G175 G176 G177 G178 G179 G180 G181 G182 G183 G184 G185 G186 G187 G188 G189 G190 G191 G192 G193 G194 G195 G196 G197 G198 G199 G200 G201 G202 G203 G204 G205 G206 G207 G208 G209 G210 G211 G212 G213 G214 G215 G216 G217 G218 G219 G220 G221 G222 G223 G224 G225 G226 G227 G228 G229 G230 G231 G232 G233 G234 G235 G236 G237 G238 G239 G240 G241 G242 G243 G244 G245 G246 G247 G248 G249 G250 G251 G252 G253 G254 G255 G256 G257 G258 G259 G260 G261 G262 G263 G264 G265 G266 G267 G268 G269 G270 G271 G272 G273 G274 G275 G276 G277 G278 G279 G280
Anc4	Sp3(6)	488	H1 H2 H3 H4 H5 H6 H7 H8 H9 H10 H11 H12 H13 H14 H15 H16 H17 H18 H19 H20 H21 H22 H23 H24 H25 H26 H27 H28 H29 H30 H31 H32 H33 H34 H35 H36 H37 H38 H39 H40 H41 H42 H43 H44 H45 H46 H47 H48 H49 H50 H51 H52 H53 H54 H55 H56 H57 H58 H59 H60 H61 H62 H63 H64 H65 H66 H67 H68 H69 H70 H71 H354 H353 H352 H351 H350 H349 H348 H347 H346 H345 H344 H343 H342 H341 H340 H339 H338 H337 H336 H335 H334 H333 H332 H331 H330 H329 H328 H327 H326 H325 H324 H323 H322 H321 H320 H319 H318 H317 H316 H315 H314 H313 H312 H311 H310 H309 H308 H307 H306 H305 H304 H303 H302 H301 H300 H299 H298 H297 H296 H295 H294 H293 H292 H291 H290 H289 H288 H287 H286 H285 H284 H283 H282 H281 H280 H279 H278 H277 H276 H275 H274 H273 H272 H271 H270 H269 H268 H267 H266 H265 H264 H263 H262 H261 H260 H259 H258 H257 H256 H255 H254 H253 H252 H251 H250 H249 H248 H247 H246 H245 H244 H243 H242 H241 H240 H239 H238 H237 H236 H235 H234 H233 H232 H231 H230 H229 H228 H227 H226 H225 H224 H223 H222 H221 H220 H219 H218 H217 H216 H215 H214 H213 H212 H211 H210 H209 H208 H207 H206 H205 H204 H203 H202 H201 H200 H199 H198 H197 H196 H195 H194 H193 H192 H191 H190 H189 H188 H187 H186 H185 H184 H183 H182 H181 H180 H179 H178 H177 H176 H175 H174 H173 H172 H171 H170 H169 H168 H167 H166 H165 H164 H163 H162 H161 H160 H159 H158 H157 H156 H155 H154 H153 H152 H151 H150 H149 H148 H147 H146 H145 H144 H143 H142 H141 H140 H139 H138 H137 H136 H135 H134 H133 H132 H131 H130 H129 H128 H127 H126 H125 H124 H123 H122 H121 H120 H119 H118 H117 H116 H115 H114 H113 H112 H111 H110 H109 H108 H418 H417 H416 H415 H414 H413 H412 H411 H410 H409 H408 H407 H406 H405 H404 H403 H402 H401 H400 H399 H398 H397 H396 H395 H394 H393 H392 H391 H390 H389 H388 H387 H386 H385 H384 H383 H382 H381 H380 H379 H378 H377 H376 H375 H374 H373 H372 H371 H370 H369 H368 H367 H366 H365 H364 H363 H362 H361 H360 H359 H358 H357 H356 H355 H72 H73 H74 H75 H76 H77 H78 H79 H80 H81 H82 H83 H84 H85 H86 H87 H88 H89 H90 H91 H92 H93 H94 H95 H96 H97 H98 H99 H100 H101 H102 H103 H104 H105 H106 H107 H419 H420 H421 H422 H423 H424 H425 H426 H427 H428 H429 H430 H431 H432 H433 H434 H435 H436 H437 H438 H439 H440 H441 H442 H443 H444 H445 H446 H447 H448 H449 H450 H451 H452 H453 H454 H455 H456 H457 H458 H459 H460 H461 H462 H463 H464 H465 H466 H467 H468 H469 H470 H471 H472 H473 H474 H475 H476 H477 H478 H479 H480 H481 H482 H483 H484 H485 H486 H487 H488
Anc4	Sp18(9)	330	I1 I2 I3 I4 I5 I6 I7 I8 I9 I10 I11 I12 I13 I14 I15 I16 I17 I18 I19 I20 I21 I22 I23 I24 I25 I26 I27 I28 I29 I30 I31 I32 I33 I34 I35 I36 I37 I38 I39 I40 I41 I42 I43 I44 I45 I46 I47 I48 I49 I50 I51 I52 I53 I54 I55 I56 I57 I58 I59 I60 I61 I62 I63 I64 I65 I66 I67 I68 I69 I70 I71 I72 I73 I74 I75 I76 I77 I78 I79 I80 I81 I82 I83 I84 I85 I86 I87 I88 I89 I90 I91 I92 I93 I94 I95 I96 I97 I98 I99 I100 I101 I102 I103 I104 I105 I106 I107 I108 I109 I110 I111 I112 I113 I114 I115 I116 I117 I118 I119 I120 I121 I122 I123 I124 I125 I126 I127 I128 I129 I130 I131 I132 I133 I134 I135 I136 I137 I138 I139 I140 I141 I142 I143 I144 I145 I146 I147 I148 I149 I150 I151 I152 I153 I154 I155 I156 I157 I158 I159 I160 I161 I162 I163 I164 I165 I166 I167 I168 I169 I170 I171 I172 I173 I174 I175 I176 I177 I178 I179 I180 I181 I182 I183 I184 I185 I186 I187 I188 I189 I190 I191 I192 I193 I194 I195 I196 I197 I198 I199 I200 I201 I202 I203 I204 I205 I206 I207 I208 I209 I210 I211 I212 I213 I214 I215 I216 I217 I218 I219 I220 I221 I222 I223 I224 I225 I226 I227 I228 I229 I230 I231 I232 I233 I234 I235 I236 I237 I238 I239 I240 I241 I242 I243 I244 I245 I246 I247 I248 I249 I250 I251 I252 I253 I254 I255 I256 I257 I258 I259 I260 I261 I262 I263 I264 I265 I266 I267 I268 I269 I270 I271 I272 I273 I274 I275 I276 I277 I278 I279 I280 I281 I282 I283 I284 I285 I286 I287 I288 I289 I290 I291 I292 I293 I294 I295 I296 I297 I298 I299 I300 I301 I302 I303 I304 I305 I306 I307 I308 I309 I310 I311 I312 I313 I314 I315 I316 I317 I318 I319 I320 I321 I322 I323 I324 I325 I326 I327 I328 I329 I330
Anc4	Sp10(4)	982	E1 E2 E3 E4 E5 E6 E7 E8 E9 E10 E11 E12 E13 E14 E15 E16 E17 E18 E19 E20 E21 E22 E23 E24 E25 E26 E27 E28 E29 E30 E31 E32 E33 E34 E35 E36 E37 E38 E39 E40 E41 E42 E43 E44 E45 E46 E47 E48 E49 E50 E51 E52 E53 E54 E55 E56 E57 E58 E59 E60 E61 E62 E63 E64 E65 E66 E67 E68 E69 E70 E71 E72 E73 E74 E75 E76 E77 E78 E79 E80 E81 E82 E83 E84 E85 E86 E87 E88 E89 E90 E91 E92 E93 E94 E95 E96 E97 E98 E99 E100 E101 E102 E103 E104 E105 E106 E107 E108 E109 E110 E111 E112 E113 E114 E115 E116 E117 E118 E119 E120 E121 E122 E123 E124 E125 E126 E127 E128 E129 E130 E131 E132 E133 E134 E135 E136 E137 E138 E139 E140 E141 E142 E143 E144 E145 E146 E147 E148 E149 E150 E151 E152 E153 E154 E155 E156 E157 E158 E159 E160 E161 E162 E632 E631 E630 E629 E628 E627 E626 E625 E624 E623 E622 E621 E620 E619 E618 E617 E616 E615 E614 E613 E612 E611 E610 E609 E608 E607 E606 E605 E604 E603 E602 E601 E600 E599 E598 E597 E596 E595 E594 E593 E592 E591 E590 E589 E588 E587 E586 E585 E584 E583 E582 E581 E580 E579 E578 E577 E576 E575 E574 E573 E572 E571 E570 E569 E568 E567 E566 E565 E564 E563 E562 E561 E560 E559 E558 E557 E556 E555 E554 E553 E552 E551 E550 E549 E548 E547 E546 E545 E544 E543 E542 E541 E540 E539 E538 E537 E536 E535 E534 E533 E532 E531 E530 E529 E528 E527 E526 E525 E524 E523 E522 E521 E520 E519 E518 E517 E516 E515 E514 E513 E512 E511 E510 E509 E508 E507 E506 E505 E504 E503 E502 E501 E500 E499 E498 E497 E496 E495 E494 E493 E492 E491 E490 E489 E488 E487 E486 E485 E484 E483 E482 E481 E480 E479 E478 E477 E476 E475 E474 E473 E472 E471 E470 E469 E468 E467 E466 E465 E464 E463 E462 E461 E460 E459 E458 E457 E456 E455 E454 E453 E452 E451 E450 E449 E448 E447 E446 E445 E444 E443 E442 E441 E440 E439 E438 E437 E436 E435 E434 E433 E432 E431 E430 E429 E428 E427 E426 E425 E424 E423 E422 E421 E420 E419 E418 E417 E416 E415 E414 E413 E412 E411 E410 E409 E408 E407 E406 E405 E404 E403 E402 E401 E400 E399 E398 E397 E396 E395 E394 E393 E392 E391 E390 E389 E388 E387 E386 E385 E384 E383 E382 E381 E380 E379 E378 E377 E376 E375 E374 E373 E372 E371 E370 E369 E368 E367 E366 E365 E364 E363 E362 E361 E360 E359 E358 E357 E356 E355 E354 E353 E352 E351 E350 E349 E348 E347 E346 E345 E344 E343 E342 E341 E340 E339 E338 E337 E336 E335 E334 E333 E332 E331 E330 E329 E328 E327 E326 E325 E324 E323 E322 E321 E320 E319 E318 E317 E316 E315 E314 E313 E312 E311 E310 E309 E308 E307 E306 E305 E304 E303 E302 E301 E300 E299 E298 E297 E296 E295 E294 E293 E292 E291 E290 E289 E288 E287 E286 E285 E284 E283 E282 E281 E280 E279 E278 E277 E276 E275 E274 E273 E272 E271 E270 E269 E268 E267 E266 E265 E264 E263 E262 E261 E260 E259 E258 E257 E256 E255 E254 E253 E252 E251 E250 E249 E248 E247 E246 E245 E244 E243 E242 E241 E240 E239 E238 E237 E236 E235 E234 E233 E232 E231 E230 E229 E228 E227 E226 E225 E224 E223 E222 E221 E220 E219 E218 E217 E216 E215 E214 E213 E212 E211 E210 E209 E208 E207 E206 E205 E204 E203 E202 E201 E200 E199 E198 E197 E196 E195 E194 E193 E192 E191 E190 E189 E188 E187 E186 E185 E184 E183 E182 E181 E180 E179 E178 E177 E176 E175 E174 E173 E172 E171 E170 E169 E168 E167 E166 E165 E164 E163 E633 E634 E635 E636 E637 E638 E639 E640 E641 E642 E643 E644 E645 E646 E647 E648 E649 E650 E651 E652 E653 E654 E655 E656 E657 E658 E659 E660 E661 E662 E663 E664 E665 E666 E667 E668 E669 E670 E671 E672 E673 E674 E675 E676 E677 E678 E679 E680 E681 E682 E683 E684 E685 E686 E687 E688 E689 E690 E691 E692 E693 E694 E695 E696 E697 E698 E699 E700 E701 E702 E703 E704 E705 E706 E707 E708 E709 E710 E711 E712 E713 E714 E715 E716 E717 E718 E719 E720 E721 E722 E723 E724 E725 E726 E727 E728 E729 E730 E731 E732 E733 E734 E735 E736 E737 E738 E739 E740 E741 E742 E743 E744 E745 E746 E747 E748 E749 E750 E751 E752 E753 E754 E755 E756 E757 E758 E759 E760 E761 E762 E763 E764 E765 E766 E767 E768 E769 E770 E771 E772 E773 E774 E775 E776 E777 E778 E779 E780 E781 E782 E783 E784 E785 E786 E787 E788 E789 E790 E791 E792 E793 E794 E795 E796 E797 E798 E799 E800 E801 E802 E803 E804 E805 E806 E807 E808 E809 E810 E811 E812 E813 E814 E815 E816 E817 E818 E819 E820 E821 E822 E823 E824 E825 E826 E827 E828 E829 E830 E831 E832 E833 E834 E835 E836 E837 E838 E839 E840 E841 E842 E843 E844 E845 E846 E847 E848 E849 E850 E851 E852 E853 E854 E855 E856 E857 E858 E859 E860 E861 E862 E863 E864 E865 E866 E867 E868 E869 E870 E871 E872 E873 E874 E875 E876 E877 E878 E879 E880 E881 E882 E883 E884 E885 E886 E887 E888 E889 E890 E891 E892 E893 E894 E895 E896 E897 E898 E899 E900 E901 E902 E903 E904 E905 E906 E907 E908 E909 E910 E911 E912 E913 E914 E915 E916 E917 E918 E919 E920 E921 E922 E923 E924 E925 E926 E927 E928 E929 E930 E931 E932 E933 E934 E935 E936 E937 E938 E939 E940 E941 E942 E943 E944 E945 E946 E947 E948 E949 E950 E951 E952 E953 E954 E955 E956 E957 E958 E959 E960 E961 E962 E963 E964 E965 E966 E967 E968 E969 E970 E971 E972 E973 E974 E975 E976 E977 E978 E979 E980 E981 E982
Anc4	Sp19(9)	396	J1 J2 J3 J4 J5 J6 J7 J8 J9 J10 J11 J12 J13 J14 J15 J16 J17 J18 J19 J20 J21 J22 J23 J24 J25 J26 J27 J28 J29 J30 J31 J32 J33 J34 J35 J36 J37 J38 J39 J40 J41 J42 J43 J44 J45 J46 J47 J48 J49 J50 J51 J52 J53 J54 J55 J56 J57 J58 J59 J60 J61 J62 J63 J64 J65 J66 J67 J68 J69 J70 J71 J72 J73 J74 J75 J76 J77 J78 J79 J80 J81 J82 J83 J84 J85 J86 J87 J88 J89 J90 J91 J92 J93 J94 J95 J96 J97 J98 J99 J100 J101 J102 J103 J104 J105 J106 J107 J108 J109 J110 J111 J112 J113 J114 J115 J116 J117 J118 J119 J120 J121 J122 J123 J124 J125 J126 J127 J128 J129 J130 J131 J132 J133 J134 J135 J136 J137 J138 J139 J140 J141 J142 J143 J144 J145 J146 J147 J148 J149 J150 J151 J152 J153 J154 J155 J156 J157 J158 J159 J160 J161 J162 J163 J164 J165 J166 J167 J168 J169 J170 J171 J172 J173 J174 J175 J176 J177 J178 J179 J180 J181 J182 J183 J184 J185 J186 J187 J188 J189 J190 J191 J192 J193 J194 J195 J196 J197 J198 J199 J200 J201 J202 J203 J204 J205 J206 J207 J208 J209 J210 J211 J212 J213 J214 J215 J216 J217 J218 J219 J220 J221 J222 J223 J224 J225 J226 J227 J228 J229 J230 J231 J232 J233 J234 J235 J236 J237 J238 J239 J240 J241 J242 J243 J244 J245 J246 J247 J248 J249 J250 J251 J252 J253 J254 J255 J256 J257 J258 J259 J260 J261 J262 J263 J264 J265 J266 J267 J268 J269 J270 J271 J272 J273 J274 J275 J276 J277 J278 J279 J280 J281 J282 J283 J284 J285 J286 J287 J288 J289 J290 J291 J292 J293 J294 J295 J296 J297 J298 J299 J300 J301 J302 J303 J304 J305 J306 J307 J308 J309 J310 J311 J312 J313 J314 J315 J316 J317 J318 J319 J320 J321 J322 J323 J324 J325 J326 J327 J328 J329 J330 J331 J332 J333 J334 J335 J336 J337 J338 J339 J340 J341 J342 J343 J344 J345 J346 J347 J348 J349 J350 J351 J352 J353 J354 J355 J356 J357 J358 J359 J360 J361 J362 J363 J364 J365 J366 J367 J368 J369 J370 J371 J372 J373 J374 J375 J376 J377 J378 J379 J380 J381 J382 J383 J384 J385 J386 J387 J388 J389 J390 J391 J392 J393 J394 J395 J396
Anc2	Sp7(1)	518	A1 A2 A3 A4 A5 A6 A7 A8 A9 A10 A11 A12 A13 A14 A15 A16 A17 A18 A19 A20 A21 A22 A23 A24 A25 A26 A27 A28 A29 A30 A31 A32 A33 A34 A35 A36 A37 A38 A39 A40 A41 A42 A43 A44 A45 A46 A47 A48 A49 A50 A51 A52 A53 A54 A55 A56 A57 A58 A59 A60 A61 A62 A63 A64 A65 A66 A67 A68 A69 A70 A71 A72 A73 A74 A75 A76 A77 A78 A79 A80 A81 A82 A83 A84 A85 A86 A87 A88 A89 A90 A91 A92 A93 A94 A95 A96 A97 A98 A99 A100 A101 A102 A103 A104 A105 A106 A107 A108 A109 A110 A111 A112 A113 A114 A115 A116 A117 A118 A119 A120 A121 A122 A123 A124 A125 A126 A127 A128 A129 A130 A131 A132 A133 A134 A135 A136 A137 A138 A139 A140 A141 A142 A143 A144 A145 A146 A147 A148 A149 A150 A151 A152 A153 A154 A155 A156 A157 A158 A159 A160 A161 A162 A163 A164 A165 A166 A167 A168 A169 A170 A171 A172 A173 A174 A175 A176 A177 A178 A179 A180 A181 A182 A183 A184 A185 A186 A187 A188 A189 A190 A191 A192 A193 A194 A195 A196 A197 A198 A199 A200 A201 A202 A203 A204 A205 A206 A207 A208 A209 A210 A211 A212 A213 A214 A215 A216 A217 A218 A219 A220 A221 A222 A223 A224 A225 A226 A227 A228 A229 A230 A231 A232 A233 A234 A235 A236 A237 A238 A239 A240 A241 A242 A243 A244 A245 A246 A247 A248 A249 A250 A251 A252 A253 A254 A255 A256 A257 A258 A259 A260 A261 A262 A263 A264 A265 A266 A267 A268 A269 A270 A271 A272 A273 A274 A275 A276 A277 A278 A279 A280 A281 A282 A283 A284 A285 A286 A287 A288 A289 A290 A291 A292 A293 A294 A295 A296 A297 A298 A299 A300 A301 A302 A303 A304 A305 A306 A307 A308 A309 A310 A311 A312 A313 A314 A315 A316 A317 A318 A319 A320 A321 A322 A323 A324 A325 A326 A327 A328 A329 A330 A331 A332 A333 A334 A335 A336 A337 A338 A339 A340 A341 A342 A343 A344 A345 A346 A347 A348 A349 A350 A351 A352 A353 A354 A355 A356 A357 A358 A359 A360 A361 A362 A363 A364 A365 A366 A367 A368 A369 A370 A371 A372 A373 A374 A375 A376 A377 A378 A379 A380 A381 A382 A383 A384 A385 A386 A387 A388 A389 A390 A391 A392 A393 A394 A395 A396 A397 A398 A399 A400 A401 A402 A403 A404 A405 A406 A407 A408 A409 A410 A411 A412 A413 A414 A415 A416 A417 A418 A419 A420 A421 A422 A423 A424 A425 A426 A427 A428 A429 A430 A431 A432 A433 A434 A435 A436 A437 A438 A439 A440 A441 A442 A443 A444 A445 A446 A447 A448 A449 A450 A451 A452 A453 A454 A455 A456 A457 A458 A459 A460 A461 A462 A463 A464 A465 A466 A467 A468 A469 A470 A471 A472 A473 A474 A475 A476 A477 A478 A479 A480 A481 A482 A483 A484 A485 A486 A487 A488 A489 A490 A491 A492 A493 A494 A495 A496 A497 A498 A499 A500 A501 A502 A503 A504 A505 A506 A507 A508 A509 A510 A511 A512 A513 A514 A515 A516 A517 A518
Anc2	Sp6(5)	330	L1 L2 L3 L4 L5 L6 L7 L8 L9 L10 L11 L12 L13 L14 L15 L16 L17 L18 L19 L20 L21 L22 L23 L24 L25 L26 L27 L28 L29 L30 L31 L32 L33 L34 L35 L36 L37 L38 L39 L40 L41 L42 L43 L44 L45 L46 L47 L48 L49 L50 L51 L52 L53 L54 L55 L56 L57 L58 L59 L60 L61 L62 L63 L64 L65 L66 L67 L68 L69 L70 L71 L72 L73 L74 L75 L76 L77 L78 L79 L80 L81 L82 L83 L84 L85 L86 L87 L88 L89 L90 L91 L92 L93 L94 L95 L96 L97 L98 L99 L100 L101 L102 L103 L104 L105 L106 L107 L108 L109 L110 L111 L112 L113 L114 L115 L116 L117 L118 L119 L120 L121 L122 L123 L124 L125 L126 L127 L128 L129 L130 L131 L132 L133 L134 L135 L136 L137 L138 L139 L140 L141 L142 L143 L144 L145 L146 L147 L148 L149 L150 L151 L152 L153 L154 L155 L156 L157 L158 L159 L160 L161 L162 L163 L164 L165 L166 L167 L168 L169 L170 L171 L172 L173 L174 L175 L176 L177 L178 L179 L180 L181 L182 L183 L184 L185 L186 L187 L188 L189 L190 L191 L192 L193 L194 L195 L196 L197 L198 L199 L200 L201 L202 L203 L204 L205 L206 L207 L208 L209 L210 L211 L212 L213 L214 L215 L216 L217 L218 L219 L220 L221 L222 L223 L224 L225 L226 L227 L228 L229 L230 L231 L232 L233 L234 L235 L236 L237 L238 L239 L240 L241 L242 L243 L244 L245 L246 L247 L248 L249 L250 L251 L252 L253 L254 L255 L256 L257 L258 L259 L260 L261 L262 L263 L264 L265 L266 L267 L268 L269 L270 L271 L272 L273 L274 L275 L276 L277 L278 L279 L280 L281 L282 L283 L284 L285 L286 L287 L288 L289 L290 L291 L292 L293 L294 L295 L296 L297 L298 L299 L300 L301 L302 L303 L304 L305 L306 L307 L308 L309 L310 L311 L312 L313 L314 L315 L316 L317 L318 L319 L320 L321 L322 L323 L324 L325 L326 L327 L328 L329 L330
Anc2	Sp18(2)	632	B1 B2 B3 B4 B5 B6 B7 B8 B9 B10 B11 B12 B13 B14 B15 B16 B17 B18 B19 B20 B21 B22 B23 B24 B25 B26 B27 B28 B29 B30 B31 B32 B33 B34 B35 B36 B37 B38 B39 B40 B41 B42 B43 B44 B45 B46 B47 B48 B49 B50 B51 B52 B53 B54 B55 B56 B57 B58 B59 B60 B61 B62 B63 B64 B65 B66 B67 B68 B69 B70 B71 B72 B73 B74 B75 B76 B77 B78 B79 B80 B81 B82 B83 B84 B85 B86 B87 B88 B89 B90 B91 B92 B93 B94 B95 B96 B97 B98 B99 B100 B101 B102 B103 B104 B105 B106 B107 B108 B109 B110 B111 B112 B113 B114 B115 B116 B117 B118 B119 B120 B121 B122 B123 B124 B125 B126 B127 B128 B129 B130 B131 B132 B133 B134 B135 B136 B137 B138 B139 B140 B141 B142 B143 B144 B145 B146 B147 B148 B149 B150 B151 B152 B153 B154 B155 B156 B157 B158 B159 B160 B161 B162 B163 B164 B165 B166 B167 B168 B169 B170 B171 B172 B173 B174 B175 B176 B177 B178 B179 B180 B181 B182 B183 B184 B185 B186 B187 B188 B189 B190 B191 B192 B193 B194 B195 B196 B197 B198 B199 B200 B201 B202 B203 B204 B205 B206 B207 B208 B209 B210 B211 B212 B213 B214 B215 B216 B217 B218 B219 B220 B221 B222 B223 B224 B225 B226 B227 B228 B229 B230 B231 B232 B233 B234 B235 B236 B237 B238 B239 B240 B241 B242 B243 B244 B245 B246 B247 B248 B249 B250 B251 B252 B253 B254 B255 B256 B257 B258 B259 B260 B261 B262 B263 B264 B265 B266 B267 B268 B269 B270 B271 B272 B273 B274 B275 B276 B277 B278 B279 B280 B281 B282 B283 B284 B285 B286 B287 B288 B289 B290 B291 B292 B293 B294 B295 B296 B297 B298 B299 B300 B301 B302 B303 B304 B305 B306 B307 B308 B309 B310 B311 B312 B313 B314 B315 B316 B317 B318 B319 B320 B321 B322 B323 B324 B325 B326 B327 B328 B329 B330 B331 B332 B333 B334 B335 B336 B337 B338 B339 B340 B341 B342 B343 B344 B345 B346 B347 B348 B349 B350 B351 B352 B353 B354 B355 B356 B357 B358 B359 B360 B361 B362 B363 B364 B365 B366 B367 B368 B369 B370 B371 B372 B373 B374 B375 B376 B377 B378 B379 B380 B381 B382 B383 B384 B385 B386 B387 B388 B389 B390 B391 B392 B393 B394 B395 B396 B397 B398 B399 B400 B401 B402 B403 B404 B405 B406 B407 B408 B409 B410 B411 B412 B413 B414 B415 B416 B417 B418 B419 B420 B421 B422 B423 B424 B425 B426 B427 B428 B429 B430 B431 B432 B433 B434 B435 B436 B437 B438 B439 B440 B441 B442 B443 B444 B445 B446 B447 B448 B449 B450 B451 B452 B453 B454 B455 B456 B457 B458 B459 B460 B461 B462 B463 B464 B465 B466 B467 B468 B469 B470 B471 B472 B473 B474 B475 B476 B477 B478 B479 B480 B481 B482 B483 B484 B485 B486 B487 B488 B489 B490 B491 B492 B493 B494 B495 B496 B497 B498 B499 B500 B501 B502 B503 B504 B505 B506 B507 B508 B509 B510 B511 B512 B513 B514 B515 B516 B517 B518 B519 B520 B521 B522 B523 B524 B525 B526 B527 B528 B529 B530 B531 B532 B533 B534 B535 B536 B537 B538 B539 B540 B541 B542 B543 B544 B545 B546 B547 B548 B549 B550 B551 B552 B553 B554 B555 B556 B557 B558 B559 B560 B561 B562 B563 B564 B565 B566 B567 B568 B569 B570 B571 B572 B573 B574 B575 B576 B577 B578 B579 B580 B581 B582 B583 B584 B585 B586 B587 B588 B589 B590 B591 B592 B593 B594 B595 B596 B597 B598 B599 B600 B601 B602 B603 B604 B605 B606 B607 B608 B609 B610 B611 B612 B613 B614 B615 B616 B617 B618 B619 B620 B621 B622 B623 B624 B625 B626 B627 B628 B629 B630 B631 B632
Anc2	Sp16(3)	873	C1 C2 C3 C4 C5 C6 C7 C8 C9 C10 C11 C12 C13 C14 C15 C16 C17 C18 C19 C20 C21 C22 C23 C24 C25 C26 C27 C28 C29 C30 C31 C32 C33 C34 C35 C36 C37 C38 C39 C40 C41 C42 C43 C44 C45 C46 C47 C48 C49 C50 C51 C52 C53 C54 C55 C56 C57 C58 C59 C60 C61 C62 C63 C64 C65 C66 C67 C68 C69 C70 C71 C72 C73 C74 C75 C76 C77 C78 C79 C80 C81 C82 C83 C84 C85 C86 C87 C88 C89 C90 C91 C92 C93 C94 C95 C96 C97 C98 C99 C100 C101 C102 C103 C104 C105 C106 C107 C108 C109 C110 C111 C112 C113 C114 C115 C116 C117 C118 C119 C120 C121 C122 C123 C124 C125 C126 C127 C128 C129 C130 C131 C132 C133 C134 C135 C136 C137 C138 C139 C140 C141 C142 C143 C144 C145 C146 C147 C148 C149 C150 C151 C152 C153 C154 C155 C156 C157 C158 C159 C160 C161 C162 C163 C164 C165 C166 C167 C168 C169 C170 C171 C172 C173 C174 C175 C176 C177 C178 C179 C180 C181 C182 C183 C184 C185 C186 C187 C188 C189 C190 C191 C192 C193 C194 C195 C196 C197 C198 C199 C200 C201 C202 C203 C204 C205 C206 C207 C208 C209 C210 C211 C212 C213 C214 C215 C216 C217 C218 C219 C220 C221 C222 C223 C224 C225 C226 C227 C228 C229 C230 C231 C232 C233 C234 C235 C236 C237 C238 C239 C240 C241 C242 C243 C244 C245 C246 C247 C248 C249 C250 C251 C252 C253 C254 C255 C256 C257 C258 C259 C260 C261 C262 C263 C264 C265 C266 C267 C268 C269 C270 C271 C272 C273 C274 C275 C276 C277 C278 C279 C280 C281 C282 C283 C284 C285 C286 C287 C288 C289 C290 C291 C292 C293 C294 C295 C296 C297 C298 C299 C300 C301 C302 C303 C304 C305 C306 C307 C308 C309 C310 C311 C312 C313 C314 C315 C316 C317 C318 C319 C320 C321 C322 C323 C324 C325 C326 C327 C328 C329 C330 C331 C332 C333 C334 C335 C336 C337 C338 C339 C340 C341 C342 C343 C344 C345 C346 C347 C348 C349 C350 C351 C352 C353 C354 C355 C356 C357 C358 C359 C360 C361 C362 C363 C364 C365 C366 C367 C368 C369 C370 C371 C372 C373 C374 C375 C376 C377 C378 C379 C380 C381 C382 C383 C384 C385 C386 C387 C388 C389 C390 C391 C392 C393 C394 C395 C396 C397 C398 C399 C400 C401 C402 C403 C404 C405 C406 C407 C408 C409 C410 C411 C412 C413 C414 C415 C416 C417 C418 C419 C420 C421 C422 C423 C424 C425 C426 C427 C428 C429 C430 C431 C432 C433 C434 C435 C436 C437 C438 C439 C440 C441 C442 C443 C444 C445 C446 C447 C448 C449 C450 C451 C452 C453 C454 C455 C456 C457 C458 C459 C460 C461 C462 C463 C464 C465 C466 C467 C468 C469 C470 C471 C472 C473 C474 C475 C476 C477 C478 C479 C480 C481 C482 C483 C484 C485 C486 C487 C488 C489 C490 C491 C492 C493 C494 C495 C496 C497 C498 C499 C500 C501 C502 C503 C504 C505 C506 C507 C508 C509 C510 C511 C512 C513 C514 C515 C516 C517 C518 C519 C520 C521 C522 C523 C524 C525 C526 C527 C528 C529 C530 C531 C532 C533 C534 C535 C536 C537 C538 C539 C540 C541 C542 C543 C544 C545 C546 C547 C548 C549 C550 C551 C552 C553 C554 C555 C556 C557 C558 C559 C560 C561 C562 C563 C564 C565 C566 C567 C568 C569 C570 C571 C572 C573 C574 C575 C576 C577 C578 C579 C580 C581 C582 C583 C584 C585 C586 C587 C588 C589 C590 C591 C592 C593 C594 C595 C596 C597 C598 C599 C600 C601 C602 C603 C604 C605 C606 C607 C608 C609 C610 C611 C612 C613 C614 C615 C616 C617 C618 C619 C620 C621 C622 C623 C624 C625 C626 C627 C628 C629 C630 C631 C632 C633 C634 C635 C636 C637 C638 C639 C640 C641 C642 C643 C644 C645 C646 C647 C648 C649 C650 C651 C652 C653 C654 F1 F2 F3 F4 F5 F6 F7 F8 F9 F10 F11 F12 F13 F14 F15 F16 F17 F18 F19 F20 F21 F22 F23 F24 F25 F26 F27 F28 F29 F30 F31 F32 F33 F34 F35 F36 F37 F38 F39 F40 F41 F42 F43 F44 F45 F46 F47 F48 F49 F50 F51 F52 F53 F54 F55 F56 F57 F58 F59 F60 F61 F62 F63 F64 F65 F66 F67 F68 F69 F70 F71 F72 F73 F74 F75 F76 F77 F78 F79 F80 F81 F82 F83 F84 F85 F86 F87 F88 F89 F90 F91 F92 F93 F94 F95 F96 F97 F98 F99 F100 F101 F102 F103 F104 F105 F106 F107 F108 F109 F110 F111 F112 F113 F114 F115 F116 F117 F118 F119 F120 F121 F122 F123 F124 F125 F126 F127 F128 F129 F130 F131 F132 F133 F134 F135 F136 F137 F138 F139 F140 F141 F142 F143 F144 F145 F146 F147 F148 F149 F150 F151 F152 F153 F154 F155 F156 F157 F158 F159 F160 F161 F162 F163 F164 F165 F166 F167 F168 F169 F170 F171 F172 F173 F174 F175 F176 F177 F178 F179 F180 F181 F182 F183 F184 F185 F186 F187 F188 F189 F190 F191 F192 F193 F194 F195 F196 F197 F198 F199 F200 F201 F202 F203 F204 F205 F206 F207 F208 F209 F210 F211 F212 F213 F214 F215 F216 F217 F218 F219
Anc2	Sp1(7)	280	G1 G2 G49 G48 G47 G46 G45 G44 G43 G42 G41 G40 G39 G38 G37 G36 G35 G34 G33 G32 G31 G30 G29 G28 G27 G26 G25 G24 G23 G22 G21 G20 G19 G18 G17 G16 G15 G14 G13 G12 G11 G10 G9 G8 G7 G6 G5 G4 G3 G50 G51 G52 G53 G54 G55 G56 G57 G58 G59 G60 G61 G62 G63 G64 G65 G66 G67 G68 G69 G70 G71 G72 G73 G74 G75 G76 G77 G78 G79 G80 G81 G82 G83 G84 G85 G86 G87 G88 G89 G90 G91 G92 G93 G94 G95 G96 G97 G98 G99 G100 G101 G102 G103 G104 G105 G106 G107 G108 G109 G110 G111 G112 G113 G114 G115 G116 G117 G118 G119 G120 G121 G122 G123 G124 G125 G126 G127 G128 G129 G130 G131 G132 G133 G134 G135 G136 G137 G138 G139 G140 G141 G142 G143 G144 G145 G146 G147 G148 G149 G150 G151 G152 G153 G154 G155 G156 G157 G158 G159 G160 G161 G162 G163 G164 G165 G166 G167 G168 G169 G170 G171 G172 G173 G174 G175 G176 G177 G178 G179 G180 G181 G182 G183 G184 G185 G186 G187 G188 G189 G190 G191 G192 G193 G194 G195 G196 G197 G198 G199 G200 G201 G202 G203 G204 G205 G206 G207 G208 G209 G210 G211 G212 G213 G214 G215 G216 G217 G218 G219 G220 G221 G222 G223 G224 G225 G226 G227 G228 G229 G230 G231 G232 G233 G234 G235 G236 G237 G238 G239 G240 G241 G242 G243 G244 G245 G246 G247 G248 G249 G250 G251 G252 G253 G254 G255 G256 G257 G258 G259 G260 G261 G262 G263 G264 G265 G266 G267 G268 G269 G270 G271 G272 G273 G274 G275 G276 G277 G278 G279 G280
