Node	ChrID	GenesCount	Genes
Anc7	Sp7(7)	1148	D1 D2 D3 D4 D5 D6 D7 D8 D9 D10 D11 D12 D13 D14 D15 D16 D17 D18 D19 D20 D21 D22 D23 D24 D25 D26 D27 D28 D29 D30 D31 D32 D33 D34 D35 D36 D37 D38 D39 D40 D41 D42 D43 D44 D45 D46 D47 D48 D49 D50 D51 D52 D53 D54 D55 D56 D57 D58 D59 D60 D61 D62 D63 D64 D65 D66 D67 D68 D69 D70 D71 D72 D73 D74 D75 D76 D77 D78 D79 D80 D81 D82 D83 D84 D85 D86 D87 D88 D89 D90 D91 D92 D93 D94 D95 D96 D97 D98 D99 D100 D101 D102 D103 D104 D105 D106 D107 D108 D109 D110 D111 D112 D113 D114 D115 D116 D117 D118 D119 D120 D121 D122 D123 D124 D125 D126 D127 D128 D129 D130 D131 D132 D133 D134 D135 D136 D137 D138 D139 D140 D141 D142 D143 D144 D145 D146 D147 D148 D149 D150 D151 D152 D153 D154 D155 D156 D157 D158 D159 D160 D161 D162 D163 D164 D165 D166 D167 D168 D169 D170 D171 D172 D173 D174 D175 D176 D177 D178 D179 D180 D181 D182 D183 D184 D185 D186 D187 D188 D189 D190 D191 D192 D193 D194 D195 D196 D197 D198 D199 D200 D201 D202 D203 D204 D205 D206 D207 D208 D209 D210 D211 D212 D213 D214 D215 D216 D217 D218 D219 D220 D221 D222 D223 D224 D225 D226 D227 D228 D229 D230 D231 D232 D233 D234 D235 D236 D237 D238 D239 D240 D241 D242 D243 D244 D245 D246 D247 D248 D249 D250 D251 D252 D253 D254 D255 D256 D257 D258 D259 D260 D261 D262 D263 D264 D265 D266 D267 D268 D269 D270 D271 D272 D273 D274 D275 D276 D277 D278 D279 D280 D281 D282 D283 D284 D285 D286 D287 D288 D289 D290 D291 D292 D293 D294 D295 D296 D297 D298 D299 D300 D301 D302 D303 D304 D305 D306 D307 D308 D309 D310 D311 D312 D313 D314 D315 D316 D317 D318 D319 D320 D321 D322 D323 D324 D325 D326 D327 D328 D329 D330 D331 D332 D333 D334 D335 D336 D337 D338 D339 D340 D341 D342 D343 D344 D345 D346 D347 D348 D349 D350 D351 D352 D353 I1 I2 I3 I4 I5 I6 I7 I8 I9 I10 I11 I12 I13 I14 I15 I16 I17 I18 I19 I20 I21 I22 I23 I24 I25 I26 I27 I28 I29 I30 I31 I32 I33 I34 I35 I36 I37 I38 I39 I40 I41 I42 I43 I44 I45 I46 I47 I48 I49 I50 I51 I52 I53 I54 I55 I56 I57 I58 I59 I60 I61 I62 I63 I64 I65 I66 I67 I68 I69 I70 I71 I72 I73 I74 I75 I76 I77 I78 I79 I80 I81 I82 I83 I84 I85 I86 I87 I88 I89 I90 I91 I92 I93 I94 I95 I96 I97 I98 I99 I100 I101 I102 I103 I104 I105 I106 I107 I108 I109 I110 I111 I112 I113 I114 I115 I116 I117 I118 I119 I120 I121 I122 I123 I124 I125 I126 I127 I128 I129 I130 I131 I132 I133 I134 I135 I136 I137 I138 I139 I140 I141 I142 I143 I144 I145 I146 I147 I148 I149 I150 I151 I152 I153 I154 I155 I156 I157 I158 I159 I160 I161 I162 I163 I164 I165 I166 I167 I168 I169 I170 I171 I172 I173 I174 I175 I176 I177 I178 I179 I180 I181 I182 I183 I184 I185 I186 I187 I188 I189 I190 I191 I192 I193 I194 I195 I196 I197 I198 I199 I200 I201 I202 I203 I204 I205 I206 I207 I208 I209 I210 I211 I212 I213 I214 I215 I216 I217 I218 I219 I220 I221 I222 I223 I224 I225 I226 I227 I228 I229 I230 I231 I232 I233 I234 I235 I236 I237 I238 I239 I240 I241 I242 I243 I244 I245 I246 I247 I248 I249 I250 I251 I252 I253 I254 I255 I256 I257 I258 I259 I260 I261 I262 I263 I264 I265 I266 I267 I268 I269 I270 I271 I272 I273 I274 I275 I276 I277 I278 I279 I280 I281 I282 I283 I284 I285 I286 I287 I288 I289 I290 I291 I292 I293 I294 I295 I296 I297 I298 I299 I300 I301 I302 I303 I304 I305 I306 I307 I308 I309 I310 I311 I312 I313 I314 I315 I316 I317 I318 I319 I320 I321 I322 I323 I324 I325 I326 I327 I328 I329 I330 D354 D355 D356 D357 D358 D359 D360 D361 D362 D363 D364 D365 D366 D367 D368 D369 D370 D371 D372 D373 D374 D375 D376 D377 D378 D379 D380 D381 D382 D383 D384 D385 D386 D387 D388 D389 D390 D391 D392 D393 D394 D395 D396 D397 D398 D399 D400 D401 D402 D403 D404 D405 D406 D407 D408 D409 D410 D411 D412 D413 D414 D415 D416 D417 D418 D419 D420 D421 D422 D423 D424 D425 D426 D427 D428 D429 D430 D431 D432 D433 D434 D435 D436 D437 D438 D439 D440 D441 D442 D443 D444 D445 D446 D447 D448 D449 D450 D451 D452 D453 D454 D455 D456 D457 D458 D459 D460 D461 D462 D463 D464 D465 D466 D467 D468 D469 D470 D471 D472 D473 D474 D475 D476 D477 D478 D479 D480 D481 D482 D483 D484 D485 D486 D487 D488 D489 D490 D491 D492 D493 D494 D495 D496 D497 D498 D499 D500 D501 D502 D503 D504 D505 D506 D507 D508 D509 D510 D511 D512 D513 D514 D515 D516 D517 D518 D519 D520 D521 D522 D523 D524 D525 D526 D527 D528 D529 D530 D531 D532 D533 D534 D535 D536 D537 D538 D539 D540 D541 D542 D543 D544 D545 D546 D547 D548 D549 D550 D551 D552 D553 D554 D555 D556 D557 D558 D559 D560 D561 D562 D563 D564 D565 D566 D567 D568 D569 D570 D571 D572 D573 D574 D575 D576 D577 D578 D579 D580 D581 D582 D583 D584 D585 D586 D587 D588 D589 D590 D591 D592 D593 D594 D595 D596 D597 D598 D599 D600 D601 D602 D603 D604 D605 D606 D607 D608 D609 D610 D611 D612 D613 D614 D615 D616 D617 D618 D619 D620 D621 D622 D623 D624 D625 D626 D627 D628 D629 D630 D631 D632 D633 D634 D635 D636 D637 D638 D639 D640 D641 D642 D643 D644 D645 D646 D647 D648 D649 D650 D651 D652 D653 D654 D655 D656 D657 D658 D659 D660 D661 D662 D663 D664 D665 D666 D667 D668 D669 D670 D671 D672 D673 D674 D675 D676 D677 D678 D679 D680 D681 D682 D683 D684 D685 D686 D687 D688 D689 D690 D691 D692 D693 D694 D695 D696 D697 D698 D699 D700 D701 D702 D703 D704 D705 D706 D707 D708 D709 D710 D711 D712 D713 D714 D715 D716 D717 D718 D719 D720 D721 D722 D723 D724 D725 D726 D727 D728 D729 D730 D731 D732 D733 D734 D735 D736 D737 D738 D739 D740 D741 D742 D743 D744 D745 D746 D747 D748 D749 D750 D751 D752 D753 D754 D755 D756 D757 D758 D759 D760 D761 D762 D763 D764 D765 D766 D767 D768 D769 D770 D771 D772 D773 D774 D775 D776 D777 D778 D779 D780 D781 D782 D783 D784 D785 D786 D787 D788 D789 D790 D791 D792 D793 D794 D795 D796 D797 D798 D799 D800 D801 D802 D803 D804 D805 D806 D807 D808 D809 D810 D811 D812 D813 D814 D815 D816 D817 D818
Anc7	Sp10(4)	982	E1 E2 E3 E4 E5 E6 E7 E8 E9 E10 E11 E12 E13 E14 E15 E16 E17 E18 E19 E20 E21 E22 E23 E24 E25 E26 E27 E28 E29 E30 E31 E32 E33 E34 E35 E36 E37 E38 E39 E40 E41 E42 E43 E44 E45 E46 E47 E48 E49 E50 E51 E52 E53 E54 E55 E56 E57 E58 E59 E60 E61 E62 E63 E64 E65 E66 E67 E68 E69 E70 E71 E72 E73 E74 E75 E76 E77 E78 E79 E80 E81 E82 E83 E84 E85 E86 E87 E88 E89 E90 E91 E92 E93 E94 E95 E96 E97 E98 E99 E100 E101 E102 E103 E104 E105 E106 E107 E108 E109 E110 E111 E112 E113 E114 E115 E116 E117 E118 E119 E120 E121 E122 E123 E124 E125 E126 E127 E128 E129 E130 E131 E132 E133 E134 E135 E136 E137 E138 E139 E140 E141 E142 E143 E144 E145 E146 E147 E148 E149 E150 E151 E152 E153 E154 E155 E156 E157 E158 E159 E160 E161 E162 E632 E631 E630 E629 E628 E627 E626 E625 E624 E623 E622 E621 E620 E619 E618 E617 E616 E615 E614 E613 E612 E611 E610 E609 E608 E607 E606 E605 E604 E603 E602 E601 E600 E599 E598 E597 E596 E595 E594 E593 E592 E591 E590 E589 E588 E587 E586 E585 E584 E583 E582 E581 E580 E579 E578 E577 E576 E575 E574 E573 E572 E571 E570 E569 E568 E567 E566 E565 E564 E563 E562 E561 E560 E559 E558 E557 E556 E555 E554 E553 E552 E551 E550 E549 E548 E547 E546 E545 E544 E543 E542 E541 E540 E539 E538 E537 E536 E535 E534 E533 E532 E531 E530 E529 E528 E527 E526 E525 E524 E523 E522 E521 E520 E519 E518 E517 E516 E515 E514 E513 E512 E511 E510 E509 E508 E507 E506 E505 E504 E503 E502 E501 E500 E499 E498 E497 E496 E495 E494 E493 E492 E491 E490 E489 E488 E487 E486 E485 E484 E483 E482 E481 E480 E479 E478 E477 E476 E475 E474 E473 E472 E471 E470 E469 E468 E467 E466 E465 E464 E463 E462 E461 E460 E459 E458 E457 E456 E455 E454 E453 E452 E451 E450 E449 E448 E447 E446 E445 E444 E443 E442 E441 E440 E439 E438 E437 E436 E435 E434 E433 E432 E431 E430 E429 E428 E427 E426 E425 E424 E423 E422 E421 E420 E419 E418 E417 E416 E415 E414 E413 E412 E411 E410 E409 E408 E407 E406 E405 E404 E403 E402 E401 E400 E399 E398 E397 E396 E395 E394 E393 E392 E391 E390 E389 E388 E387 E386 E385 E384 E383 E382 E381 E380 E379 E378 E377 E376 E375 E374 E373 E372 E371 E370 E369 E368 E367 E366 E365 E364 E363 E362 E361 E360 E359 E358 E357 E356 E355 E354 E353 E352 E351 E350 E349 E348 E347 E346 E345 E344 E343 E342 E341 E340 E339 E338 E337 E336 E335 E334 E333 E332 E331 E330 E329 E328 E327 E326 E325 E324 E323 E322 E321 E320 E319 E318 E317 E316 E315 E314 E313 E312 E311 E310 E309 E308 E307 E306 E305 E304 E303 E302 E301 E300 E299 E298 E297 E296 E295 E294 E293 E292 E291 E290 E289 E288 E287 E286 E285 E284 E283 E282 E281 E280 E279 E278 E277 E276 E275 E274 E273 E272 E271 E270 E269 E268 E267 E266 E265 E264 E263 E262 E261 E260 E259 E258 E257 E256 E255 E254 E253 E252 E251 E250 E249 E248 E247 E246 E245 E244 E243 E242 E241 E240 E239 E238 E237 E236 E235 E234 E233 E232 E231 E230 E229 E228 E227 E226 E225 E224 E223 E222 E221 E220 E219 E218 E217 E216 E215 E214 E213 E212 E211 E210 E209 E208 E207 E206 E205 E204 E203 E202 E201 E200 E199 E198 E197 E196 E195 E194 E193 E192 E191 E190 E189 E188 E187 E186 E185 E184 E183 E182 E181 E180 E179 E178 E177 E176 E175 E174 E173 E172 E171 E170 E169 E168 E167 E166 E165 E164 E163 E633 E634 E635 E636 E637 E638 E639 E640 E641 E642 E643 E644 E645 E646 E647 E648 E649 E650 E651 E652 E653 E654 E655 E656 E657 E658 E659 E660 E661 E662 E663 E664 E665 E666 E667 E668 E669 E670 E671 E672 E673 E674 E675 E676 E677 E678 E679 E680 E681 E682 E683 E684 E685 E686 E687 E688 E689 E690 E691 E692 E693 E694 E695 E696 E697 E698 E699 E700 E701 E702 E703 E704 E705 E706 E707 E708 E709 E710 E711 E712 E713 E714 E715 E716 E717 E718 E719 E720 E721 E722 E723 E724 E725 E726 E727 E728 E729 E730 E731 E732 E733 E734 E735 E736 E737 E738 E739 E740 E741 E742 E743 E744 E745 E746 E747 E748 E749 E750 E751 E752 E753 E754 E755 E756 E757 E758 E759 E760 E761 E762 E763 E764 E765 E766 E767 E768 E769 E770 E771 E772 E773 E774 E775 E776 E777 E778 E779 E780 E781 E782 E783 E784 E785 E786 E787 E788 E789 E790 E791 E792 E793 E794 E795 E796 E797 E798 E799 E800 E801 E802 E803 E804 E805 E806 E807 E808 E809 E810 E811 E812 E813 E814 E815 E816 E817 E818 E819 E820 E821 E822 E823 E824 E825 E826 E827 E828 E829 E830 E831 E832 E833 E834 E835 E836 E837 E838 E839 E840 E841 E842 E843 E844 E845 E846 E847 E848 E849 E850 E851 E852 E853 E854 E855 E856 E857 E858 E859 E860 E861 E862 E863 E864 E865 E866 E867 E868 E869 E870 E871 E872 E873 E874 E875 E876 E877 E878 E879 E880 E881 E882 E883 E884 E885 E886 E887 E888 E889 E890 E891 E892 E893 E894 E895 E896 E897 E898 E899 E900 E901 E902 E903 E904 E905 E906 E907 E908 E909 E910 E911 E912 E913 E914 E915 E916 E917 E918 E919 E920 E921 E922 E923 E924 E925 E926 E927 E928 E929 E930 E931 E932 E933 E934 E935 E936 E937 E938 E939 E940 E941 E942 E943 E944 E945 E946 E947 E948 E949 E950 E951 E952 E953 E954 E955 E956 E957 E958 E959 E960 E961 E962 E963 E964 E965 E966 E967 E968 E969 E970 E971 E972 E973 E974 E975 E976 E977 E978 E979 E980 E981 E982
Anc7	Sp8(6)	219	F1 F2 F3 F4 F5 F6 F7 F8 F9 F10 F11 F12 F13 F14 F15 F16 F17 F18 F19 F20 F21 F22 F23 F24 F25 F26 F27 F28 F29 F30 F31 F32 F33 F34 F35 F36 F37 F38 F39 F40 F41 F42 F43 F44 F45 F46 F47 F48 F49 F50 F144 F143 F142 F141 F140 F139 F138 F137 F136 F135 F134 F133 F132 F131 F130 F129 F128 F127 F126 F125 F124 F123 F122 F121 F120 F119 F118 F117 F116 F115 F114 F113 F112 F111 F110 F109 F108 F107 F106 F105 F104 F103 F102 F101 F100 F99 F98 F97 F96 F95 F94 F93 F92 F91 F90 F89 F88 F87 F86 F85 F84 F83 F82 F81 F80 F79 F78 F77 F76 F75 F74 F73 F72 F71 F70 F69 F68 F67 F66 F65 F64 F63 F62 F61 F60 F59 F58 F57 F56 F55 F54 F53 F52 F51 F145 F146 F147 F148 F149 F150 F151 F152 F153 F154 F155 F156 F157 F158 F159 F160 F161 F162 F163 F164 F165 F166 F167 F168 F169 F170 F171 F172 F173 F174 F175 F176 F177 F178 F179 F180 F181 F182 F183 F184 F185 F186 F187 F188 F189 F190 F191 F192 F193 F194 F195 F196 F197 F198 F199 F200 F201 F202 F203 F204 F205 F206 F207 F208 F209 F210 F211 F212 F213 F214 F215 F216 F217 F218 F219
Anc7	Sp1(7)	280	G1 G2 G49 G48 G47 G46 G45 G44 G43 G42 G41 G40 G39 G38 G37 G36 G35 G34 G33 G32 G31 G30 G29 G28 G27 G26 G25 G24 G23 G22 G21 G20 G19 G18 G17 G16 G15 G14 G13 G12 G11 G10 G9 G8 G7 G6 G5 G4 G3 G50 G51 G52 G53 G54 G55 G56 G57 G58 G59 G60 G61 G62 G63 G64 G65 G66 G67 G68 G69 G70 G71 G72 G73 G74 G75 G76 G77 G78 G79 G80 G81 G82 G83 G84 G85 G86 G87 G88 G89 G90 G91 G92 G93 G94 G95 G96 G97 G98 G99 G100 G101 G102 G103 G104 G105 G106 G107 G108 G109 G110 G111 G112 G113 G114 G115 G116 G117 G118 G119 G120 G121 G122 G123 G124 G125 G126 G127 G128 G129 G130 G131 G132 G133 G134 G135 G136 G137 G138 G139 G140 G141 G142 G143 G144 G145 G146 G147 G148 G149 G150 G151 G152 G153 G154 G155 G156 G157 G158 G159 G160 G161 G162 G163 G164 G165 G166 G167 G168 G169 G170 G171 G172 G173 G174 G175 G176 G177 G178 G179 G180 G181 G182 G183 G184 G185 G186 G187 G188 G189 G190 G191 G192 G193 G194 G195 G196 G197 G198 G199 G200 G201 G202 G203 G204 G205 G206 G207 G208 G209 G210 G211 G212 G213 G214 G215 G216 G217 G218 G219 G220 G221 G222 G223 G224 G225 G226 G227 G228 G229 G230 G231 G232 G233 G234 G235 G236 G237 G238 G239 G240 G241 G242 G243 G244 G245 G246 G247 G248 G249 G250 G251 G252 G253 G254 G255 G256 G257 G258 G259 G260 G261 G262 G263 G264 G265 G266 G267 G268 G269 G270 G271 G272 G273 G274 G275 G276 G277 G278 G279 G280
Anc7	Sp9(7)	919	J396 J395 J394 J393 J392 J391 J390 J389 J388 J387 J386 J385 J384 J383 J382 J381 J380 J379 J378 J377 J376 J375 J374 J373 J372 J371 J370 J369 J368 J367 J366 J365 J364 J363 J362 J361 J360 J359 J358 J357 J356 J355 J354 J353 J352 J351 J350 J349 J348 J347 J346 J345 J344 J343 J342 J341 J340 J339 J338 J337 J336 J335 J334 J333 J332 J331 J330 J329 J328 J327 J326 J325 J324 J323 J322 J321 J320 J319 J318 J317 J316 J315 J314 J313 J312 J311 J310 J309 J308 J307 J306 J305 J304 J303 J302 J301 J300 J299 J298 J297 J296 J295 J294 J293 J292 J291 J290 J289 J288 J287 J286 J285 J284 J283 J282 J281 J280 J279 J278 J277 J276 J275 J274 J273 J272 J271 J270 J269 J268 J267 J266 J265 J264 J263 J262 J261 J260 J259 J258 J257 J256 J255 J254 J253 J252 J251 J250 J249 J248 J247 J246 J245 J244 J243 J242 J241 J240 J239 J238 J237 J236 J235 J234 J233 J232 J231 J230 J229 J228 J227 J226 J225 J224 J223 J222 J221 J220 J219 J218 J217 J216 J215 J214 J213 J212 J211 J210 J209 J208 J207 J206 J205 J204 J203 J202 J201 J200 J199 J198 J197 J196 J195 J194 J193 J192 J191 J190 J189 J188 J187 J186 J185 J184 J183 J182 J181 J180 J179 J178 J177 J176 J175 J174 J173 J172 J171 J170 J169 J168 J167 J166 J165 J164 J163 J162 J161 J160 J159 J158 J157 J156 J155 J154 J153 J152 J151 J150 J149 J148 J147 J146 J145 J144 J143 J142 J141 B99 B100 B101 B102 B103 B104 B105 B106 B107 B108 B109 B110 B111 B112 B113 B114 B115 B116 B117 B118 B119 B120 B121 B122 B123 B124 B125 B126 B127 B128 B129 B130 B131 B132 B133 B134 B135 B136 B137 B138 B139 B140 B141 B142 B143 B144 B145 B146 B147 B148 B149 B150 B151 B152 B153 B154 B155 B156 B157 B158 B159 B160 B161 B162 B163 B164 B165 B166 B167 B168 B169 B170 B171 B172 B173 B174 B175 B176 B177 B178 B179 B180 B181 B182 B183 B184 B185 B186 B187 B188 B189 B190 B191 B192 B193 B194 B195 B196 B197 B198 B199 B200 B201 B202 B203 B204 B205 B206 B207 B208 B209 B210 B211 B212 B213 B214 B215 B216 B217 B218 B219 B220 B221 B222 B223 B224 B225 B226 B227 B228 B229 B230 B231 B232 B233 B234 B235 B236 B237 B238 B239 B240 B241 B242 B243 B244 B245 B246 B247 B248 B249 B250 B251 B252 B253 B254 B255 B256 B257 B258 B259 B260 B261 B262 B263 B264 B265 B266 B267 B268 B269 B270 B271 B272 B273 B274 B275 B276 B277 B278 B279 B280 B281 B282 B283 B284 B285 B286 B287 B288 B289 B290 B291 B292 B293 B294 B295 B296 B297 B298 B299 B300 B301 B302 B303 B304 B305 B306 B307 B308 B309 B310 B311 B312 B313 B314 B315 B316 B317 B318 B319 B320 B321 B322 B323 B324 B325 B326 B327 B328 B329 B330 B331 B332 B333 B334 B335 B336 B337 B338 B339 B340 B341 B342 B343 B344 B345 B346 B347 B348 B349 B350 B351 B352 B353 B354 B355 B356 B357 B358 B359 B360 B361 B362 B363 B364 B365 B366 B367 B368 B369 B370 B371 B372 B373 B374 B375 B376 B377 B378 B379 B380 B381 B382 B383 B384 B385 B386 B387 B388 B389 B390 B391 B392 B393 B394 B395 B396 B397 B398 B399 B400 B401 B402 B403 B404 B405 B406 B407 B408 B409 B410 B411 B412 B413 B414 B415 B416 B417 B418 B419 B420 B421 B422 B423 B424 B425 B426 B427 B428 B429 B430 B431 B432 B433 B434 B435 B436 B437 B438 B439 B440 B441 B442 B443 B444 B445 B446 B447 B448 B449 B450 B451 B452 B453 B454 B455 B456 B457 B458 B459 B460 B461 B462 B463 B464 B465 B466 B467 B468 B469 B470 B471 B472 B473 B474 B475 B476 B477 B478 B479 B480 B481 B482 B483 B484 B485 B486 B487 B488 B489 B490 B491 B492 B493 B494 B495 B496 B497 B498 B499 B500 B501 B502 B503 B504 B505 B506 B507 B508 B509 B510 B511 B512 B513 B514 B515 B516 B517 B518 B519 B520 B521 B522 B523 B524 B525 B526 B527 B528 B529 B530 B531 B532 B533 B534 B535 B536 B537 B538 B539 B540 B541 B542 B543 B544 B545 B546 B547 B548 B549 B550 B551 B552 B553 B554 B555 B556 B557 B558 B559 B560 B561 B562 B563 B564 B565 B566 B567 B568 B569 B570 B571 B572 B573 B574 B575 B576 B577 B578 B579 B580 B581 B582 B583 B584 B585 B586 B587 B588 B589 B590 B591 B592 B593 B594 B595 B596 B597 B598 B599 B600 B601 B602 B603 B604 B605 B606 B607 B608 B609 B610 B611 B612 B613 B614 B615 B616 B617 B618 B619 B620 B621 B622 B623 B624 B625 B626 B627 B628 B629 B630 B631 B632 K1 K2 K3 K4 K5 K6 K7 K8 K9 K10 K11 K12 K13 K14 K15 K16 K17 K18 K19 K20 K21 K22 K23 K24 K25 K26 K27 K28 K29 K30 K31 K32 K33 K34 K35 K36 K37 K38 K39 K40 K41 K42 K43 K44 K45 K46 K47 K48 K49 K50 K51 K52 K53 K54 K55 K56 K57 K58 K59 K60 K61 K62 K63 K64 K65 K66 K67 K68 K69 K70 K71 K72 K73 K74 K75 K76 K77 K78 K79 K80 K81 K82 K83 K84 K85 K86 K87 K88 K89 K90 K91 K92 K93 K94 K95 K96 K103 K102 K101 K100 K99 K98 K97 K104 K105 K106 K107 K108 K109 K110 K111 K112 K113 K114 K115 K116 K117 K118 K119 K120 K121 K122 K123 K124 K125 K126 K127 K128 K129
Anc7	Sp6(5)	330	L1 L2 L3 L4 L5 L6 L7 L8 L9 L10 L11 L12 L13 L14 L15 L16 L17 L18 L19 L20 L21 L22 L23 L24 L25 L26 L27 L28 L29 L30 L31 L32 L33 L34 L35 L36 L37 L38 L39 L40 L41 L42 L43 L44 L45 L46 L47 L48 L49 L50 L51 L52 L53 L54 L55 L56 L57 L58 L59 L60 L61 L62 L63 L64 L65 L66 L67 L68 L69 L70 L71 L72 L73 L74 L75 L76 L77 L78 L79 L80 L81 L82 L83 L84 L85 L86 L87 L88 L89 L90 L91 L92 L93 L94 L95 L96 L97 L98 L99 L100 L101 L102 L103 L104 L105 L106 L107 L108 L109 L110 L111 L112 L113 L114 L115 L116 L117 L118 L119 L120 L121 L122 L123 L124 L125 L126 L127 L128 L129 L130 L131 L132 L133 L134 L135 L136 L137 L138 L139 L140 L141 L142 L143 L144 L145 L146 L147 L148 L149 L150 L151 L152 L153 L154 L155 L156 L157 L158 L159 L160 L161 L162 L163 L164 L165 L166 L167 L168 L169 L170 L171 L172 L173 L174 L175 L176 L177 L178 L179 L180 L181 L182 L183 L184 L185 L186 L187 L188 L189 L190 L191 L192 L193 L194 L195 L196 L197 L198 L199 L200 L201 L202 L203 L204 L205 L206 L207 L208 L209 L210 L211 L212 L213 L214 L215 L216 L217 L218 L219 L220 L221 L222 L223 L224 L225 L226 L227 L228 L229 L230 L231 L232 L233 L234 L235 L236 L237 L238 L239 L240 L241 L242 L243 L244 L245 L246 L247 L248 L249 L250 L251 L252 L253 L254 L255 L256 L257 L258 L259 L260 L261 L262 L263 L264 L265 L266 L267 L268 L269 L270 L271 L272 L273 L274 L275 L276 L277 L278 L279 L280 L281 L282 L283 L284 L285 L286 L287 L288 L289 L290 L291 L292 L293 L294 L295 L296 L297 L298 L299 L300 L301 L302 L303 L304 L305 L306 L307 L308 L309 L310 L311 L312 L313 L314 L315 L316 L317 L318 L319 L320 L321 L322 L323 L324 L325 L326 L327 L328 L329 L330
Anc7	Sp3(3)	654	C1 C2 C3 C4 C5 C6 C7 C8 C9 C10 C11 C12 C13 C14 C15 C16 C17 C18 C19 C20 C21 C22 C23 C24 C25 C26 C27 C28 C29 C30 C31 C32 C33 C34 C35 C36 C37 C38 C39 C40 C41 C42 C43 C44 C45 C46 C47 C48 C49 C50 C51 C52 C53 C54 C55 C56 C57 C58 C59 C60 C61 C62 C63 C64 C65 C66 C67 C68 C69 C70 C71 C72 C73 C74 C75 C76 C77 C78 C79 C80 C81 C82 C83 C84 C85 C86 C87 C88 C89 C90 C91 C92 C93 C94 C95 C96 C97 C98 C99 C100 C101 C102 C103 C104 C105 C106 C107 C108 C109 C110 C111 C112 C113 C114 C115 C116 C117 C118 C119 C120 C121 C122 C123 C124 C125 C126 C127 C128 C129 C130 C131 C132 C133 C134 C135 C136 C137 C138 C139 C140 C141 C142 C143 C144 C145 C146 C147 C148 C149 C150 C151 C152 C153 C154 C155 C156 C157 C158 C159 C160 C161 C162 C163 C164 C165 C166 C167 C168 C169 C170 C171 C172 C173 C174 C175 C176 C177 C178 C179 C180 C181 C182 C183 C184 C185 C186 C187 C188 C189 C190 C191 C192 C193 C194 C195 C196 C197 C198 C199 C200 C201 C202 C203 C204 C205 C206 C207 C208 C209 C210 C211 C212 C213 C214 C215 C216 C217 C218 C219 C220 C221 C222 C223 C224 C225 C226 C227 C228 C229 C230 C231 C232 C233 C234 C235 C236 C237 C238 C239 C240 C241 C242 C243 C244 C245 C246 C247 C248 C249 C250 C251 C252 C253 C254 C255 C256 C257 C258 C259 C260 C261 C262 C263 C264 C265 C266 C267 C268 C269 C270 C271 C272 C273 C274 C275 C276 C277 C278 C279 C280 C281 C282 C283 C284 C285 C286 C287 C288 C289 C290 C291 C292 C293 C294 C295 C296 C297 C298 C299 C300 C301 C302 C303 C304 C305 C306 C307 C308 C309 C310 C311 C312 C313 C314 C315 C316 C317 C318 C319 C320 C321 C322 C323 C324 C325 C326 C327 C328 C329 C330 C331 C332 C333 C334 C335 C336 C337 C338 C339 C340 C341 C342 C343 C344 C345 C346 C347 C348 C349 C350 C351 C352 C353 C354 C355 C356 C357 C358 C359 C360 C361 C362 C363 C364 C365 C366 C367 C368 C369 C370 C371 C372 C373 C374 C375 C376 C377 C378 C379 C380 C381 C382 C383 C384 C385 C386 C387 C388 C389 C390 C391 C392 C393 C394 C395 C396 C397 C398 C399 C400 C401 C402 C403 C404 C405 C406 C407 C408 C409 C410 C411 C412 C413 C414 C415 C416 C417 C418 C419 C420 C421 C422 C423 C424 C425 C426 C427 C428 C429 C430 C431 C432 C433 C434 C435 C436 C437 C438 C439 C440 C441 C442 C443 C444 C445 C446 C447 C448 C449 C450 C451 C452 C453 C454 C455 C456 C457 C458 C459 C460 C461 C462 C463 C464 C465 C466 C467 C468 C469 C470 C471 C472 C473 C474 C475 C476 C477 C478 C479 C480 C481 C482 C483 C484 C485 C486 C487 C488 C489 C490 C491 C492 C493 C494 C495 C496 C497 C498 C499 C500 C501 C502 C503 C504 C505 C506 C507 C508 C509 C510 C511 C512 C513 C514 C515 C516 C517 C518 C519 C520 C521 C522 C523 C524 C525 C526 C527 C528 C529 C530 C531 C532 C533 C534 C535 C536 C537 C538 C539 C540 C541 C542 C543 C544 C545 C546 C547 C548 C549 C550 C551 C552 C553 C554 C555 C556 C557 C558 C559 C560 C561 C562 C563 C564 C565 C566 C567 C568 C569 C570 C571 C572 C573 C574 C575 C576 C577 C578 C579 C580 C581 C582 C583 C584 C585 C586 C587 C588 C589 C590 C591 C592 C593 C594 C595 C596 C597 C598 C599 C600 C601 C602 C603 C604 C605 C606 C607 C608 C609 C610 C611 C612 C613 C614 C615 C616 C617 C618 C619 C620 C621 C622 C623 C624 C625 C626 C627 C628 C629 C630 C631 C632 C633 C634 C635 C636 C637 C638 C639 C640 C641 C642 C643 C644 C645 C646 C647 C648 C649 C650 C651 C652 C653 C654
Anc8	Sp1(2)	238	B1 B2 B3 B4 B5 B6 B7 B8 B9 B10 B11 B12 B13 B14 B15 B16 B17 B18 B19 B20 B21 B22 B23 B24 B25 B26 B27 B28 B29 B30 B31 B32 B33 B34 B35 B36 B37 B38 B39 B40 B41 B42 B43 B44 B45 B46 B47 B48 B49 B50 B51 B52 B53 B54 B55 B56 B57 B58 B59 B60 B61 B62 B63 B64 B65 B66 B67 B68 B69 B70 B71 B72 B73 B74 B75 B76 B77 B78 B79 B80 B81 B82 B83 B84 B85 B86 B87 B88 B89 B90 B91 B92 B93 B94 B95 B96 B97 B98 J140 J139 J138 J137 J136 J135 J134 J133 J132 J131 J130 J129 J128 J127 J126 J125 J124 J123 J122 J121 J120 J119 J118 J117 J116 J115 J114 J113 J112 J111 J110 J109 J108 J107 J106 J105 J104 J103 J102 J101 J100 J99 J98 J97 J96 J95 J94 J93 J92 J91 J90 J89 J88 J87 J86 J85 J84 J83 J82 J81 J80 J79 J78 J77 J76 J75 J74 J73 J72 J71 J70 J69 J68 J67 J66 J65 J64 J63 J62 J61 J60 J59 J58 J57 J56 J55 J54 J53 J52 J51 J50 J49 J48 J47 J46 J45 J44 J43 J42 J41 J40 J39 J38 J37 J36 J35 J34 J33 J32 J31 J30 J29 J28 J27 J26 J25 J24 J23 J22 J21 J20 J19 J18 J17 J16 J15 J14 J13 J12 J11 J10 J9 J8 J7 J6 J5 J4 J3 J2 J1
Anc8	Sp1(7)	280	G1 G2 G49 G48 G47 G46 G45 G44 G43 G42 G41 G40 G39 G38 G37 G36 G35 G34 G33 G32 G31 G30 G29 G28 G27 G26 G25 G24 G23 G22 G21 G20 G19 G18 G17 G16 G15 G14 G13 G12 G11 G10 G9 G8 G7 G6 G5 G4 G3 G50 G51 G52 G53 G54 G55 G56 G57 G58 G59 G60 G61 G62 G63 G64 G65 G66 G67 G68 G69 G70 G71 G72 G73 G74 G75 G76 G77 G78 G79 G80 G81 G82 G83 G84 G85 G86 G87 G88 G89 G90 G91 G92 G93 G94 G95 G96 G97 G98 G99 G100 G101 G102 G103 G104 G105 G106 G107 G108 G109 G110 G111 G112 G113 G114 G115 G116 G117 G118 G119 G120 G121 G122 G123 G124 G125 G126 G127 G128 G129 G130 G131 G132 G133 G134 G135 G136 G137 G138 G139 G140 G141 G142 G143 G144 G145 G146 G147 G148 G149 G150 G151 G152 G153 G154 G155 G156 G157 G158 G159 G160 G161 G162 G163 G164 G165 G166 G167 G168 G169 G170 G171 G172 G173 G174 G175 G176 G177 G178 G179 G180 G181 G182 G183 G184 G185 G186 G187 G188 G189 G190 G191 G192 G193 G194 G195 G196 G197 G198 G199 G200 G201 G202 G203 G204 G205 G206 G207 G208 G209 G210 G211 G212 G213 G214 G215 G216 G217 G218 G219 G220 G221 G222 G223 G224 G225 G226 G227 G228 G229 G230 G231 G232 G233 G234 G235 G236 G237 G238 G239 G240 G241 G242 G243 G244 G245 G246 G247 G248 G249 G250 G251 G252 G253 G254 G255 G256 G257 G258 G259 G260 G261 G262 G263 G264 G265 G266 G267 G268 G269 G270 G271 G272 G273 G274 G275 G276 G277 G278 G279 G280
