Node	ChrID	GenesCount	Genes
Anc14	Sp5(2)	737	J1 J2 J3 J4 J5 J6 J7 J8 J9 J10 J11 J12 J13 J14 J15 J16 J17 J18 J19 J20 J21 J22 J23 J24 J25 J26 J27 J28 J29 J30 J31 J32 J33 J34 J35 J36 J37 J38 J39 J40 J41 J42 J43 J44 J45 J46 J47 J48 J49 J50 J51 J52 J53 J54 J55 J56 J57 J58 J59 J60 J61 J62 J63 J64 J65 J66 J67 J68 J69 J70 J71 J72 J73 J74 J75 J76 J77 J78 J79 J80 J81 J82 J83 J84 J85 J86 J87 J88 J89 J90 J91 J92 J93 J94 J95 J96 J97 J98 J99 J100 J101 J102 J103 J104 J105 J106 J107 J108 J109 J110 J111 J112 J113 J114 J115 J116 J117 J118 J119 J120 J121 J122 J123 J124 J125 J126 J127 J128 J129 J130 J131 J132 J133 J134 J135 J136 J137 J138 J139 J140 B98 B97 B96 B95 B94 B93 B92 B91 B90 B89 B88 B87 B86 B85 B84 B83 B82 B81 B80 B79 B78 B77 B76 B75 B74 B73 B72 B71 B70 B69 B68 B67 B66 B65 B64 B63 B62 B61 B60 B59 B58 B57 B56 B55 B54 B53 B52 B51 B50 B49 B48 B47 B46 B45 B44 B43 B42 B41 B40 B39 B38 B37 B36 B35 B34 B33 B32 B31 B30 B29 B28 B27 B26 B25 B24 B23 B22 B21 B20 B19 B18 B17 B16 B15 B14 B13 B12 B11 B10 B9 B8 B7 B6 B5 B4 B3 B2 B1 G280 G279 G278 G277 G276 G275 G274 G273 G272 G271 G270 G269 G268 G267 G266 G265 G264 G263 G262 G261 G260 G259 G258 G257 G256 G255 G254 G253 G252 G251 G250 G249 G248 G247 G246 G245 G244 G243 G242 G241 G240 G239 G238 G237 G236 G235 G234 G233 G232 G231 G230 G229 G228 G227 G226 G225 G224 G223 G222 G221 G220 G219 G218 G217 G216 G215 G214 G213 G212 G211 G210 G209 G208 G207 G206 G205 G204 G203 G202 G201 G200 G199 G198 G197 G196 G195 G194 G193 G192 G191 G190 G189 G188 G187 G186 G185 G184 G183 G182 G181 G180 G179 G178 G177 G176 G175 G174 G173 G172 G171 G170 G169 G168 G167 G166 G165 G164 G163 G162 G161 G160 G159 G158 G157 G156 G155 G154 G153 G152 G151 G150 G149 G148 G147 G146 G145 G144 G143 G142 G141 G140 G139 G138 G137 G136 G135 G134 G133 G132 G131 G130 G129 G128 G127 G126 G125 G124 G123 G122 G121 G120 G119 G118 G117 G116 G115 G114 G113 G112 G111 G110 G109 G108 G107 G106 G105 G104 G103 G102 G101 G100 G99 G98 G97 G96 G95 G94 G93 G92 G91 G90 G89 G88 G87 G86 G85 G84 G83 G82 G81 G80 G79 G78 G77 G76 G75 G74 G73 G72 G71 G70 G69 G68 G67 G66 G65 G64 G63 G62 G61 G60 G59 G58 G57 G56 G55 G54 G53 G52 G51 G50 G49 G48 G47 G46 G45 G44 G43 G42 G41 G40 G39 G38 G37 G36 G35 G34 G33 G32 G31 G30 G29 G28 G27 G26 G25 G24 G23 G22 G21 G20 G19 G18 G17 G16 G15 G14 G13 G12 G11 G10 G9 G8 G7 G6 G5 G4 G3 G2 G1 M1 M2 M3 M4 M5 M6 M7 M8 M9 M10 M11 M12 M13 M14 M15 M16 M17 M18 M19 M20 M21 M22 M23 M24 M25 M26 M27 M28 M29 M30 M31 M32 M33 M34 M35 M36 M37 M38 M39 M40 M41 M42 M43 M44 M45 M46 M47 M48 M49 M50 M51 M52 M53 M54 M55 M56 M57 M58 M59 M60 M61 M62 M63 M64 M65 M66 M67 M68 M69 M70 M71 M72 M73 M74 M75 M76 M77 M78 M79 M80 M81 M82 M83 M84 M85 M86 M87 M88 M89 M90 M91 M92 M93 M94 M95 M96 M97 M98 M99 M100 M101 M102 M103 M104 M105 M106 M107 M108 M109 M110 M111 M112 M113 M114 M115 M116 M117 M118 M119 M120 M121 M122 M123 M124 M125 M126 M127 M128 M129 M130 M131 M132 M133 M134 M135 M136 M137 M138 M139 M140 M141 M142 M143 M144 M145 M146 M147 M148 M149 M150 M151 M152 M153 M154 M155 M156 M157 M158 M159 M160 M161 M162 M163 M164 M165 M166 M167 M168 M169 M170 M171 M172 M173 M174 M175 M176 M177 M178 M179 M180 M181 M182 M183 M184 M185 M186 M187 M188 M189 M190 M191 M192 M193 M194 M195 M196 M197 M198 M199 M200 M201 M202 M203 M204 M205 M206 M207 M208 M209 M210 M211 M212 M213 M214 M215 M216 M217 M218 M219
Anc14	Sp7(7)	1148	D1 D2 D3 D4 D5 D6 D7 D8 D9 D10 D11 D12 D13 D14 D15 D16 D17 D18 D19 D20 D21 D22 D23 D24 D25 D26 D27 D28 D29 D30 D31 D32 D33 D34 D35 D36 D37 D38 D39 D40 D41 D42 D43 D44 D45 D46 D47 D48 D49 D50 D51 D52 D53 D54 D55 D56 D57 D58 D59 D60 D61 D62 D63 D64 D65 D66 D67 D68 D69 D70 D71 D72 D73 D74 D75 D76 D77 D78 D79 D80 D81 D82 D83 D84 D85 D86 D87 D88 D89 D90 D91 D92 D93 D94 D95 D96 D97 D98 D99 D100 D101 D102 D103 D104 D105 D106 D107 D108 D109 D110 D111 D112 D113 D114 D115 D116 D117 D118 D119 D120 D121 D122 D123 D124 D125 D126 D127 D128 D129 D130 D131 D132 D133 D134 D135 D136 D137 D138 D139 D140 D141 D142 D143 D144 D145 D146 D147 D148 D149 D150 D151 D152 D153 D154 D155 D156 D157 D158 D159 D160 D161 D162 D163 D164 D165 D166 D167 D168 D169 D170 D171 D172 D173 D174 D175 D176 D177 D178 D179 D180 D181 D182 D183 D184 D185 D186 D187 D188 D189 D190 D191 D192 D193 D194 D195 D196 D197 D198 D199 D200 D201 D202 D203 D204 D205 D206 D207 D208 D209 D210 D211 D212 D213 D214 D215 D216 D217 D218 D219 D220 D221 D222 D223 D224 D225 D226 D227 D228 D229 D230 D231 D232 D233 D234 D235 D236 D237 D238 D239 D240 D241 D242 D243 D244 D245 D246 D247 D248 D249 D250 D251 D252 D253 D254 D255 D256 D257 D258 D259 D260 D261 D262 D263 D264 D265 D266 D267 D268 D269 D270 D271 D272 D273 D274 D275 D276 D277 D278 D279 D280 D281 D282 D283 D284 D285 D286 D287 D288 D289 D290 D291 D292 D293 D294 D295 D296 D297 D298 D299 D300 D301 D302 D303 D304 D305 D306 D307 D308 D309 D310 D311 D312 D313 D314 D315 D316 D317 D318 D319 D320 D321 D322 D323 D324 D325 D326 D327 D328 D329 D330 D331 D332 D333 D334 D335 D336 D337 D338 D339 D340 D341 D342 D343 D344 D345 D346 D347 D348 D349 D350 D351 D352 D353 I1 I2 I3 I4 I5 I6 I7 I8 I9 I10 I11 I12 I13 I14 I15 I16 I17 I18 I19 I20 I21 I22 I23 I24 I25 I26 I27 I28 I29 I30 I31 I32 I33 I34 I35 I36 I37 I38 I39 I40 I41 I42 I43 I44 I45 I46 I47 I48 I49 I50 I51 I52 I53 I54 I55 I56 I57 I58 I59 I60 I61 I62 I63 I64 I65 I66 I67 I68 I69 I70 I71 I72 I73 I74 I75 I76 I77 I78 I79 I80 I81 I82 I83 I84 I85 I86 I87 I88 I89 I90 I91 I92 I93 I94 I95 I96 I97 I98 I99 I100 I101 I102 I103 I104 I105 I106 I107 I108 I109 I110 I111 I112 I113 I114 I115 I116 I117 I118 I119 I120 I121 I122 I123 I124 I125 I126 I127 I128 I129 I130 I131 I132 I133 I134 I135 I136 I137 I138 I139 I140 I141 I142 I143 I144 I145 I146 I147 I148 I149 I150 I151 I152 I153 I154 I155 I156 I157 I158 I159 I160 I161 I162 I163 I164 I165 I166 I167 I168 I169 I170 I171 I172 I173 I174 I175 I176 I177 I178 I179 I180 I181 I182 I183 I184 I185 I186 I187 I188 I189 I190 I191 I192 I193 I194 I195 I196 I197 I198 I199 I200 I201 I202 I203 I204 I205 I206 I207 I208 I209 I210 I211 I212 I213 I214 I215 I216 I217 I218 I219 I220 I221 I222 I223 I224 I225 I226 I227 I228 I229 I230 I231 I232 I233 I234 I235 I236 I237 I238 I239 I240 I241 I242 I243 I244 I245 I246 I247 I248 I249 I250 I251 I252 I253 I254 I255 I256 I257 I258 I259 I260 I261 I262 I263 I264 I265 I266 I267 I268 I269 I270 I271 I272 I273 I274 I275 I276 I277 I278 I279 I280 I281 I282 I283 I284 I285 I286 I287 I288 I289 I290 I291 I292 I293 I294 I295 I296 I297 I298 I299 I300 I301 I302 I303 I304 I305 I306 I307 I308 I309 I310 I311 I312 I313 I314 I315 I316 I317 I318 I319 I320 I321 I322 I323 I324 I325 I326 I327 I328 I329 I330 D354 D355 D356 D357 D358 D359 D360 D361 D362 D363 D364 D365 D366 D367 D368 D369 D370 D371 D372 D373 D374 D375 D376 D377 D378 D379 D380 D381 D382 D383 D384 D385 D386 D387 D388 D389 D390 D391 D392 D393 D394 D395 D396 D397 D398 D399 D400 D401 D402 D403 D404 D405 D406 D407 D408 D409 D410 D411 D412 D413 D414 D415 D416 D417 D418 D419 D420 D421 D422 D423 D424 D425 D426 D427 D428 D429 D430 D431 D432 D433 D434 D435 D436 D437 D438 D439 D440 D441 D442 D443 D444 D445 D446 D447 D448 D449 D450 D451 D452 D453 D454 D455 D456 D457 D458 D459 D460 D461 D462 D463 D464 D465 D466 D467 D468 D469 D470 D471 D472 D473 D474 D475 D476 D477 D478 D479 D480 D481 D482 D483 D484 D485 D486 D487 D488 D489 D490 D491 D492 D493 D494 D495 D496 D497 D498 D499 D500 D501 D502 D503 D504 D505 D506 D507 D508 D509 D510 D511 D512 D513 D514 D515 D516 D517 D518 D519 D520 D521 D522 D523 D524 D525 D526 D527 D528 D529 D530 D531 D532 D533 D534 D535 D536 D537 D538 D539 D540 D541 D542 D543 D544 D545 D546 D547 D548 D549 D550 D551 D552 D553 D554 D555 D556 D557 D558 D559 D560 D561 D562 D563 D564 D565 D566 D567 D568 D569 D570 D571 D572 D573 D574 D575 D576 D577 D578 D579 D580 D581 D582 D583 D584 D585 D586 D587 D588 D589 D590 D591 D592 D593 D594 D595 D596 D597 D598 D599 D600 D601 D602 D603 D604 D605 D606 D607 D608 D609 D610 D611 D612 D613 D614 D615 D616 D617 D618 D619 D620 D621 D622 D623 D624 D625 D626 D627 D628 D629 D630 D631 D632 D633 D634 D635 D636 D637 D638 D639 D640 D641 D642 D643 D644 D645 D646 D647 D648 D649 D650 D651 D652 D653 D654 D655 D656 D657 D658 D659 D660 D661 D662 D663 D664 D665 D666 D667 D668 D669 D670 D671 D672 D673 D674 D675 D676 D677 D678 D679 D680 D681 D682 D683 D684 D685 D686 D687 D688 D689 D690 D691 D692 D693 D694 D695 D696 D697 D698 D699 D700 D701 D702 D703 D704 D705 D706 D707 D708 D709 D710 D711 D712 D713 D714 D715 D716 D717 D718 D719 D720 D721 D722 D723 D724 D725 D726 D727 D728 D729 D730 D731 D732 D733 D734 D735 D736 D737 D738 D739 D740 D741 D742 D743 D744 D745 D746 D747 D748 D749 D750 D751 D752 D753 D754 D755 D756 D757 D758 D759 D760 D761 D762 D763 D764 D765 D766 D767 D768 D769 D770 D771 D772 D773 D774 D775 D776 D777 D778 D779 D780 D781 D782 D783 D784 D785 D786 D787 D788 D789 D790 D791 D792 D793 D794 D795 D796 D797 D798 D799 D800 D801 D802 D803 D804 D805 D806 D807 D808 D809 D810 D811 D812 D813 D814 D815 D816 D817 D818
Anc15	Sp3(3)	654	C1 C2 C3 C4 C5 C6 C7 C8 C9 C10 C11 C12 C13 C14 C15 C16 C17 C18 C19 C20 C21 C22 C23 C24 C25 C26 C27 C28 C29 C30 C31 C32 C33 C34 C35 C36 C37 C38 C39 C40 C41 C42 C43 C44 C45 C46 C47 C48 C49 C50 C51 C52 C53 C54 C55 C56 C57 C58 C59 C60 C61 C62 C63 C64 C65 C66 C67 C68 C69 C70 C71 C72 C73 C74 C75 C76 C77 C78 C79 C80 C81 C82 C83 C84 C85 C86 C87 C88 C89 C90 C91 C92 C93 C94 C95 C96 C97 C98 C99 C100 C101 C102 C103 C104 C105 C106 C107 C108 C109 C110 C111 C112 C113 C114 C115 C116 C117 C118 C119 C120 C121 C122 C123 C124 C125 C126 C127 C128 C129 C130 C131 C132 C133 C134 C135 C136 C137 C138 C139 C140 C141 C142 C143 C144 C145 C146 C147 C148 C149 C150 C151 C152 C153 C154 C155 C156 C157 C158 C159 C160 C161 C162 C163 C164 C165 C166 C167 C168 C169 C170 C171 C172 C173 C174 C175 C176 C177 C178 C179 C180 C181 C182 C183 C184 C185 C186 C187 C188 C189 C190 C191 C192 C193 C194 C195 C196 C197 C198 C199 C200 C201 C202 C203 C204 C205 C206 C207 C208 C209 C210 C211 C212 C213 C214 C215 C216 C217 C218 C219 C220 C221 C222 C223 C224 C225 C226 C227 C228 C229 C230 C231 C232 C233 C234 C235 C236 C237 C238 C239 C240 C241 C242 C243 C244 C245 C246 C247 C248 C249 C250 C251 C252 C253 C254 C255 C256 C257 C258 C259 C260 C261 C262 C263 C264 C265 C266 C267 C268 C269 C270 C271 C272 C273 C274 C275 C276 C277 C278 C279 C280 C281 C282 C283 C284 C285 C286 C287 C288 C289 C290 C291 C292 C293 C294 C295 C296 C297 C298 C299 C300 C301 C302 C303 C304 C305 C306 C307 C308 C309 C310 C311 C312 C313 C314 C315 C316 C317 C318 C319 C320 C321 C322 C323 C324 C325 C326 C327 C328 C329 C330 C331 C332 C333 C334 C335 C336 C337 C338 C339 C340 C341 C342 C343 C344 C345 C346 C347 C348 C349 C350 C351 C352 C353 C354 C355 C356 C357 C358 C359 C360 C361 C362 C363 C364 C365 C366 C367 C368 C369 C370 C371 C372 C373 C374 C375 C376 C377 C378 C379 C380 C381 C382 C383 C384 C385 C386 C387 C388 C389 C390 C391 C392 C393 C394 C395 C396 C397 C398 C399 C400 C401 C402 C403 C404 C405 C406 C407 C408 C409 C410 C411 C412 C413 C414 C415 C416 C417 C418 C419 C420 C421 C422 C423 C424 C425 C426 C427 C428 C429 C430 C431 C432 C433 C434 C435 C436 C437 C438 C439 C440 C441 C442 C443 C444 C445 C446 C447 C448 C449 C450 C451 C452 C453 C454 C455 C456 C457 C458 C459 C460 C461 C462 C463 C464 C465 C466 C467 C468 C469 C470 C471 C472 C473 C474 C475 C476 C477 C478 C479 C480 C481 C482 C483 C484 C485 C486 C487 C488 C489 C490 C491 C492 C493 C494 C495 C496 C497 C498 C499 C500 C501 C502 C503 C504 C505 C506 C507 C508 C509 C510 C511 C512 C513 C514 C515 C516 C517 C518 C519 C520 C521 C522 C523 C524 C525 C526 C527 C528 C529 C530 C531 C532 C533 C534 C535 C536 C537 C538 C539 C540 C541 C542 C543 C544 C545 C546 C547 C548 C549 C550 C551 C552 C553 C554 C555 C556 C557 C558 C559 C560 C561 C562 C563 C564 C565 C566 C567 C568 C569 C570 C571 C572 C573 C574 C575 C576 C577 C578 C579 C580 C581 C582 C583 C584 C585 C586 C587 C588 C589 C590 C591 C592 C593 C594 C595 C596 C597 C598 C599 C600 C601 C602 C603 C604 C605 C606 C607 C608 C609 C610 C611 C612 C613 C614 C615 C616 C617 C618 C619 C620 C621 C622 C623 C624 C625 C626 C627 C628 C629 C630 C631 C632 C633 C634 C635 C636 C637 C638 C639 C640 C641 C642 C643 C644 C645 C646 C647 C648 C649 C650 C651 C652 C653 C654
Anc15	Sp3(4)	1961	D1 D2 D3 D4 D5 D6 D7 D8 D9 D10 D11 D12 D13 D14 D15 D16 D17 D18 D19 D20 D21 D22 D23 D24 D25 D26 D27 D28 D29 D30 D31 D32 D33 D34 D35 D36 D37 D38 D39 D40 D41 D42 D43 D44 D45 D46 D47 D48 D49 D50 D51 D52 D53 D54 D55 D56 D57 D58 D59 D60 D61 D62 D63 D64 D65 D66 D67 D68 D69 D70 D71 D72 D73 D74 D75 D76 D77 D78 D79 D80 D81 D82 D83 D84 D85 D86 D87 D88 D89 D90 D91 D92 D93 D94 D95 D96 D97 D98 D99 D100 D101 D102 D103 D104 D105 D106 D107 D108 D109 D110 D111 D112 D113 D114 D115 D116 D117 D118 D119 D120 D121 D122 D123 D124 D125 D126 D127 D128 D129 D130 D131 D132 D133 D134 D135 D136 D137 D138 D139 D140 D141 D142 D143 D144 D145 D146 D147 D148 D149 D150 D151 D152 D153 D154 D155 D156 D157 D158 D159 D160 D161 D162 D163 D164 D165 D166 D167 D168 D169 D170 D171 D172 D173 D174 D175 D176 D177 D178 D179 D180 D181 D182 D183 D184 D185 D186 D187 D188 D189 D190 D191 D192 D193 D194 D195 D196 D197 D198 D199 D200 D201 D202 D203 D204 D205 D206 D207 D208 D209 D210 D211 D212 D213 D214 D215 D216 D217 D218 D219 D220 D221 D222 D223 D224 D225 D226 D227 D228 D229 D230 D231 D232 D233 D234 D235 D236 D237 D238 D239 D240 D241 D242 D243 D244 D245 D246 D247 D248 D249 D250 D251 D252 D253 D254 D255 D256 D257 D258 D259 D260 D261 D262 D263 D264 D265 D266 D267 D268 D269 D270 D271 D272 D273 D274 D275 D276 D277 D278 D279 D280 D281 D282 D283 D284 D285 D286 D287 D288 D289 D290 D291 D292 D293 D294 D295 D296 D297 D298 D299 D300 D301 D302 D303 D304 D305 D306 D307 D308 D309 D310 D311 D312 D313 D314 D315 D316 D317 D318 D319 D320 D321 D322 D323 D324 D325 D326 D327 D328 D329 D330 D331 D332 D333 D334 D335 D336 D337 D338 D339 D340 D341 D342 D343 D344 D345 D346 D347 D348 D349 D350 D351 D352 D353 I1 I2 I3 I4 I5 I6 I7 I8 I9 I10 I11 I12 I13 I14 I15 I16 I17 I18 I19 I20 I21 I22 I23 I24 I25 I26 I27 I28 I29 I30 I31 I32 I33 I34 I35 I36 I37 I38 I39 I40 I41 I42 I43 I44 I45 I46 I47 I48 I49 I50 I51 I52 I53 I54 I55 I56 I57 I58 I59 I60 I61 I62 I63 I64 I65 I66 I67 I68 I69 I70 I71 I72 I73 I74 I75 I76 I77 I78 I79 I80 I81 I82 I83 I84 I85 I86 I87 I88 I89 I90 I91 I92 I93 I94 I95 I96 I97 I98 I99 I100 I101 I102 I103 I104 I105 I106 I107 I108 I109 I110 I111 I112 I113 I114 I115 I116 I117 I118 I119 I120 I121 I122 I123 I124 I125 I126 I127 I128 I129 I130 I131 I132 I133 I134 I135 I136 I137 I138 I139 I140 I141 I142 I143 I144 I145 I146 I147 I148 I149 I150 I151 I152 I153 I154 I155 I156 I157 I158 I159 I160 I161 I162 I163 I164 I165 I166 I167 I168 I169 I170 I171 I172 I173 I174 I175 I176 I177 I178 I179 I180 I181 I182 I183 I184 I185 I186 I187 I188 I189 I190 I191 I192 I193 I194 I195 I196 I197 I198 I199 I200 I201 I202 I203 I204 I205 I206 I207 I208 I209 I210 I211 I212 I213 I214 I215 I216 I217 I218 I219 I220 I221 I222 I223 I224 I225 I226 D637 D636 D635 D634 D633 D632 D631 D630 D629 D628 D627 D626 D625 D624 D623 D622 D621 D620 D619 D618 D617 D616 D615 D614 D613 D612 D611 D610 D609 D608 D607 D606 D605 D604 D603 D602 D601 D600 D599 D598 D597 D596 D595 D594 D593 D592 D591 D590 D589 D588 D587 D586 D585 D584 D583 D582 D581 D580 D579 D578 D577 D576 D575 D574 D573 D572 D571 D570 D569 D568 D567 D566 D565 D564 D563 D562 D561 D560 D559 D558 D557 D556 D555 D554 D553 D552 D551 D550 D549 D548 D547 D546 D545 D544 D543 D542 D541 D540 D539 D538 D537 D536 D535 D534 D533 D532 D531 D530 D529 D528 D527 D526 D525 D524 D523 D522 D521 D520 D519 D518 D517 D516 D515 D514 D513 D512 D511 D510 D509 D508 D507 D506 D505 D504 D503 D502 D501 D500 D499 D498 D497 D496 D495 D494 D493 D492 D491 D490 D489 D488 D487 D486 D485 D484 D483 D482 D481 D480 D479 D478 D477 D476 D475 D474 D473 D472 D471 D470 D469 D468 D467 D466 D465 D464 D463 D462 D461 D460 D459 D458 D457 D456 D455 D454 D453 D452 D451 D450 D449 D448 D447 D446 D445 D444 D443 D442 D441 D440 D439 D438 D437 D436 D435 D434 D433 D432 D431 D430 D429 D428 D427 D426 D425 D424 D423 D422 D421 D420 D419 D418 D417 D416 D415 D414 D413 D412 D411 D410 D409 D408 D407 D406 D405 D404 D403 D402 D401 D400 D399 D398 D397 D396 D395 D394 D393 D392 D391 D390 D389 D388 D387 D386 D385 D384 D383 D382 D381 D380 D379 D378 D377 D376 D375 D374 D373 D372 D371 D370 D369 D368 D367 D366 D365 D364 D363 D362 D361 D360 D359 D358 D357 D356 D355 D354 I330 I329 I328 I327 I326 I325 I324 I323 I322 I321 I320 I319 I318 I317 I316 I315 I314 I313 I312 I311 I310 I309 I308 I307 I306 I305 I304 I303 I302 I301 I300 I299 I298 I297 I296 I295 I294 I293 I292 I291 I290 I289 I288 I287 I286 I285 I284 I283 I282 I281 I280 I279 I278 I277 I276 I275 I274 I273 I272 I271 I270 I269 I268 I267 I266 I265 I264 I263 I262 I261 I260 I259 I258 I257 I256 I255 I254 I253 I252 I251 I250 I249 I248 I247 I246 I245 I244 I243 I242 I241 I240 I239 I238 I237 I236 I235 I234 I233 I232 I231 I230 I229 I228 I227 D638 D639 D640 D641 D642 D643 D644 D645 D646 D647 D648 D649 D650 D651 D652 D653 D654 D655 D656 D657 D658 D659 D660 D661 D662 D663 D664 D665 D666 D667 D668 D669 D670 D671 D672 D673 D674 D675 D676 D677 D678 D679 D680 D681 D682 D683 D684 D685 D686 D687 D688 D689 D690 D691 D692 D693 D694 D695 D696 D697 D698 D699 D700 D701 D702 D703 D704 D705 D706 D707 D708 D709 D710 D711 D712 D713 D714 D715 D716 D717 D718 D719 D720 D721 D722 D723 D724 D725 D726 D727 D728 D729 D730 D731 D732 D733 D734 D735 D736 D737 D738 D739 D740 D741 D742 D743 D744 D745 D746 D747 D748 D749 D750 D751 D752 D753 D754 D755 D756 D757 D758 D759 D760 D761 D762 D763 D764 D765 D766 D767 D768 D769 D770 D771 D772 D773 D774 D775 D776 D777 D778 D779 D780 D781 D782 D783 D784 D785 D786 D787 D788 D789 D790 D791 D792 D793 D794 D795 D796 D797 D798 D799 D800 D801 D802 D803 D804 D805 D806 D807 D808 D809 D810 D811 D812 D813 D814 D815 D816 D817 D818 F1 F2 F3 F4 F5 F6 F7 F8 F9 F10 F11 F12 F13 F14 F15 F16 F17 F18 F19 F20 F21 F22 F23 F24 F25 F26 F27 F28 F29 F30 F31 F32 F33 F34 F35 F36 F37 F38 F39 F40 F41 F42 F43 F44 F45 F46 F47 F48 F49 F50 F144 F143 F142 F141 F140 F139 F138 F137 F136 F135 F134 F133 F132 F131 F130 F129 F128 F127 F126 F125 F124 F123 J396 J395 J394 J393 J392 J391 J390 J389 J388 J387 J386 J385 J384 J383 J382 J381 J380 J379 J378 J377 J376 J375 J374 J373 J372 J371 J370 J369 J368 J367 J366 J365 J364 J363 J362 J361 J360 J359 J358 J357 J356 J355 J354 J353 J352 J351 J350 J349 J348 J347 J346 J345 J344 J343 J342 J341 J340 J339 J338 J337 J336 J335 J334 J333 J332 J331 J330 J329 E269 E270 E271 E272 E273 E274 E275 E276 E277 E278 E279 E280 E281 E282 E283 E284 E285 E286 E287 E288 E289 E290 E291 E292 E293 E294 E295 E296 E297 E298 E299 E300 E301 E302 E303 E304 E305 E306 E307 E308 E309 E310 E311 E312 E313 E314 E315 E316 E317 E318 E319 E320 E321 E322 E323 E324 E325 E326 E327 E328 E329 E330 E331 E332 E333 E334 E335 E336 E337 E338 E339 E340 E341 E342 E343 E344 E345 E346 E347 E348 E349 E350 E351 E352 E353 E354 E355 E356 E357 E358 E359 E360 E361 E362 E363 E364 E365 E366 E367 E368 E369 E370 E371 E372 E373 E374 E375 E376 E377 E378 E379 E380 E381 E382 E383 E384 E385 E386 E387 E388 E389 E390 E391 E392 E393 E394 E395 E396 E397 E398 E399 E400 E401 E402 E403 E404 E405 E406 E407 E408 E409 E410 E411 E412 E413 E414 E415 E416 E417 E418 E419 E420 E421 E422 E423 E424 E425 E426 E427 E428 E429 E430 E431 E432 E433 E434 E435 E436 E437 E438 E439 E440 E441 E442 E443 E444 E445 E446 E447 E448 E449 E450 E451 E452 E453 E454 E455 E456 E457 E458 E459 E460 E461 E462 E463 E464 E465 E466 E467 E468 E469 E470 E471 E472 E473 E474 E475 E476 E477 E478 E479 E480 E481 E482 E483 E484 E485 E486 E487 E488 E489 E490 E491 E492 E493 E494 E495 E496 E497 E498 E499 E500 E501 E502 E503 E504 E505 E506 E507 E508 E509 E510 E511 E512 E513 E514 E515 E516 E517 E518 E519 E520 E521 E522 E523 E524 E525 E526 E527 E528 E529 E530 E531 E532 E533 E534 E535 E536 E537 E538 E539 E540 E541 E542 E543 E544 E545 E546 E547 E548 E549 E550 E551 E552 E553 E605 E604 E603 E602 E601 E600 E599 E598 E597 E596 E595 E594 E593 E592 E591 E590 E589 E588 E587 E586 E585 E584 E583 E582 E581 E580 E579 E578 E577 E576 E575 E574 E573 E572 E571 E570 E569 E568 E567 E566 E565 E564 E563 E562 E561 E560 E559 E558 E557 E556 E555 E554 E606 E607 E608 E609 E610 E611 E612 E613 E614 E615 E616 E617 E618 E619 E620 E621 E622 E623 E624 E625 E626 E627 E628 E629 E630 E631 E632 E162 E161 E160 E159 E158 E157 E156 E155 E154 E153 E152 E151 E150 E149 E148 E147 E146 E145 E144 E143 E142 E141 E140 E139 E138 E137 E136 E135 E134 E133 E132 E131 E130 E129 E128 E127 E126 E125 E124 E123 E122 E121 E120 E119 E118 E117 E116 E115 E114 E113 E112 E111 E110 E109 E108 E107 E106 E105 E104 E103 E102 E101 E100 E99 E98 E97 E96 E95 E94 E93 E92 E91 E90 E89 E88 E87 E86 E85 E84 E83 E82 E81 E80 E79 E78 E77 E76 E75 E74 E73 E72 E71 E70 E69 E68 E67 E66 E65 E64 E63 E62 E61 E60 E59 E58 E57 E56 E55 E54 E53 E52 E51 E50 E49 E48 E47 E46 E45 E44 E43 E42 E41 E40 E39 E38 E37 E36 E35 E34 E33 E32 E31 E30 E29 E28 E27 E26 E25 E24 E23 E22 E21 E20 E19 E18 E17 E16 E15 E14 E13 E12 E11 E10 E9 E8 E7 E6 E5 E4 E3 E2 E1 F122 F121 F120 F119 F118 F117 F116 F115 F114 F113 F112 F111 F110 F109 F108 F107 F106 F105 F104 F103 F102 F101 F100 F99 F98 F97 F96 F95 F94 F93 F92 F91 F90 F89 F88 F87 F86 F85 F84 F83 F82 F81 F80 F79 F78 F77 F76 F75 F74 F73 F72 F71 F70 F69 F68 F67 F66 F65 F64 F63 F62 F61 F60 F59 F58 F57 F56 F55 F54 F53 F52 F51 F145 F146 F147 F148 F149 F150 F151 F152 F153 F154 F155 F156 F157 F158 F159 F160 F161 F162 F163 F164 F165 F166 F167 F168 F169 F170 F171 F172 F173 F174 F175 F176 F177 F178 F179 F180 F181 F182 F183 F184 F185 F186 F187 F188 F189 F190 F191 F192 F193 F194 F195 F196 F197 F198 F199 F200 F201 F202 F203 F204 F205 F206 F207 F208 F209 F210 F211 F212 F213 F214 F215 F216 F217 F218 F219
Anc15	Sp3(6)	488	H1 H2 H3 H4 H5 H6 H7 H8 H9 H10 H11 H12 H13 H14 H15 H16 H17 H18 H19 H20 H21 H22 H23 H24 H25 H26 H27 H28 H29 H30 H31 H32 H33 H34 H35 H36 H37 H38 H39 H40 H41 H42 H43 H44 H45 H46 H47 H48 H49 H50 H51 H52 H53 H54 H55 H56 H57 H58 H59 H60 H61 H62 H63 H64 H65 H66 H67 H68 H69 H70 H71 H354 H353 H352 H351 H350 H349 H348 H347 H346 H345 H344 H343 H342 H341 H340 H339 H338 H337 H336 H335 H334 H333 H332 H331 H330 H329 H328 H327 H326 H325 H324 H323 H322 H321 H320 H319 H318 H317 H316 H315 H314 H313 H312 H311 H310 H309 H308 H307 H306 H305 H304 H303 H302 H301 H300 H299 H298 H297 H296 H295 H294 H293 H292 H291 H290 H289 H288 H287 H286 H285 H284 H283 H282 H281 H280 H279 H278 H277 H276 H275 H274 H273 H272 H271 H270 H269 H268 H267 H266 H265 H264 H263 H262 H261 H260 H259 H258 H257 H256 H255 H254 H253 H252 H251 H250 H249 H248 H247 H246 H245 H244 H243 H242 H241 H240 H239 H238 H237 H236 H235 H234 H233 H232 H231 H230 H229 H228 H227 H226 H225 H224 H223 H222 H221 H220 H219 H218 H217 H216 H215 H214 H213 H212 H211 H210 H209 H208 H207 H206 H205 H204 H203 H202 H201 H200 H199 H198 H197 H196 H195 H194 H193 H192 H191 H190 H189 H188 H187 H186 H185 H184 H183 H182 H181 H180 H179 H178 H177 H176 H175 H174 H173 H172 H171 H170 H169 H168 H167 H166 H165 H164 H163 H162 H161 H160 H159 H158 H157 H156 H155 H154 H153 H152 H151 H150 H149 H148 H147 H146 H145 H144 H143 H142 H141 H140 H139 H138 H137 H136 H135 H134 H133 H132 H131 H130 H129 H128 H127 H126 H125 H124 H123 H122 H121 H120 H119 H118 H117 H116 H115 H114 H113 H112 H111 H110 H109 H108 H418 H417 H416 H415 H414 H413 H412 H411 H410 H409 H408 H407 H406 H405 H404 H403 H402 H401 H400 H399 H398 H397 H396 H395 H394 H393 H392 H391 H390 H389 H388 H387 H386 H385 H384 H383 H382 H381 H380 H379 H378 H377 H376 H375 H374 H373 H372 H371 H370 H369 H368 H367 H366 H365 H364 H363 H362 H361 H360 H359 H358 H357 H356 H355 H72 H73 H74 H75 H76 H77 H78 H79 H80 H81 H82 H83 H84 H85 H86 H87 H88 H89 H90 H91 H92 H93 H94 H95 H96 H97 H98 H99 H100 H101 H102 H103 H104 H105 H106 H107 H419 H420 H421 H422 H423 H424 H425 H426 H427 H428 H429 H430 H431 H432 H433 H434 H435 H436 H437 H438 H439 H440 H441 H442 H443 H444 H445 H446 H447 H448 H449 H450 H451 H452 H453 H454 H455 H456 H457 H458 H459 H460 H461 H462 H463 H464 H465 H466 H467 H468 H469 H470 H471 H472 H473 H474 H475 H476 H477 H478 H479 H480 H481 H482 H483 H484 H485 H486 H487 H488
