Node	ChrID	GenesCount	Genes
Anc8_preWGD	Sp7(9)	166	C1 C2 C3 C4 C5 C6 C7 C8 C9 C10 C11 C12 C13 C14 C15 C16 C17 C18 C19 C20 C21 C22 C23 C24 C25 C26 C27 C28 C29 C30 C31 C32 C33 C34 C35 C36 C37 C38 C39 C40 C41 C42 C43 C44 C45 C46 C47 C48 C49 C50 C51 C52 C53 C54 C55 C56 C57 C58 C59 C60 C61 C62 C63 C64 C65 C66 C67 C68 C69 C70 C71 C72 C73 C74 C75 C76 C77 C78 C79 C80 C81 C82 C83 C84 C85 C86 C87 C88 C89 C90 C91 C92 C93 C94 C95 C96 C97 C98 C99 C100 C101 C102 C103 C104 C105 C106 C107 C108 C109 C110 C111 C112 C113 C114 C115 C116 C117 C118 C119 C120 C121 C122 C123 C124 C125 C126 C127 C128 C129 C130 C131 C132 C133 C134 C135 C136 C137 C138 C139 C140 C141 C142 C143 C144 C145 C146 C147 C148 C149 C150 C151 C152 C153 C154 C155 C156 C157 C158 C159 C160 C161 C162 C163 C164 C165 C166
Anc8	Sp3(9)	830	D1 D2 D3 D4 D5 D6 D7 D8 D9 D10 D11 D12 D13 D14 D15 D16 D17 D18 D19 D20 D21 D22 D23 D24 D25 D26 D27 D28 D29 D30 D31 D32 D33 D34 D35 D36 D37 D38 D39 D40 D41 D42 D43 D44 D45 D46 D47 D48 D49 D50 D51 D52 D53 D54 D55 D56 D57 D58 D59 D60 D61 D62 D63 D64 D65 D66 D67 D68 D69 D70 D71 D72 D73 D74 D75 D76 D77 D78 D79 D80 D81 D82 D83 D84 D85 D86 D87 D88 D89 D90 D91 D92 D93 D94 D95 D96 D97 D98 D99 D100 D101 D102 D103 D104 D105 D106 D107 D108 D109 D110 D111 D112 D113 D114 D115 D116 D117 D118 D119 D120 D121 D122 D123 D124 D125 D126 D127 D128 D129 D130 D131 D132 D133 D134 D135 D136 D137 D138 D139 D140 D141 D142 D143 D144 D145 D146 D147 D148 D149 D150 D151 D152 D153 D154 D155 D156 D157 D158 D159 D160 D161 D162 D163 D164 D165 D166 D167 D168 D169 D170 D171 D172 D173 D174 D175 D176 D177 D178 D179 D180 D181 D182 D183 D184 D185 D186 D187 D188 D189 D190 D191 D192 D193 D194 D195 D196 D197 D198 D199 D200 D201 D202 D203 D204 D205 D206 D207 D208 D209 D210 D211 D212 D213 D214 D215 D216 D217 D218 D219 D220 D221 D222 D223 D224 D225 D226 D227 D228 D229 D230 D231 D232 D233 D234 D235 D236 D237 D238 D239 D240 D241 D242 D243 D244 D245 D246 D247 D248 D249 D250 D251 D252 D253 D254 D255 D256 D257 D258 D259 D260 D261 D262 D263 D264 D265 D266 D267 D268 D269 D270 D271 D272 D273 D274 D275 D276 D277 D278 D279 D280 D281 D282 D283 D284 D285 D286 D287 D288 D289 D290 D291 D292 D293 D294 D295 D296 D297 D298 D299 D300 D301 D302 D303 D304 D305 D306 D307 D308 D309 D310 D311 D312 D313 D314 D315 D316 D317 D318 D319 D320 D321 D322 D323 D324 D325 D326 D327 D328 D329 D330 D331 D332 D333 D334 D335 D336 D337 D338 D339 D340 D341 D342 D343 D344 D345 D346 D347 D348 D349 D350 D351 D352 D353 D354 D355 D356 D357 D358 D359 D360 D361 D362 D363 D364 D365 D366 D367 D368 D369 D370 D371 D372 D373 D374 D375 D376 D377 D378 D379 D380 D381 D382 D383 D384 D385 D386 D387 D388 D389 D390 D391 D392 D393 D394 D395 D396 D397 D398 D399 D400 D401 D402 D403 D404 D405 D406 D407 D408 D409 D410 D411 D412 D413 D414 D415 D416 D417 D418 D419 D420 D421 D422 D423 D424 D425 D426 D427 D428 D429 D430 D431 D432 D433 D434 D435 D436 D437 D438 D439 D440 D441 D442 D443 D444 D445 D446 D447 D448 D449 D450 D451 D452 D453 D454 D455 D456 D457 D458 D459 D460 D461 D462 D463 D464 D465 D466 D467 D468 D469 D470 D471 D472 D473 D474 D475 D476 D477 D478 D479 D480 D481 D482 D483 D484 D485 D486 D487 D488 D489 D490 D491 D492 D493 D494 D495 D496 D497 D498 D499 D500 D501 D502 D503 D504 D505 D506 D507 D508 D509 D510 D511 D512 D513 D514 D515 D516 D517 D518 D519 D520 D521 D522 D523 D524 D525 D526 D527 D528 D529 D530 D531 D532 D533 D534 D535 D536 D537 D538 D539 D540 D541 D542 D543 D544 D545 D546 D547 D548 D549 D550 D551 D552 D553 D554 D555 D556 D557 D558 D559 D560 D561 D562 D563 D564 D565 D566 D567 D568 D569 D570 D571 D572 D573 D574 D575 D576 D577 D578 D579 L41 L42 L43 L44 L45 L46 L47 L48 L49 L50 L51 L52 L53 L54 L55 L56 L57 L58 L59 L60 L61 L62 L63 L64 L65 L66 L67 L68 L69 L70 L71 L72 L73 L74 L75 L76 L77 L78 L79 L80 L81 L82 L83 L84 L85 L86 L87 L88 L89 L90 L91 L92 L93 L94 L95 L96 L97 L98 L99 L100 L101 L102 L103 L104 L105 L106 L107 L108 L109 L110 L111 L112 L113 L114 L115 L116 L117 L118 L119 L120 L121 L122 L123 L124 L125 L126 L127 L128 L129 L130 L131 L132 L133 L134 L135 L136 L137 L138 L139 L140 L141 L142 L143 L144 L145 L146 L147 L148 L149 L150 L151 L152 L153 L154 L155 L156 L157 L158 L159 L160 L161 L162 L163 L164 L165 L166 L167 L168 L169 L170 L171 L172 L173 L174 L175 L176 L177 L178 L179 L180 L181 L182 L183 L184 L185 L186 L187 L188 L189 L190 L191 L192 L193 L194 L195 L196 L197 L198 L199 L200 L201 L202 L203 L204 L205 L206 L207 L208 L209 L210 L211 L212 L213 L214 L215 L216 L217 L218 L219 L220 L221 L222 L223 L224 L225 L226 L227 L228 L229 L230 L231 L232 L233 L234 L235 L236 L237 L238 L239 L240 L241 L242 L243 L244 L245 L246 L247 L248 L249 L250 L251 L252 L253 L254 L255 L256 L257 L258 L259 L260 L261 L262 L263 L264 L265 L266 L267 L268 L269 L270 L271 L272 L273 L274 L275 L276 L277 L278 L279 L280 L281 L282 L283 L284 L285 L286 L287 L288 L289 L290 L291
Anc8	Sp5(8)	534	E1 E2 E3 E4 E5 E6 E7 E8 E9 E10 E11 E12 E13 E14 E15 E16 E17 E18 E19 E20 E21 E22 E23 E24 E25 E26 E27 E28 E29 E30 E31 E32 E33 E34 E35 E36 E37 E38 E39 E40 E41 E42 E43 E44 E45 E46 E47 E48 E49 E50 E51 E52 E53 E54 E55 E56 E57 E58 E59 E60 E61 E62 E63 E64 E65 E66 E67 E68 E69 E70 E71 E72 E73 E74 E75 E76 E77 E78 E79 E80 E81 E82 E83 E84 E85 E86 E87 E88 K175 K176 K177 K178 K179 K180 K181 K182 K183 K184 K185 K186 K187 K188 K189 K190 K191 K192 K193 K194 K195 K196 K197 K198 K199 K200 K201 K202 K203 K204 K205 K206 K207 K208 K209 K210 K211 K212 K213 K214 K215 K216 K217 K218 K219 K220 K221 K222 K223 K224 K225 K226 K227 K228 K229 K230 K231 K232 K233 K234 K235 K236 K237 K238 K239 K240 K241 K242 K243 K244 K245 K246 K247 K248 K249 K250 K251 K252 K253 K254 K255 K256 K257 K258 K259 K260 K261 K262 K263 K264 K265 K266 K267 K268 K269 K270 K271 K272 K273 K274 K275 K276 K277 K278 K279 K280 K281 K282 K283 K284 K285 K286 K287 K288 K289 K290 K291 K292 K293 K294 K295 K296 K297 K298 K299 K300 K301 K302 K303 K304 K305 K306 K307 K308 K309 K310 K311 K312 K313 K314 K315 K316 K317 K318 K319 K320 K321 K322 K323 K324 K325 K326 K327 K328 K329 K330 K331 K332 K333 K334 K335 K336 K337 K338 K339 K340 K341 K342 K343 K344 K345 K346 K347 K348 K349 K350 K351 K352 K353 K354 K355 K356 K357 K358 K359 K360 K361 K362 K363 K364 K365 K366 K367 K368 K369 K370 K371 K372 K373 K374 K375 K376 K377 K378 K379 K380 K381 K382 K383 K384 K385 K386 K387 K388 K389 K390 K391 K392 K393 K394 K395 K396 K397 K398 K399 K400 K401 K402 K403 K404 K405 K406 K407 K408 K409 K410 K411 K412 K413 K414 K415 K416 K417 K418 K419 K420 K421 K422 K423 K424 K425 K426 K427 K428 K429 K430 K431 K432 K433 K434 K435 K436 K437 K438 K439 K440 K441 K442 K443 K444 K445 K446 K447 K448 K449 K450 K451 K452 K453 K454 K455 K456 K457 K458 K459 K460 K461 K462 K463 K464 K465 K466 K467 K468 K469 K470 K471 K472 K473 K474 K475 K476 K477 K478 K479 K480 K481 K482 K483 K484 K485 K486 K487 K488 K489 K490 K491 K492 K493 K494 K495 K496 K497 K498 K499 K500 K501 K502 K503 K504 K505 K506 K507 K508 K509 K510 K511 K512 K513 K514 K515 K516 K517 K518 K519 K520 K521 K522 K523 K524 K525 K526 K527 K528 K529 K530 K531 K532 K533 K534 K535 K536 K537 K538 K539 K540 K541 K542 K543 K544 K545 K546 K547 K548 K549 K550 K551 K552 K553 K554 K555 K556 K557 K558 K559 K560 K561 K562 K563 K564 K565 K566 K567 K568 K569 K570 K571 K572 K573 K574 K575 K576 K577 K578 K579 K580 K581 K582 K583 K584 K585 K586 K587 K588 K589 K590 K591 K592 K593 K594 K595 K596 K597 K598 K599 K600 K601 K602 K603 K604 K605 K606 K607 K608 K609 K610 K611 K612 K613 K614 K615 K616 K617 K618 K619 K620
Anc8	Sp7(1)	909	A1 A2 A3 A4 A5 A6 A7 A8 A9 A10 A11 A12 A13 A14 A15 A16 A17 A18 A19 A20 A21 A22 A23 A24 A25 A26 A27 A28 A29 A30 A31 A32 A33 A34 A35 A36 A37 A38 A39 A40 A41 A42 A43 A44 A45 A46 A47 A48 A49 A50 A51 A52 A53 A54 A55 A56 A57 A58 A59 A60 A61 A62 A63 A64 A65 A66 A67 A68 A69 A70 A71 A72 A73 A74 A75 A76 A77 A78 A79 A80 A81 A82 A83 A84 A85 A86 A87 A88 A89 A90 A91 A92 A93 A94 A95 A96 A97 A98 A99 A100 A101 A102 A103 A104 A105 A106 A107 A108 A109 A110 A111 A112 A113 A114 A115 A116 A117 A118 A119 A120 A121 A122 A123 A124 A125 A126 A127 A128 A129 A130 A131 A132 A133 A134 A135 A136 A137 A138 A139 A140 A141 A142 A143 A144 A145 A146 A147 A148 A149 A150 A151 A152 A153 A154 A155 A156 A157 A158 A159 A160 A161 A162 A163 A164 A165 A166 A167 A168 A169 A170 A171 A172 A173 A174 A175 A176 A177 A178 A179 A180 A181 A182 A183 A184 A185 A186 A187 A188 A189 A190 A191 A192 A193 A194 A195 A196 A197 A198 A199 A200 A201 A202 A203 A204 A205 A206 A207 A208 A209 A210 A211 A212 A213 A214 A215 A216 A217 A218 A219 A220 A221 A222 A223 A224 A225 A226 A227 A228 A229 A230 A231 A232 A233 A234 A235 A236 A237 A238 A239 A240 A241 A242 A243 A244 A245 A246 A247 A248 A249 A250 A251 A252 A253 A254 A255 A256 A257 A258 A259 A260 A261 A262 A263 A264 A265 A266 A267 A268 A269 A270 A271 A272 A273 A274 A275 A276 A277 A278 A279 A280 A281 A282 A283 A284 A285 A286 A287 A288 A289 A290 A291 A292 A293 A294 A295 A296 A297 A298 A299 A300 A301 A302 A303 A304 A305 A306 A307 A308 A309 A310 A311 A312 A313 A314 A315 A316 A317 A318 A319 A320 A321 A322 A323 A324 A325 A326 A327 A328 A329 A330 A331 A332 A333 A334 A335 A336 A337 A338 A339 A340 A341 A342 A343 A344 A345 A346 A347 A348 A349 A350 A351 A352 A353 A354 A355 A356 A357 A358 A359 A360 A361 A362 A363 A364 A365 A366 A367 A368 A369 A370 A371 A372 A373 A374 A375 A376 A377 A378 A379 A380 A381 A382 A383 A384 A385 A386 A387 A388 A389 A390 A391 A392 A393 A394 A395 A396 A397 A398 A399 A400 A401 A402 A403 A404 A405 A406 A407 A408 A409 A410 A411 A412 A413 A414 A415 A416 A417 A418 A419 A420 A421 A422 A423 A424 A425 A426 A427 A428 A429 A430 A431 A432 A433 A434 A435 A436 A437 A438 A439 A440 A441 A442 A443 A444 A445 A446 A447 A448 A449 A450 A451 A452 A453 A454 A455 A456 A457 A458 A459 A460 A461 A462 A463 A464 A465 A466 A467 A468 A469 A470 A471 A472 A473 A474 A475 A476 A477 A478 A479 A480 A481 A482 A483 A484 A485 A486 A487 A488 A489 A490 A491 A492 A493 A494 A495 A496 A497 A498 A499 A500 A501 A502 A503 A504 A505 A506 A507 A508 A509 A510 A511 A512 A513 A514 A515 A516 A517 A518 A519 A520 A521 A522 A523 A524 A525 A526 A527 A528 A529 A530 A531 A532 A533 A534 A535 A536 A537 A538 A539 A540 A541 A542 A543 A544 A545 A546 A547 A548 A549 A550 A551 A552 A553 A554 A555 A556 A557 A558 A559 A560 A561 A562 A563 A564 A565 A566 A567 A568 A569 A570 A571 A572 A573 A574 A575 A576 A577 A578 A579 A580 A581 A582 A583 A584 A585 A586 A587 A588 A589 A590 A591 A592 A593 A594 A595 A596 J257 J256 J255 J254 J253 J252 J251 J250 J249 J248 J247 J246 J245 J244 J243 J242 J241 J240 J239 J238 J237 J236 J235 J234 J233 J232 J231 J230 J229 J228 J227 J226 J225 J224 J223 J222 J221 J220 J219 J218 J217 J216 J215 J214 J213 J212 J211 J210 J209 J208 J207 J206 J205 J204 J203 J202 J201 J200 J199 J198 J197 J196 J195 J194 J193 J192 J191 J190 J189 J188 J187 J186 J185 J184 J183 J182 J181 J180 J179 J178 J177 J176 J175 J174 J173 J172 J171 J170 J169 J168 J167 J166 J165 J164 J163 J162 J161 J160 J159 J158 J157 J156 J155 J154 J153 J152 J151 J150 J149 J148 J147 J146 J145 J144 J143 J142 J141 J140 J139 J138 J137 J136 J135 J134 J133 J132 J131 J130 J129 J128 J127 J126 J125 J124 J123 J122 J121 J120 J119 J118 J117 J116 J115 J114 J113 J112 J111 F166 F165 F164 F163 F162 F161 F160 F159 F158 F157 F156 F155 F154 F153 F152 F151 F150 F149 F148 F147 F146 F145 F144 F143 F142 F141 F140 F139 F138 F137 F136 F135 F134 F133 F132 F131 F130 F129 F128 F127 F126 F125 F124 F123 F122 F121 F120 F119 F118 F117 F116 F115 F114 F113 F112 F111 F110 F109 F108 F107 F106 F105 F104 F103 F102 F101 F100 F99 F98 F97 F96 F95 F94 F93 F92 F91 F90 F89 F88 F87 F86 F85 F84 F83 F82 F81 F80 F79 F78 F77 F76 F75 F74 F73 F72 F71 F70 F69 F68 F67 F66 F65 F64 F63 F62 F61 F60 F59 F58 F57 F56 F55 F54 F53 F52 F51 F50 F49 F48 F47 F46 F45 F44 F43 F42 F41 F40 F39 F38 F37 F36 F35 F34 F33 F32 F31 F30 F29 F28 F27 F26 F25 F24 F23 F22 F21 F20 F19 F18 F17 F16 F15 F14 F13 F12 F11 F10 F9 F8 F7 F6 F5 F4 F3 F2 F1
Anc8	Sp9(5)	417	G1 G2 G3 G4 G5 G6 G7 G8 G9 G10 G11 G12 G13 G14 G15 G16 G17 G18 G19 G20 G21 G22 G23 G24 G25 G26 G27 G28 G29 G30 G31 G32 G33 G34 G35 G36 G37 G38 G39 G40 G41 G42 G43 G44 G45 G46 G47 G48 G49 G50 G51 G52 G53 G54 G55 G56 G57 G58 G59 G60 G61 G62 G63 G64 G65 G66 G67 G68 G69 G70 G71 G72 G73 G74 G75 G76 G77 G78 G79 G80 G81 G82 G83 G84 G85 G86 G87 G88 G89 G90 G91 G92 G93 G94 G95 G96 G97 G98 G99 G100 G101 G102 G103 G104 G105 G106 G107 G108 G109 G110 G111 G112 G113 G114 G115 G116 G117 G118 G119 G120 G121 G122 G123 G124 G125 G126 G127 G128 G129 G130 G131 G132 G133 G134 G135 G136 G137 G138 G139 G140 G141 G142 G143 G144 G145 G146 G147 G148 G149 G150 G151 G152 G153 G154 G155 G156 G157 G158 G159 G160 G161 G162 G163 G164 G165 G166 G167 G168 G169 G170 G171 G172 G173 G174 G175 G176 G177 G178 G179 G180 G181 G182 G183 G184 G185 G186 G187 G188 G189 G190 G191 G192 G193 G194 G195 G196 G197 G198 G199 G200 G201 G202 G203 G204 G205 G206 G207 G208 G209 G210 G211 G212 G213 G214 G215 G216 G217 G218 G219 G220 G221 G222 G223 G224 G225 G226 G227 G228 G229 G230 G231 G232 G233 G234 G235 G236 G237 G238 G239 G240 G241 G242 G243 G244 G245 G246 G247 G248 G249 G250 G251 G252 G253 G254 G255 G256 G257 G258 G259 G260 G261 G262 G263 G264 G265 G266 G267 G268 G269 G270 G271 G272 G273 G274 G275 G276 G277 G278 G279 G280 G281 G282 G283 G284 G285 G286 G287 G288 G289 G290 G291 G292 G293 G294 G295 G296 G297 G298 G299 G300 G301 G302 G303 G304 G305 G306 G307 G308 G309 G310 G311 G312 G313 G314 G315 G316 G317 G318 G319 G320 G321 G322 G323 G324 G325 G326 G327 G328 G329 G330 G331 G332 G333 G334 G335 G336 G337 G338 G339 G340 G341 G342 G343 G344 G345 G346 G347 G348 G349 G350 G351 G352 G353 G354 G355 G356 G357 G358 G359 G360 G361 G362 G363 G364 G365 G366 G367 G368 G369 G370 G371 G372 G373 G374 G375 G376 G377 G378 G379 G380 G381 G382 G383 G384 G385 G386 G387 G388 G389 G390 G391 G392 G393 G394 G395 G396 G397 G398 G399 G400 G401 G402 G403 G404 G405 G406 G407 G408 G409 G410 G411 G412 G413 G414 G415 G416 G417
Anc8	Sp9(6)	786	H1 H2 H3 H4 H5 H6 H7 H8 H9 H10 H11 H12 H13 H14 H15 H16 H17 H18 H19 H20 H21 H22 H23 H24 H25 H26 H27 H28 H29 H30 H31 H32 H33 H34 H35 H36 H37 H38 H39 H40 H41 H42 H43 H44 H45 H46 H47 H48 H49 H50 H51 H52 H53 H54 H55 H56 H57 H58 H59 H60 H61 H62 H63 H64 H65 H66 H67 H68 H69 H70 H71 H72 H73 H74 H75 H76 H77 H78 H79 H80 H81 H82 H83 H84 H85 H86 H87 H88 H89 H90 H91 H92 H93 H94 H95 H96 H97 H98 H99 H100 H101 H102 H103 H104 H105 H106 H107 H108 H109 H110 H111 H112 H113 H114 H115 H116 H117 H118 H119 H120 H121 H122 H123 H124 H125 H126 H127 H128 H129 H130 H131 H132 H133 H134 H135 H136 H137 H138 H139 H140 H141 H142 H143 H144 H145 H146 H147 H148 H149 H150 H151 H152 H153 H154 H155 H156 H157 H158 H159 H160 H161 H162 H163 H164 H165 H166 H167 H168 H169 H170 H171 H172 H173 H174 H175 H176 H177 H178 H179 H180 H181 H182 H183 H184 H185 H186 H187 H188 H189 H190 H191 H192 H193 H194 H195 H196 H197 H198 H199 H200 H201 H202 H203 H204 H205 H206 H207 H208 H209 H210 H211 H212 H213 H214 H215 H216 H217 H218 H219 H220 H221 H222 H223 H224 H225 H226 H227 H228 H229 H230 H231 H232 H233 H234 H235 H236 H237 H238 H239 H240 H241 H242 H243 H244 H245 H246 H247 H248 H249 H250 H251 H252 H253 H254 H255 H256 H257 H258 H259 H260 H261 H262 H263 H264 H265 H266 H267 H268 H269 H270 H271 H272 H273 H274 H275 H276 H277 H278 H279 H280 H281 H282 H283 H284 H285 H286 H287 H288 H289 H290 H291 H292 H293 H294 H295 H296 H297 H298 H299 H300 H301 H302 H303 H304 H305 H306 H307 H308 H309 H310 H311 H312 H313 H314 H315 H316 H317 H318 H319 H320 H321 H322 H323 H324 H325 H326 H327 H328 H329 H330 H331 H332 H333 H334 H335 H336 H337 H338 H339 H340 H341 H342 H343 H344 H345 H346 H347 H348 H349 H350 H351 H352 H353 H354 H355 H356 H357 H358 H359 H360 H361 H362 H363 H364 H365 H366 H367 H368 H369 H370 H371 H372 H373 H374 H375 H376 H377 H378 H379 H380 H381 H382 H383 H384 H385 H386 H387 H388 H389 H390 H391 H392 H393 H394 H395 H396 H397 H398 H399 H400 H401 H402 H403 H404 H405 H406 H407 H408 H409 H410 H411 H412 H413 H414 H415 H416 H417 H418 H419 H420 H421 H422 H423 H424 H425 H426 H427 H428 H429 H430 H431 H432 H433 H434 H435 H436 H437 H438 H439 H440 H441 H442 H443 H444 H445 H446 H447 H448 H449 H450 H451 H452 H453 H454 H455 H456 H457 H458 H459 H460 H461 H462 H463 H464 H465 H466 H467 H468 H469 H470 H471 H472 H473 H474 H475 H476 H477 H478 H479 H480 H481 H482 H531 H530 H529 H528 H527 H526 H525 H524 H523 H522 H521 H520 H519 H518 H517 H516 H515 H514 H513 H512 H511 H510 H509 H508 H507 H506 H505 H504 H503 H502 H501 H500 H499 H498 H497 H496 H495 H494 H493 H492 H491 H490 H489 H488 H487 H486 H485 H484 H483 H532 H533 H534 H535 H536 H537 H538 H539 H540 H541 H542 H543 H544 H545 H546 H547 H548 H549 H550 H551 H552 H553 H554 H555 H556 H557 H558 H559 H560 H561 H562 H563 H564 H565 H566 H567 H568 H569 H570 H571 H572 H573 H574 H575 H576 H577 H578 H579 H580 H581 H582 H583 H584 H585 H586 H587 H588 H589 H590 H591 H592 H593 H594 H595 H596 H597 H598 H599 H600 H601 H602 H603 H604 H605 H606 H607 H608 H609 H610 H611 H612 H613 H614 H615 H616 H617 H618 H619 H620 H621 H622 H623 H624 H625 H626 H627 H628 H629 H630 H631 H632 H633 H634 H635 H636 H637 H638 H639 H640 H641 H642 H643 H644 H645 H646 H647 H648 H649 H650 H651 H652 H653 H654 H655 H656 H657 H658 H659 H660 H661 H662 H663 H664 H665 H666 H667 H668 H669 H670 H671 H672 H673 H674 H675 H676 H677 H678 H679 H680 H681 H682 H683 H684 H685 H686 H687 H688 H689 H690 H691 H692 H693 H694 H695 H696 H697 H698 H699 H700 H701 H702 H703 H704 H705 H706 H707 H708 H709 H710 H711 H712 H713 H714 H715 H716 H717 H718 H719 H720 H721 H722 H723 H724 H725 H726 H727 H728 H729 H730 H731 H732 H733 H734 H735 H736 H737 H738 H739 H740 H741 H742 H743 H744 H745 H746 H747 H748 H749 H750 H751 H752 H753 H754 H755 H756 H757 H758 H759 H760 H761 H762 H763 H764 H765 H766 H767 H768 H769 H770 H771 H772 H773 H774 H775 H776 H777 H778 H779 H780 H781 H782 H783 H784 H785 H786
Anc8	Sp7(27)	928	I1 I2 I3 I4 I5 I6 I7 I8 I9 I10 I11 I12 I13 I14 I15 I16 I17 I18 I19 I20 I21 I22 I23 I24 I25 I26 I27 I28 I29 I30 I31 I32 I33 I34 I35 I36 I37 I38 I39 I40 I41 I42 I43 I44 I45 I46 I47 I48 I49 I50 I51 I52 I53 I54 I55 I56 I57 I58 I59 I60 I61 I62 I63 I64 I65 I66 I67 I68 I69 I70 I71 I72 I73 I74 I75 I76 I77 I78 I79 I80 I81 I82 I83 I84 I85 I86 I87 I88 I89 I90 I91 I92 I93 I94 I95 I96 I97 I98 I99 I100 I101 I102 I103 I104 I105 I106 I107 I108 I109 I110 I111 I112 I113 I114 I115 I116 I117 I118 I119 I120 I121 I122 I123 I124 I125 I126 I127 I128 I129 I130 I131 I132 I133 I134 I135 I136 I137 I138 I139 I140 I141 I142 I143 I144 I145 I146 I147 I148 I149 I150 I151 I152 I153 I154 I155 I156 I157 I158 I159 I160 I161 I162 I163 I164 I165 I166 I167 I168 I169 I170 I171 I172 I173 I174 I175 I176 I177 I178 I179 I180 I181 I182 I183 I184 I185 I186 I187 I188 I189 I190 I191 I192 I193 I194 I195 I196 I197 I198 I199 I200 I201 I202 I203 I204 I205 I206 I207 I208 I209 I210 I211 I212 I213 I214 I215 I216 I217 I218 I219 I220 I221 I222 I223 I224 I225 I226 I227 I228 I229 I230 I231 I232 I233 I234 I235 I236 I237 I238 I239 I240 I241 I242 I243 I244 I245 I246 I247 I248 I249 I250 I251 I252 I253 I254 I255 I256 I257 I258 I259 I260 I261 I262 I263 I264 I265 I266 I267 I268 I269 I270 I271 I272 I273 I274 I275 I276 I277 I278 I279 I280 I281 I282 I283 I284 I285 I286 I287 I288 I289 I290 I291 I292 I293 I294 I295 I296 I297 I298 I299 I300 I301 I302 I303 I304 I305 I306 I307 I308 I309 I310 I311 I312 I313 I314 I315 I316 I317 I318 I319 I320 I321 I322 I323 I324 I325 I326 I327 I328 I329 I330 I331 I332 I333 I334 I335 I336 I337 I338 I339 I340 I341 I342 I343 I344 I345 I346 I347 I348 I349 I350 I351 I352 I353 I354 I355 I356 I357 I358 I359 I360 I361 I362 I363 I364 I365 I366 I367 I368 I369 I370 I371 I372 I373 I374 I375 I376 I377 I378 I379 I380 I381 I382 I383 I384 I385 I386 I387 I388 I389 I390 I391 I392 I393 I394 I395 I396 I397 I398 I399 I400 I401 I402 I403 I404 I405 I406 I407 I408 I409 I410 I411 I412 I413 I414 I415 I416 I417 I418 I419 I420 I421 I422 I423 I424 I425 I426 I427 I428 I429 I430 I431 I432 I433 I434 I435 I436 I437 I438 I439 I440 I441 I442 I443 I444 I445 I446 I447 I448 I449 I450 I451 I452 I453 I454 I455 I456 I457 I458 I459 I460 I461 I462 I463 I464 I1 I2 I3 I4 I5 I6 I7 I8 I9 I10 I11 I12 I13 I14 I15 I16 I17 I18 I19 I20 I21 I22 I23 I24 I25 I26 I27 I28 I29 I30 I31 I32 I33 I34 I35 I36 I37 I38 I39 I40 I41 I42 I43 I44 I45 I46 I47 I48 I49 I50 I51 I52 I53 I54 I55 I56 I57 I58 I59 I60 I61 I62 I63 I64 I65 I66 I67 I68 I69 I70 I71 I72 I73 I74 I75 I76 I77 I78 I79 I80 I81 I82 I83 I84 I85 I86 I87 I88 I89 I90 I91 I92 I93 I94 I95 I96 I97 I98 I99 I100 I101 I102 I103 I104 I105 I106 I107 I108 I109 I110 I111 I112 I113 I114 I115 I116 I117 I118 I119 I120 I121 I122 I123 I124 I125 I126 I127 I128 I129 I130 I131 I132 I133 I134 I135 I136 I137 I138 I139 I140 I141 I142 I143 I144 I145 I146 I147 I148 I149 I150 I151 I152 I153 I154 I155 I156 I157 I158 I159 I160 I161 I162 I163 I164 I165 I166 I167 I168 I169 I170 I171 I172 I173 I174 I175 I176 I177 I178 I179 I180 I181 I182 I183 I184 I185 I186 I187 I188 I189 I190 I191 I192 I193 I194 I195 I196 I197 I198 I199 I200 I201 I202 I203 I204 I205 I206 I207 I208 I209 I210 I211 I212 I213 I214 I215 I216 I217 I218 I219 I220 I221 I222 I223 I224 I225 I226 I227 I228 I229 I230 I231 I232 I233 I234 I235 I236 I237 I238 I239 I240 I241 I242 I243 I244 I245 I246 I247 I248 I249 I250 I251 I252 I253 I254 I255 I256 I257 I258 I259 I260 I261 I262 I263 I264 I265 I266 I267 I268 I269 I270 I271 I272 I273 I274 I275 I276 I277 I278 I279 I280 I281 I282 I283 I284 I285 I286 I287 I288 I289 I290 I291 I292 I293 I294 I295 I296 I297 I298 I299 I300 I301 I302 I303 I304 I305 I306 I307 I308 I309 I310 I311 I312 I313 I314 I315 I316 I317 I318 I319 I320 I321 I322 I323 I324 I325 I326 I327 I328 I329 I330 I331 I332 I333 I334 I335 I336 I337 I338 I339 I340 I341 I342 I343 I344 I345 I346 I347 I348 I349 I350 I351 I352 I353 I354 I355 I356 I357 I358 I359 I360 I361 I362 I363 I364 I365 I366 I367 I368 I369 I370 I371 I372 I373 I374 I375 I376 I377 I378 I379 I380 I381 I382 I383 I384 I385 I386 I387 I388 I389 I390 I391 I392 I393 I394 I395 I396 I397 I398 I399 I400 I401 I402 I403 I404 I405 I406 I407 I408 I409 I410 I411 I412 I413 I414 I415 I416 I417 I418 I419 I420 I421 I422 I423 I424 I425 I426 I427 I428 I429 I430 I431 I432 I433 I434 I435 I436 I437 I438 I439 I440 I441 I442 I443 I444 I445 I446 I447 I448 I449 I450 I451 I452 I453 I454 I455 I456 I457 I458 I459 I460 I461 I462 I463 I464
Anc8	Sp9(8)	519	J1 J2 J3 J4 J5 J6 J7 J8 J9 J10 J11 J12 J13 J14 J15 J16 J17 J18 J19 J20 J21 J22 J23 J24 J25 J26 J27 J28 J29 J30 J31 J32 J33 J34 J35 J36 J37 J38 J39 J40 J41 J42 J43 J44 J45 J46 J47 J48 J49 J50 J51 J52 J53 J54 J55 J56 J57 J58 J59 J60 J61 J62 J63 J64 J65 J66 J67 J68 J69 J70 J71 J72 J73 J74 J75 J76 J77 J78 J79 J80 J81 J82 J83 J84 J85 J86 J87 J88 J89 J90 J91 J92 J93 J94 J95 J96 J97 J98 J99 J100 J101 J102 J103 J104 J105 J106 J107 J108 J109 J110 F167 F168 F169 F170 F171 F172 F173 F174 F175 F176 F177 F178 F179 F180 F181 F182 F183 F184 F185 F186 F187 F188 F189 F190 F191 F192 F193 F194 F195 F196 F197 F198 F199 F200 F201 F202 F203 F204 F205 F206 F207 F208 F209 F210 F211 F212 F213 F214 F215 F216 F217 F218 F219 F220 F221 F222 F223 F224 F225 F226 F227 F228 F229 F230 F231 F232 F233 F234 F235 F236 F237 F238 F239 F240 F241 F242 F243 F244 F245 F246 F247 F248 F249 F250 F251 F252 F253 F254 F255 F256 F257 F258 F259 F260 F261 F262 F263 F264 F265 F266 F267 F268 F269 F270 F271 F272 F273 F274 F275 F276 F277 F278 F279 F280 F281 F282 F283 F284 F285 F286 F287 F288 F289 F290 F291 F292 F293 F294 F295 F296 F297 F298 F299 F300 F301 F302 F303 F304 F305 F306 F307 F308 F309 F310 F311 F312 F313 F314 F315 F316 F317 F318 F319 F320 F321 F322 F323 F324 F325 F326 F327 F328 F329 F330 F331 F332 F333 F334 F335 F336 F337 F338 F339 F340 F341 F342 F343 F344 F345 F346 F347 F348 F349 F350 F351 F352 F353 F354 F355 F356 F357 F358 F359 F360 F361 F362 F363 F364 F365 F366 F367 F368 F369 F370 F371 F372 F373 F374 F375 F376 F377 F378 F379 F380 F381 F382 F383 F384 F385 F386 F387 F388 F389 F390 F391 F392 F393 F394 F395 F396 F397 F398 F399 F400 F401 F402 F403 F404 F405 F406 F407 F408 F409 F410 F411 F412 F413 F414 F415 F416 F417 F418 F419 F420 F421 F422 F423 F424 F425 F426 F427 F428 F429 F430 F431 F432 F433 F434 F435 F436 F437 F438 F439 F440 F441 F442 F443 F444 F445 F446 F447 F448 F449 F450 F451 F452 F453 F454 F455 F456 F457 F458 F459 F460 F461 F462 F463 F464 F465 F466 F467 F468 F469 F470 F471 F472 F473 F474 F475 F476 F477 F478 F479 F480 F481 F482 F483 F484 F485 F486 F487 F488 F489 F490 F491 F492 F493 F494 F495 F496 F497 F498 F499 F500 F501 F502 F503 F504 F505 F506 F507 F508 F509 F510 F511 F512 F513 F514 F515 F516 F517 F518 F519 F520 F521 F522 F523 F524 F525 F526 F527 F528 F529 F530 F531 F532 F533 F534 F535 F536 F537 F538 F539 F540 F541 F542 F543 F544 F545 F546 F547 F548 F549 F550 F551 F552 F553 F554 F555 F556 F557 F558 F559 F560 F561 F562 F563 F564 F565 F566 F567 F568 F569 F570 F571 F572 F573 F574 F575
