Node	ChrID	GenesCount	Genes
Anc1_preWGD	Sp16(13)	729	H1 H2 H3 H4 H5 H6 H7 H8 H9 H10 H11 H12 H13 H14 H15 H16 H17 H18 H19 H20 H21 H22 H23 H24 H25 H26 H27 H28 H29 H30 H31 H32 H33 H34 H35 H36 H37 H38 H39 H40 H41 H42 H43 H44 H45 H46 H47 H48 H49 H50 H51 H52 H53 H54 H55 H56 H57 H58 H59 H60 H61 H62 H63 H64 H65 H66 H67 H68 H69 H70 H71 H72 H73 H74 H75 H76 H77 H78 H79 H80 H81 H82 H83 H84 H85 H86 H87 H88 H89 H90 H91 H92 H93 H94 H95 H96 H97 H98 H99 H100 H101 H102 H103 H104 H105 H106 H107 H108 H109 H110 H111 H112 H113 H114 H115 H116 H117 H118 H119 H120 H121 H122 H123 H124 H125 H126 H127 H128 H129 H130 H131 H132 H133 H134 H135 H136 H137 H138 H139 H140 H141 H142 H143 H144 H145 H146 H147 H148 H149 H150 H151 H152 H153 H154 H155 H156 H157 H158 H159 H160 H161 H162 H163 H164 H165 H166 H167 H168 H169 H170 H171 H172 H173 H174 H175 H176 H177 H178 H179 H180 H181 H182 H183 H184 H185 H186 H187 H188 H189 H190 H191 H192 H193 H194 H195 H196 H197 H198 H199 H200 H201 H202 H203 H204 H205 H206 H207 H208 H209 H210 H211 H212 H213 H214 H215 H216 H217 H218 H219 H220 H221 H222 H223 H224 H225 H226 H227 H228 H229 H230 H231 H232 H233 H234 H235 H236 H237 H238 H239 H240 H241 H242 H243 H244 H245 H246 H247 H248 H249 H250 H251 H252 H253 H254 H255 H256 H257 H258 H259 H260 H261 H262 H263 H264 H265 H266 H267 H268 H269 H270 H271 H272 H273 H274 H275 H276 H277 H278 H279 H280 H281 H282 H283 H284 H285 H286 H287 H288 H289 H290 H291 H292 H293 H294 H295 H296 H297 H298 H299 H300 H301 H302 H303 H304 H305 H306 H307 H308 H309 H310 H311 H312 H313 H314 H315 H316 H317 H318 H319 H320 H321 H322 H323 H324 H325 H326 H327 H328 H329 H330 H331 H332 H333 H334 H335 H336 H337 H338 H339 H340 H341 H342 H343 H344 H345 H346 H347 H348 H349 H350 H351 H352 H353 H354 H355 H356 H357 H358 H359 H360 H361 H362 H363 H364 H365 H366 H367 H368 H369 H370 H371 H372 H373 H374 H375 H376 H377 H378 H379 H380 H381 H382 H383 H384 H385 H386 H387 H388 H389 H390 H391 H392 H393 H394 H395 H396 H397 H398 H399 H400 H401 H402 H403 H404 H405 H406 H407 H408 H409 H410 H411 H412 H413 H414 H415 H416 H417 H418 H419 H420 H421 H422 H423 H424 H425 H426 H427 H428 H429 H430 H431 H432 H433 H434 H435 H436 H437 H438 H439 H440 H441 H442 H443 H444 H445 H446 H447 H448 H449 H450 H451 H452 H453 H454 H455 H456 H457 H458 H459 H460 H461 H462 H463 H464 H465 H466 H467 H468 H469 H470 H471 H472 H473 H474 H475 H476 H477 H478 H479 H480 H481 H482 H483 H484 H485 H486 H487 H488 H489 H490 H491 H492 H493 H494 H495 H496 H497 H498 H499 H500 H501 H502 H503 H504 H505 H506 H507 H508 H509 H510 H511 H512 H513 H514 H515 H516 H517 H518 H519 H520 H521 H522 H523 H524 H525 H526 H527 H528 H529 H530 H531 H532 H533 H534 H535 H536 H537 H538 H539 H540 H541 H542 H543 H544 H545 H546 H547 H548 H549 K180 K179 K178 K177 K176 K175 K174 K173 K172 K171 K170 K169 K168 K167 K166 K165 K164 K163 K162 K161 K160 K159 K158 K157 K156 K155 K154 K153 K152 K151 K150 K149 K148 K147 K146 K145 K144 K143 K142 K141 K140 K139 K138 K137 K136 K135 K134 K133 K132 K131 K130 K129 K128 K127 K126 K125 K124 K123 K122 K121 K120 K119 K118 K117 K116 K115 K114 K113 K112 K111 K110 K109 K108 K107 K106 K105 K104 K103 K102 K101 K100 K99 K98 K97 K96 K95 K94 K93 K92 K91 K90 K89 K88 K87 K86 K85 K84 K83 K82 K81 K80 K79 K78 K77 K76 K75 K74 K73 K72 K71 K70 K69 K68 K67 K66 K65 K64 K63 K62 K61 K60 K59 K58 K57 K56 K55 K54 K53 K52 K51 K50 K49 K48 K47 K46 K45 K44 K43 K42 K41 K40 K39 K38 K37 K36 K35 K34 K33 K32 K31 K30 K29 K28 K27 K26 K25 K24 K23 K22 K21 K20 K19 K18 K17 K16 K15 K14 K13 K12 K11 K10 K9 K8 K7 K6 K5 K4 K3 K2 K1
Anc1_preWGD	Sp7(27)	928	I1 I2 I3 I4 I5 I6 I7 I8 I9 I10 I11 I12 I13 I14 I15 I16 I17 I18 I19 I20 I21 I22 I23 I24 I25 I26 I27 I28 I29 I30 I31 I32 I33 I34 I35 I36 I37 I38 I39 I40 I41 I42 I43 I44 I45 I46 I47 I48 I49 I50 I51 I52 I53 I54 I55 I56 I57 I58 I59 I60 I61 I62 I63 I64 I65 I66 I67 I68 I69 I70 I71 I72 I73 I74 I75 I76 I77 I78 I79 I80 I81 I82 I83 I84 I85 I86 I87 I88 I89 I90 I91 I92 I93 I94 I95 I96 I97 I98 I99 I100 I101 I102 I103 I104 I105 I106 I107 I108 I109 I110 I111 I112 I113 I114 I115 I116 I117 I118 I119 I120 I121 I122 I123 I124 I125 I126 I127 I128 I129 I130 I131 I132 I133 I134 I135 I136 I137 I138 I139 I140 I141 I142 I143 I144 I145 I146 I147 I148 I149 I150 I151 I152 I153 I154 I155 I156 I157 I158 I159 I160 I161 I162 I163 I164 I165 I166 I167 I168 I169 I170 I171 I172 I173 I174 I175 I176 I177 I178 I179 I180 I181 I182 I183 I184 I185 I186 I187 I188 I189 I190 I191 I192 I193 I194 I195 I196 I197 I198 I199 I200 I201 I202 I203 I204 I205 I206 I207 I208 I209 I210 I211 I212 I213 I214 I215 I216 I217 I218 I219 I220 I221 I222 I223 I224 I225 I226 I227 I228 I229 I230 I231 I232 I233 I234 I235 I236 I237 I238 I239 I240 I241 I242 I243 I244 I245 I246 I247 I248 I249 I250 I251 I252 I253 I254 I255 I256 I257 I258 I259 I260 I261 I262 I263 I264 I265 I266 I267 I268 I269 I270 I271 I272 I273 I274 I275 I276 I277 I278 I279 I280 I281 I282 I283 I284 I285 I286 I287 I288 I289 I290 I291 I292 I293 I294 I295 I296 I297 I298 I299 I300 I301 I302 I303 I304 I305 I306 I307 I308 I309 I310 I311 I312 I313 I314 I315 I316 I317 I318 I319 I320 I321 I322 I323 I324 I325 I326 I327 I328 I329 I330 I331 I332 I333 I334 I335 I336 I337 I338 I339 I340 I341 I342 I343 I344 I345 I346 I347 I348 I349 I350 I351 I352 I353 I354 I355 I356 I357 I358 I359 I360 I361 I362 I363 I364 I365 I366 I367 I368 I369 I370 I371 I372 I373 I374 I375 I376 I377 I378 I379 I380 I381 I382 I383 I384 I385 I386 I387 I388 I389 I390 I391 I392 I393 I394 I395 I396 I397 I398 I399 I400 I401 I402 I403 I404 I405 I406 I407 I408 I409 I410 I411 I412 I413 I414 I415 I416 I417 I418 I419 I420 I421 I422 I423 I424 I425 I426 I427 I428 I429 I430 I431 I432 I433 I434 I435 I436 I437 I438 I439 I440 I441 I442 I443 I444 I445 I446 I447 I448 I449 I450 I451 I452 I453 I454 I455 I456 I457 I458 I459 I460 I461 I462 I463 I464 I1 I2 I3 I4 I5 I6 I7 I8 I9 I10 I11 I12 I13 I14 I15 I16 I17 I18 I19 I20 I21 I22 I23 I24 I25 I26 I27 I28 I29 I30 I31 I32 I33 I34 I35 I36 I37 I38 I39 I40 I41 I42 I43 I44 I45 I46 I47 I48 I49 I50 I51 I52 I53 I54 I55 I56 I57 I58 I59 I60 I61 I62 I63 I64 I65 I66 I67 I68 I69 I70 I71 I72 I73 I74 I75 I76 I77 I78 I79 I80 I81 I82 I83 I84 I85 I86 I87 I88 I89 I90 I91 I92 I93 I94 I95 I96 I97 I98 I99 I100 I101 I102 I103 I104 I105 I106 I107 I108 I109 I110 I111 I112 I113 I114 I115 I116 I117 I118 I119 I120 I121 I122 I123 I124 I125 I126 I127 I128 I129 I130 I131 I132 I133 I134 I135 I136 I137 I138 I139 I140 I141 I142 I143 I144 I145 I146 I147 I148 I149 I150 I151 I152 I153 I154 I155 I156 I157 I158 I159 I160 I161 I162 I163 I164 I165 I166 I167 I168 I169 I170 I171 I172 I173 I174 I175 I176 I177 I178 I179 I180 I181 I182 I183 I184 I185 I186 I187 I188 I189 I190 I191 I192 I193 I194 I195 I196 I197 I198 I199 I200 I201 I202 I203 I204 I205 I206 I207 I208 I209 I210 I211 I212 I213 I214 I215 I216 I217 I218 I219 I220 I221 I222 I223 I224 I225 I226 I227 I228 I229 I230 I231 I232 I233 I234 I235 I236 I237 I238 I239 I240 I241 I242 I243 I244 I245 I246 I247 I248 I249 I250 I251 I252 I253 I254 I255 I256 I257 I258 I259 I260 I261 I262 I263 I264 I265 I266 I267 I268 I269 I270 I271 I272 I273 I274 I275 I276 I277 I278 I279 I280 I281 I282 I283 I284 I285 I286 I287 I288 I289 I290 I291 I292 I293 I294 I295 I296 I297 I298 I299 I300 I301 I302 I303 I304 I305 I306 I307 I308 I309 I310 I311 I312 I313 I314 I315 I316 I317 I318 I319 I320 I321 I322 I323 I324 I325 I326 I327 I328 I329 I330 I331 I332 I333 I334 I335 I336 I337 I338 I339 I340 I341 I342 I343 I344 I345 I346 I347 I348 I349 I350 I351 I352 I353 I354 I355 I356 I357 I358 I359 I360 I361 I362 I363 I364 I365 I366 I367 I368 I369 I370 I371 I372 I373 I374 I375 I376 I377 I378 I379 I380 I381 I382 I383 I384 I385 I386 I387 I388 I389 I390 I391 I392 I393 I394 I395 I396 I397 I398 I399 I400 I401 I402 I403 I404 I405 I406 I407 I408 I409 I410 I411 I412 I413 I414 I415 I416 I417 I418 I419 I420 I421 I422 I423 I424 I425 I426 I427 I428 I429 I430 I431 I432 I433 I434 I435 I436 I437 I438 I439 I440 I441 I442 I443 I444 I445 I446 I447 I448 I449 I450 I451 I452 I453 I454 I455 I456 I457 I458 I459 I460 I461 I462 I463 I464
Anc1_preWGD	Sp16(18)	275	J1 J2 J3 J4 J5 J6 J7 J8 J9 J10 J11 J12 J13 J14 J15 J16 J17 J18 J19 J20 J21 J22 J23 J24 J25 J26 J27 J28 J29 J30 J31 J32 J33 J34 J35 J36 J37 J38 J39 J40 J41 J42 J43 J44 J45 J46 J47 J48 J49 J50 J51 J52 J53 J54 J55 J56 J57 J58 J59 J60 J61 J62 J63 J64 J65 J66 J67 J68 J69 J70 J71 J72 J73 J74 J75 J76 J77 J78 J79 J80 J81 J82 J83 J84 J85 J86 J87 J88 J89 J90 J91 J92 J93 J94 J95 J96 J97 J98 J99 J100 J101 J102 J103 J104 J105 J106 J107 J108 J109 J110 J111 J112 J113 J114 J115 J116 J117 J118 J119 J120 J121 J122 J123 J124 J125 J126 J127 J128 J129 J130 J131 J132 J133 J134 J135 J136 J137 J138 J139 J140 J141 J142 J143 J144 J145 J146 J147 J148 J149 J150 J151 J152 J153 J154 J155 J156 J157 J158 J159 J160 J161 J162 J163 J164 J165 J166 J167 J168 J169 J170 J171 J172 J173 J174 J175 J176 J177 J178 J179 J180 J181 J182 J183 J184 J185 J186 J187 J188 J189 J190 J191 J192 J193 J194 J195 J196 J197 J198 J199 J200 J201 J202 J203 J204 J205 J206 J207 J208 J209 J210 J211 J212 J213 J214 J215 J216 J217 J218 J219 J220 J221 J222 J223 J224 J225 J226 J227 J228 J229 J230 J231 J232 J233 J234 J235 J236 J237 J238 J239 J240 J241 J242 J243 J244 J245 J246 J247 J248 J249 J250 J251 J252 J253 J254 J255 J256 J257 J258 J259 J260 J261 J262 J263 J264 J265 J266 J267 J268 J269 J270 J271 J272 J273 J274 J275
Anc1_preWGD	Sp16(19)	677	H786 H785 H784 H783 H782 H781 H780 H779 H778 H777 H776 H775 H774 H773 H772 H771 H770 H769 H768 H767 H766 H765 H764 H763 H762 H761 H760 H759 H758 H757 H756 H755 H754 H753 H752 H751 H750 H749 H748 H747 H746 H745 H744 H743 H742 H741 H740 H739 H738 H737 H736 H735 H734 H733 H732 H731 H730 H729 H728 H727 H726 H725 H724 H723 H722 H721 H720 H719 H718 H717 H716 H715 H714 H713 H712 H711 H710 H709 H708 H707 H706 H705 H704 H703 H702 H701 H700 H699 H698 H697 H696 H695 H694 H693 H692 H691 H690 H689 H688 H687 H686 H685 H684 H683 H682 H681 H680 H679 H678 H677 H676 H675 H674 H673 H672 H671 H670 H669 H668 H667 H666 H665 H664 H663 H662 H661 H660 H659 H658 H657 H656 H655 H654 H653 H652 H651 H650 H649 H648 H647 H646 H645 H644 H643 H642 H641 H640 H639 H638 H637 H636 H635 H634 H633 H632 H631 H630 H629 H628 H627 H626 H625 H624 H623 H622 H621 H620 H619 H618 H617 H616 H615 H614 H613 H612 H611 H610 H609 H608 H607 H606 H605 H604 H603 H602 H601 H600 H599 H598 H597 H596 H595 H594 H593 H592 H591 H590 H589 H588 H587 H586 H585 H584 H583 H582 H581 H580 H579 H578 H577 H576 H575 H574 H573 H572 H571 H570 H569 H568 H567 H566 H565 H564 H563 H562 H561 H560 H559 H558 H557 H556 H555 H554 H553 H552 H551 H550 K181 K182 K183 K184 K185 K186 K187 K188 K189 K190 K191 K192 K193 K194 K195 K196 K197 K198 K199 K200 K201 K202 K203 K204 K205 K206 K207 K208 K209 K210 K211 K212 K213 K214 K215 K216 K217 K218 K219 K220 K221 K222 K223 K224 K225 K226 K227 K228 K229 K230 K231 K232 K233 K234 K235 K236 K237 K238 K239 K240 K241 K242 K243 K244 K245 K246 K247 K248 K249 K250 K251 K252 K253 K254 K255 K256 K257 K258 K259 K260 K261 K262 K263 K264 K265 K266 K267 K268 K269 K270 K271 K272 K273 K274 K275 K276 K277 K278 K279 K280 K281 K282 K283 K284 K285 K286 K287 K288 K289 K290 K291 K292 K293 K294 K295 K296 K297 K298 K299 K300 K301 K302 K303 K304 K305 K306 K307 K308 K309 K310 K311 K312 K313 K314 K315 K316 K317 K318 K319 K320 K321 K322 K323 K324 K325 K326 K327 K328 K329 K330 K331 K332 K333 K334 K335 K336 K337 K338 K339 K340 K341 K342 K343 K344 K345 K346 K347 K348 K349 K350 K351 K352 K353 K354 K355 K356 K357 K358 K359 K360 K361 K362 K363 K364 K365 K366 K367 K368 K369 K370 K371 K372 K373 K374 K375 K376 K377 K378 K379 K380 K381 K382 K383 K384 K385 K386 K387 K388 K389 K390 K391 K392 K393 K394 K395 K396 K397 K398 K399 K400 K401 K402 K403 K404 K405 K406 K407 K408 K409 K410 K411 K412 K413 K414 K415 K416 K417 K418 K419 K420 K421 K422 K423 K424 K425 K426 K427 K428 K429 K430 K431 K432 K433 K434 K435 K436 K437 K438 K439 K440 K441 K442 K443 K444 K445 K446 K447 K448 K449 K450 K451 K452 K453 K454 K455 K456 K457 K458 K459 K460 K461 K462 K463 K464 K465 K466 K467 K468 K469 K470 K471 K472 K473 K474 K475 K476 K477 K478 K479 K480 K481 K482 K483 K484 K485 K486 K487 K488 K489 K490 K491 K492 K493 K494 K495 K496 K497 K498 K499 K500 K501 K502 K503 K504 K505 K506 K507 K508 K509 K510 K511 K512 K513 K514 K515 K516 K517 K518 K519 K520 K521 K522 K523 K524 K525 K526 K527 K528 K529 K530 K531 K532 K533 K534 K535 K536 K537 K538 K539 K540 K541 K542 K543 K544 K545 K546 K547 K548 K549 K550 K551 K552 K553 K554 K555 K556 K557 K558 K559 K560 K561 K562 K563 K564 K565 K566 K567 K568 K569 K570 K571 K572 K573 K574 K575 K576 K577 K578 K579 K580 K581 K582 K583 K584 K585 K586 K587 K588 K589 K590 K591 K592 K593 K594 K595 K596 K597 K598 K599 K600 K601 K602 K603 K604 K605 K606 K607 K608 K609 K610 K611 K612 K613 K614 K615 K616 K617 K618 K619 K620
Anc1_preWGD	Sp9(10)	291	L1 L2 L3 L4 L5 L6 L7 L8 L9 L10 L11 L12 L13 L14 L15 L16 L17 L18 L19 L20 L21 L22 L23 L24 L25 L26 L27 L28 L29 L30 L31 L32 L33 L34 L35 L36 L37 L38 L39 L40 L41 L42 L43 L44 L45 L46 L47 L48 L49 L50 L51 L52 L53 L54 L55 L56 L57 L58 L59 L60 L61 L62 L63 L64 L65 L66 L67 L68 L69 L70 L71 L72 L73 L74 L75 L76 L77 L78 L79 L80 L81 L82 L83 L84 L85 L86 L87 L88 L89 L90 L91 L92 L93 L94 L95 L96 L97 L98 L99 L100 L101 L102 L103 L104 L105 L106 L107 L108 L109 L110 L111 L112 L113 L114 L115 L116 L117 L118 L119 L120 L121 L122 L123 L124 L125 L126 L127 L128 L129 L130 L131 L132 L133 L134 L135 L136 L137 L138 L139 L140 L141 L142 L143 L144 L145 L146 L147 L148 L149 L150 L151 L152 L153 L154 L155 L156 L157 L158 L159 L160 L161 L162 L163 L164 L165 L166 L167 L168 L169 L170 L171 L172 L173 L174 L175 L176 L177 L178 L179 L180 L181 L182 L183 L184 L185 L186 L187 L188 L189 L190 L191 L192 L193 L194 L195 L196 L197 L198 L199 L200 L201 L202 L203 L204 L205 L206 L207 L208 L209 L210 L211 L212 L213 L214 L215 L216 L217 L218 L219 L220 L221 L222 L223 L224 L225 L226 L227 L228 L229 L230 L231 L232 L233 L234 L235 L236 L237 L238 L239 L240 L241 L242 L243 L244 L245 L246 L247 L248 L249 L250 L251 L252 L253 L254 L255 L256 L257 L258 L259 L260 L261 L262 L263 L264 L265 L266 L267 L268 L269 L270 L271 L272 L273 L274 L275 L276 L277 L278 L279 L280 L281 L282 L283 L284 L285 L286 L287 L288 L289 L290 L291
Anc1_preWGD	Sp9(2)	277	B1 B2 B3 B4 B5 B6 B7 B8 B9 B10 B11 B12 B13 B14 B15 B16 B17 B18 B19 B20 B21 B22 B23 B24 B25 B26 B27 B28 B29 B30 B31 B32 B33 B34 B35 B36 B37 B38 B39 B40 B41 B42 B43 B44 B45 B46 B47 B48 B49 B50 B51 B52 B53 B54 B55 B56 B57 B58 B59 B60 B61 B62 B63 B64 B65 B66 B67 B68 B69 B70 B71 B72 B73 B74 B75 B76 B77 B78 B79 B80 B81 B82 B83 B84 B85 B86 B87 B88 B89 B90 B91 B92 B93 B94 B95 B96 B97 B98 B99 B100 B101 B102 B103 B104 B105 B106 B107 B108 B109 B110 B111 B112 B113 B114 B115 B116 B117 B118 B119 B120 B121 B122 B123 B124 B125 B126 B127 B128 B129 B130 B131 B132 B133 B134 B135 B136 B137 B138 B139 B140 B141 B142 B143 B144 B145 B146 B147 B148 B149 B150 B151 B152 B153 B154 B155 B156 B157 B158 B159 B160 B161 B162 B163 B164 B165 B166 B167 B168 B169 B170 B171 B172 B173 B174 B175 B176 B177 B178 B179 B180 B181 B182 B183 B184 B185 B186 B187 B188 B189 B190 B191 B192 B193 B194 B195 B196 B197 B198 B199 B200 B201 B202 B203 B204 B205 B206 B207 B208 B209 B210 B211 B212 B213 B214 B215 B216 B217 B218 B219 B220 B221 B222 B223 B224 B225 B226 B227 B228 B229 B230 B231 B232 B233 B234 B235 B236 B237 B238 B239 B240 B241 B242 B243 B244 B245 B246 B247 B248 B249 B250 B251 B252 B253 B254 B255 B256 B257 B258 B259 B260 B261 B262 B263 B264 B265 B266 B267 B268 B269 B270 B271 B272 B273 B274 B275 B276 B277
Anc1_preWGD	Sp7(9)	166	C1 C2 C3 C4 C5 C6 C7 C8 C9 C10 C11 C12 C13 C14 C15 C16 C17 C18 C19 C20 C21 C22 C23 C24 C25 C26 C27 C28 C29 C30 C31 C32 C33 C34 C35 C36 C37 C38 C39 C40 C41 C42 C43 C44 C45 C46 C47 C48 C49 C50 C51 C52 C53 C54 C55 C56 C57 C58 C59 C60 C61 C62 C63 C64 C65 C66 C67 C68 C69 C70 C71 C72 C73 C74 C75 C76 C77 C78 C79 C80 C81 C82 C83 C84 C85 C86 C87 C88 C89 C90 C91 C92 C93 C94 C95 C96 C97 C98 C99 C100 C101 C102 C103 C104 C105 C106 C107 C108 C109 C110 C111 C112 C113 C114 C115 C116 C117 C118 C119 C120 C121 C122 C123 C124 C125 C126 C127 C128 C129 C130 C131 C132 C133 C134 C135 C136 C137 C138 C139 C140 C141 C142 C143 C144 C145 C146 C147 C148 C149 C150 C151 C152 C153 C154 C155 C156 C157 C158 C159 C160 C161 C162 C163 C164 C165 C166
Anc1_preWGD	Sp16(7)	934	D1 D2 D3 D4 D5 D6 D7 D8 D9 D10 D11 D12 D13 D14 D15 D16 D17 D18 D19 D20 D21 D22 D23 D24 D25 D26 D27 D28 D29 D30 D31 D32 D33 D34 D35 D36 D37 D38 D39 D40 D41 D42 D43 D44 D45 D46 D47 D48 D49 D50 D51 D52 D53 D54 D55 D56 D57 D58 D59 D60 D61 D62 D63 D64 D65 D66 D67 D68 D69 D70 D71 D72 D73 D74 D75 D76 D77 D78 D79 D80 D81 D82 D83 D84 D85 D86 D87 D88 D89 D90 D91 D92 D93 D94 D95 D96 D97 D98 D99 D100 D101 D102 D103 D104 D105 D106 D107 D108 D109 D110 D111 D112 D113 D114 D115 D116 D117 D118 D119 D120 D121 D122 D123 D124 D125 D126 D127 D128 D129 D130 D131 D132 D133 D134 D135 D136 D137 D138 D139 D140 D141 D142 D143 D144 D145 D146 D147 D148 D149 D150 D151 D152 D153 D154 D155 D156 D157 D158 D159 D160 D161 D162 D163 D164 D165 D166 D167 D168 D169 D170 D171 D172 D173 D174 D175 D176 D177 D178 D179 D180 D181 D182 D183 D184 D185 D186 D187 D188 D189 D190 D191 D192 D193 D194 D195 D196 D197 D198 D199 D200 D201 D202 D203 D204 D205 D206 D207 D208 D209 D210 D211 D212 D213 D214 D215 D216 D217 D218 D219 D220 D221 D222 D223 D224 D225 D226 D227 D228 D229 D230 D231 D232 D233 D234 D235 D236 D237 D238 D239 D240 D241 D242 D243 D244 D245 D246 D247 D248 D249 D250 D251 D252 D253 D254 D255 D256 D257 D258 D259 D260 D261 D262 D263 D264 D265 D266 D267 D268 D269 D270 D271 D272 D273 D274 D275 D276 D277 D278 D279 D280 D281 D282 D283 D284 D285 D286 D287 D288 D289 D290 D291 D292 D293 D294 D295 D296 D297 D298 D299 D300 D301 D302 D303 D304 D305 D306 D307 D308 D309 D310 D311 D312 D313 D314 D315 D316 D317 D318 D319 D320 D321 D322 D323 D324 D325 D326 D327 D328 D329 D330 D331 D332 D333 D334 D335 D336 D337 D338 D339 D340 D341 D342 D343 D344 D345 D346 D347 D348 D349 D350 D351 D352 D353 D354 D355 D356 D357 D358 D359 D360 D361 D362 D363 D364 D365 D366 D367 D368 D369 D370 D371 D372 D373 D374 D375 D376 D377 D378 D379 D380 D381 D382 D383 D384 D385 D386 D387 D388 D389 D390 D391 D392 D393 D394 D395 D396 D397 D398 D399 D400 D401 D402 D403 D404 D405 D406 D407 D408 D409 D410 D411 D412 D413 D414 D415 D416 D417 D418 D419 D420 D421 D422 D423 D424 D425 D426 D427 D428 D429 D430 D431 D432 D433 D434 D435 D436 D437 D438 D439 D440 D441 D442 D443 D444 D445 D446 D447 D448 D449 D450 D451 D452 D453 D454 D455 D456 D457 D458 D459 D460 D461 D462 D463 D464 D465 D466 D467 D468 D469 D470 D471 D472 D473 D474 D475 D476 D477 D478 D479 D480 D481 D482 D483 D484 D485 D486 D487 D488 D489 D490 D491 D492 D493 D494 D495 D496 D497 D498 D499 D500 D501 D502 D503 D504 D505 D506 D507 D508 D509 D510 D511 D512 D513 D514 D515 D516 D517 D518 D519 D520 D521 D522 D523 D524 D525 D526 D527 D528 D529 D530 D531 D532 D533 D534 D535 D536 D537 D538 D539 D540 D541 D542 D543 D544 D545 D546 D547 D548 D549 D550 D551 D552 D553 D554 D555 D556 D557 D558 D559 D560 D561 D562 D563 D564 D565 D566 D567 D568 D569 D570 D571 D572 D573 D574 D575 D576 D577 D578 D579 D580 D581 D582 D583 D584 D585 D586 D587 D588 D589 D590 D591 D592 D593 D594 D595 D596 D597 D598 D599 D600 D601 D602 D603 D604 D605 D606 D607 D608 D609 D610 D611 D612 D613 D614 D615 D616 D617 D618 D619 D620 D621 D622 D623 D624 D625 D626 D627 D628 D629 D630 D631 D632 D633 D634 D635 D636 D637 D638 D639 D640 D641 D642 D643 D644 D645 D646 D647 D648 D649 D650 D651 D652 D653 D654 D655 D656 D657 D658 D659 D660 D661 D662 D663 D664 D665 D666 D667 D668 D669 D670 D671 D672 D673 D674 D675 D676 D677 D678 D679 D680 D681 D682 D683 D684 D685 D686 D687 D688 D689 D690 D691 D692 D693 D694 D695 D696 D697 D698 D699 D700 D701 D702 D703 D704 D705 D706 D707 D708 D709 D710 D711 D712 D713 D714 D715 D716 D717 D718 D719 D720 D721 D722 D723 D724 D725 D726 D727 D728 D729 D730 D731 D732 D733 D734 D735 D736 D737 D738 D739 D740 D741 D742 D743 D744 D745 D746 D747 D748 D749 D750 D751 D752 D753 D754 D755 D756 D757 D758 D759 D760 D761 D762 D763 D764 D765 D766 D767 D768 D769 D770 D771 D772 D773 D774 D775 D776 D777 D778 D779 D780 D781 D782 D783 D784 D785 D786 D787 D788 D789 D790 D791 D792 D793 D794 D795 D796 D797 D798 D799 D800 D801 D802 D803 D804 D805 D806 D807 D808 D809 D810 D811 D812 D813 D814 D815 D816 D817 D818 D819 D820 D821 D822 D823 D824 D825 D826 D827 D828 D829 D830 D831 D832 D833 D834 D835 D836 D837 D838 D839 D840 D841 D842 D843 D844 D845 D846 D847 D848 D849 D850 D851 D852 D853 D854 D855 D856 D857 D858 D859 D860 D861 D862 D863 D864 D865 D866 D867 D868 D869 D870 D871 D872 D873 D874 D875 D876 D877 D878 D879 D880 D881 D882 D883 D884 D885 D886 D887 D888 D889 D890 D891 D892 D893 D894 D895 D896 D897 D898 D899 D900 D901 D902 D903 D904 D905 D906 D907 D908 D909 D910 D911 D912 D913 D914 D915 D916 D917 D918 D919 D920 D921 D922 D923 D924 D925 D926 D927 D928 D929 D930 D931 D932 D933 D934
