Node	ChrID	GenesCount	Genes
Anc3	Sp7(6)	479	G1 G2 G3 G4 G5 G6 G7 G8 G9 G10 G11 G12 G13 G14 G15 G16 G17 G18 G19 G20 G21 G22 G23 G24 G25 G26 G27 G28 G29 G30 G31 G32 G33 G34 G35 G36 G37 G38 G39 G40 G41 G42 G43 G44 G45 G46 G47 G48 G49 G50 G51 G52 G53 G54 G55 G56 G57 G58 G59 G60 G61 G62 G63 G64 G65 G66 G67 G68 G69 G70 G71 G72 G73 G74 G75 G76 G77 G78 G79 G80 G81 G82 G83 G84 G85 G86 G87 G88 G89 G90 G91 G92 G93 G94 G95 G96 G97 G98 G99 G100 G101 G102 G103 G104 G105 G106 G107 G108 G109 G110 G111 G112 G113 G114 G115 G116 G117 G118 G119 G120 G121 G122 G123 G124 G125 G126 G127 G128 G129 G130 G131 G132 G133 G134 G135 G136 G137 G138 G139 G140 G141 G142 G143 G144 G145 G146 G147 G148 G149 G150 G151 G152 G153 G154 G155 G156 G157 G158 G159 G160 G161 G162 G163 G164 G165 G166 G167 G168 G169 G170 G171 G172 G173 G174 G175 G176 G177 G178 G179 G180 G181 G182 G183 G184 G185 G186 G187 G188 G189 G190 G191 G192 G193 G194 G195 G196 G197 G198 G199 G200 G201 G202 G203 G204 G205 G206 G207 G208 G209 G210 G211 G212 G213 G214 G215 G216 G217 G218 G219 G220 G221 G222 G223 G224 G225 G226 G227 G228 G229 G230 G231 G232 G233 G234 G235 G236 G237 G238 G239 G240 G241 G242 G243 G244 G245 G246 G247 G248 G249 G250 G251 G252 G253 G254 G255 G256 G257 G258 G259 G260 G261 G262 G263 G264 G265 G266 G267 G268 G269 G270 G271 G272 G273 G274 G275 G276 G277 G278 G279 G280 G281 G282 G283 G284 G285 G286 G287 G288 G289 G290 G291 G292 G293 G294 G295 G296 G297 G298 G299 G300 G301 G302 G303 G304 G305 G306 G307 G308 G309 G310 G311 G312 G313 G314 G315 G316 G317 G318 G319 G320 G321 G322 G323 G324 G325 G326 G327 G328 G329 G330 G331 G332 G333 G334 G335 G336 G337 G338 G339 G340 G341 G342 G343 G344 G345 G346 G347 G348 G349 G350 G351 G352 G353 G354 G355 G356 G357 G358 G359 G360 G361 G362 G363 G364 G365 G366 G367 G368 G369 G370 G371 G372 G373 G374 G375 G376 G377 G378 G379 G380 G381 G382 G383 G384 G385 G386 G387 G388 G389 G390 G391 G392 G393 G394 G395 G396 G397 G398 G399 G400 G401 G402 G403 G404 G405 G406 G407 G408 G409 G410 G411 G412 G413 G414 G415 G416 G417 G418 G419 G420 G421 G422 G423 G424 G425 G426 G427 G428 G429 G430 G431 G432 G433 G434 G435 G436 G437 G438 G439 G440 G441 G442 G443 G444 G445 G446 G447 G448 G449 G450 G451 G452 G453 G454 G455 G456 G457 G458 G459 G460 G461 G462 G463 G464 G465 G466 G467 G468 G469 G470 G471 G472 G473 G474 G475 G476 G477 G478 G479
Anc3	Sp8(3)	659	E1 E2 E3 E4 E5 E6 E7 E8 E9 E10 E11 E12 E13 E14 E15 E16 E17 E18 E19 E20 E21 E22 E23 E24 E25 E26 E27 E28 E29 E30 E31 E32 E33 E34 E35 E36 E37 E38 E39 E40 E41 E42 E43 E44 E45 E46 E47 E48 E49 E50 E51 E52 E53 E54 E55 E56 E57 E58 E59 E60 E61 E62 E63 E64 E65 E66 E67 E68 E69 E70 E71 E72 E73 E74 E75 E76 E77 E78 E79 E80 E81 E82 E83 E84 E85 E86 E87 E88 E89 E90 E91 E92 E93 E94 E95 E96 E97 E98 E99 E100 E101 E102 E103 E104 E105 E106 E107 E108 E109 E110 E111 E112 E113 E114 E115 E116 E117 E118 E119 E120 E121 E122 E123 E124 E125 E126 E127 E128 E129 E130 E131 E132 E133 E134 E135 E136 E137 E138 E139 E140 E141 E142 E143 E144 E145 E146 E147 E148 E149 E150 E151 E152 E153 E154 E155 E156 E157 E158 E159 E160 E161 E162 E163 E164 E165 E166 E167 E168 E169 E170 E171 E172 E173 E174 E175 E176 E177 E178 E179 E180 E181 E182 E183 E184 E185 E186 E187 E188 E189 E190 E191 E192 E193 E194 E195 E196 E197 E198 E199 E200 E201 E202 E203 E204 E205 E206 E207 E208 E209 E210 E211 E212 E213 E214 E215 E216 E217 E218 E219 E220 E221 E222 E223 E224 E225 E226 E227 E228 E229 E230 E231 E232 E233 E234 E235 E236 E237 E238 E239 E240 E241 E242 E243 E244 E245 E246 E247 E248 E249 E250 E251 E252 E253 E254 E255 E256 E257 E258 E259 E260 E261 E262 E263 E264 E265 E266 E267 E268 E269 E270 E271 E272 E273 E274 E275 E276 E277 E278 E279 E280 E281 E282 E283 E284 E285 E286 E287 E288 E289 E290 E291 E292 E293 E294 E295 E296 E297 E298 E299 E300 E301 E302 E303 E304 E305 E306 E307 E308 E309 E310 E311 E312 E313 E314 E315 E316 E317 E318 E319 E320 E321 E322 E323 E324 E325 E326 E327 E328 E329 E330 E331 E332 E333 E334 E335 E336 E337 E338 E339 E340 E341 E342 E343 E344 E345 E346 E347 E348 E349 E350 E351 E352 E353 E354 E355 E356 E357 E358 E359 E360 E361 E362 E363 E364 E365 E366 E367 E368 E369 E370 E371 E372 E373 E374 E375 E376 E377 E378 E379 E380 E381 E382 E383 E384 E385 E386 E387 E388 E389 E390 E391 E392 E393 E394 E395 E396 E397 E398 E399 E400 E401 E402 E403 E404 E405 E406 E407 E408 E409 E410 E411 E412 E413 E414 E415 E416 E417 E418 E419 E420 E421 E422 E423 E424 E425 E426 E427 E428 E429 E430 E431 E432 E433 E434 E435 E436 E437 E438 E439 E440 E441 E442 E443 E444 E445 E446 E447 E448 E449 E450 E451 E452 E453 E454 E455 E456 E457 E458 E459 E460 E461 E462 E463 E464 E465 E466 E467 E468 E469 E470 E471 E472 E473 E474 E475 E476 E477 E478 E479 E480 E481 E482 E483 E484 E485 E486 E487 E488 E489 E490 E491 E492 E493 E494 E495 E496 E497 E498 E499 E500 E501 E502 E503 E504 E505 E506 E507 E508 E509 E510 E511 E512 E513 E514 E515 E516 E517 E518 E519 E520 E521 E522 E523 E524 E525 E526 E527 E528 E529 E530 E531 E532 E533 E534 E535 E536 E537 E538 E539 E540 E541 E542 E543 E544 H115 H114 H113 H112 H111 H110 H109 H108 H107 H106 H105 H104 H103 H102 H101 H100 H99 H98 H97 H96 H95 H94 H93 H92 H91 H90 H89 H88 H87 H86 H85 H84 H83 H82 H81 H80 H79 H78 H77 H76 H75 H74 H73 H72 H71 H70 H69 H68 H67 H66 H65 H64 H63 H62 H61 H60 H59 H58 H57 H56 H55 H54 H53 H52 H51 H50 H49 H48 H47 H46 H45 H44 H43 H42 H41 H40 H39 H38 H37 H36 H35 H34 H33 H32 H31 H30 H29 H28 H27 H26 H25 H24 H23 H22 H21 H20 H19 H18 H17 H16 H15 H14 H13 H12 H11 H10 H9 H8 H7 H6 H5 H4 H3 H2 H1
Anc4	Sp7(3)	624	D1 D2 D3 D4 D5 D6 D7 D8 D9 D10 D11 D12 D13 D14 D15 D16 D17 D18 D19 D20 D21 D22 D23 D24 D25 D26 D27 D28 D29 D30 D31 D32 D33 D34 D35 D36 D37 D38 D39 D40 D41 D42 D43 D44 D45 D46 D47 D48 D49 D50 D51 D52 D53 D54 D55 D56 D57 D58 D59 D60 D61 D62 D63 D64 D65 D66 D67 D68 D69 D70 D71 D72 D73 D74 D75 D76 D77 D78 D79 D80 D81 D82 D83 D84 D85 D86 D87 D88 D89 D90 D91 D92 D93 D94 D95 D96 D97 D98 D99 D100 D101 D102 D103 D104 D105 D106 D107 D108 D109 D110 D111 D112 D113 D114 D115 D116 D117 D118 D119 D120 D121 D122 D123 D124 D125 D126 D127 D128 D129 D130 D131 D132 D133 D134 D135 D136 D137 D138 D139 D140 D141 D142 D143 D144 D145 D146 D147 D148 D149 D150 D151 D152 D153 D154 D155 D156 D157 D158 D159 D160 D161 D162 D163 D164 D165 D166 D167 D168 D169 D170 D171 D172 D173 D174 D175 D176 D177 D178 D179 D180 D181 D182 D183 D184 D185 D186 D187 D188 D189 D190 D191 D192 D193 D194 D195 D196 D197 D198 D199 D200 D201 D202 D203 D204 D205 D206 D207 D208 D209 D210 D211 D212 D213 D214 D215 D216 D217 D218 D219 D220 D221 D222 D223 D224 D225 D226 D227 D228 D229 D230 D231 D232 D233 D234 D235 D236 D237 D238 D239 D240 D241 D242 D243 D244 D245 D246 D247 D248 D249 D250 D251 D252 D253 D254 D255 D256 D257 D258 D259 D260 D261 D262 D263 D264 D265 D266 D267 D268 D269 D270 D271 D272 D273 D274 D275 D276 D277 D278 D279 D280 D281 D282 D283 D284 D285 D286 D287 D288 D289 D290 D291 D292 D293 D294 D295 D296 D297 D298 D299 D300 D301 D302 D303 D304 D305 D306 D307 D308 D309 D310 D311 D312 D313 D314 D315 D316 D317 D318 D319 D320 D321 D322 D323 D324 D325 D326 D327 D328 D329 D330 D331 D332 D333 D334 D335 D336 D337 D338 D339 D340 D341 D342 D343 D344 D345 D346 D347 D348 D349 D350 D351 D352 D353 D354 D355 D356 D357 D358 D359 D360 D361 D362 D363 D364 D365 D366 D367 D368 D369 D370 D371 D372 D373 D374 D375 D376 D377 D378 D379 D380 D381 D382 D383 D384 D385 D386 D387 D388 D389 D390 D391 D392 D393 D394 D395 D396 D397 D398 D399 D400 D401 D402 D403 D404 D405 D406 D407 D408 D409 D410 D411 D412 D413 D414 D415 D416 D417 D418 D419 D420 D421 D422 D423 D424 D425 D426 D427 D428 D429 D430 D431 D432 D433 D434 D435 D436 D437 D438 D439 D440 D441 D442 D443 D444 D445 D446 D447 D448 D449 D450 D451 D452 D453 D454 D455 D456 D457 D458 D459 D460 D461 D462 D463 D464 D465 D466 D467 D468 D469 D470 D471 D472 D473 D474 D475 D476 D477 D478 D479 D480 D481 D482 D483 D484 D485 D486 D487 D488 D489 D490 D491 D492 D493 D494 D495 D496 D497 D498 D499 D500 D501 D502 D503 D504 D505 D506 D507 D508 D509 D510 D511 D512 D513 D514 D515 D516 D517 D518 D519 D520 D521 D522 D523 D524 D525 D526 D527 D528 D529 D530 D531 D532 D533 D534 D535 D536 D537 D538 D539 D540 D541 D542 D543 D544 D545 D546 D547 D548 D549 D550 D551 D552 D553 D554 D555 D556 D557 D558 D559 D560 D561 D562 D563 D564 D565 D566 D567 D568 D569 D570 D571 D572 D573 D574 D575 D576 D577 D578 D579 D580 D581 D582 D583 D584 D585 D586 D587 D588 D589 D590 D591 D592 D593 D594 D595 D596 D597 D598 D599 D600 D601 D602 D603 D604 D605 D606 D607 D608 D609 D610 D611 D612 D613 D614 D615 D616 D617 D618 D619 D620 D621 D622 D623 D624
Anc4	Sp4(4)	1169	F1 F2 F3 F4 F5 F6 F7 F8 F9 F10 F11 F12 F13 F14 F15 F16 F17 F18 F19 F20 F21 F22 F23 F24 F25 F26 F27 F28 F29 F30 F31 F32 F33 F34 F35 F36 F37 F38 F39 F40 F41 F42 F43 F44 F45 F46 F47 F48 F49 F50 F51 F52 F53 F54 F55 F56 F57 F58 F59 F60 F61 F62 F63 F64 F65 F66 F67 F68 F69 F70 F71 F72 F73 F74 F75 F76 F77 F78 F79 F80 F81 F82 F83 F84 F85 F86 F87 F88 F89 F90 F91 F92 F93 F94 F95 F96 F97 F98 F99 F100 F101 F102 F103 F104 F105 F106 F107 F108 F109 F110 F111 F112 F113 F114 F115 F116 F117 F118 F119 F120 F121 F122 F123 F124 F125 F126 F127 F128 F129 F130 F131 F132 F133 F134 F135 F136 F137 F138 F139 F140 F141 F142 F143 F144 F145 F146 F147 F148 F149 F150 F151 F152 F153 F154 F155 F156 F157 F158 F159 F160 F161 F162 F163 F164 F165 F166 F167 F168 F169 F170 F171 F172 F173 F174 F175 F176 F177 F178 F179 F180 F181 F182 F183 F184 F185 F186 F187 F188 F189 F190 F191 F192 F193 F194 F195 F196 F197 F198 F199 F200 F201 F202 F203 F204 F205 F206 F207 F208 F209 F210 F211 F212 F213 F214 F215 F216 F217 F218 F219 F220 F221 F222 F223 F224 F225 F226 F227 F228 F229 F230 F231 F232 F233 F234 F235 F236 F237 F238 F239 F240 F241 F242 F243 F244 F245 F246 F247 F248 F249 F250 F251 F252 F253 F254 F255 F256 F257 F258 F259 F260 F261 F262 F263 F264 F265 F266 F267 F268 F269 F270 F271 F272 F273 F274 F275 F276 F277 F278 F279 F280 F281 F282 F283 F284 F285 F286 F287 F288 F289 F290 F291 F292 F293 F294 F295 F296 F297 F298 F299 F300 F301 F302 F303 F304 F305 F306 F307 F308 F309 F310 F311 F312 F313 F314 F315 F316 F317 F318 F319 F320 F321 F322 F323 F324 F325 F326 F327 F328 F329 F330 F331 F332 F333 F334 F335 F336 F337 F338 F339 F340 F341 F342 F343 F344 F345 F346 F347 F348 F349 F350 F351 F352 F353 F354 F355 F356 F357 F358 F359 F360 F361 F362 F363 F364 F365 F366 F367 F368 F369 F370 F371 F372 F373 F374 F375 F376 F377 F378 F379 F380 F381 F382 F383 F384 F385 F386 F387 F388 F389 F390 F391 F392 F393 F394 F395 F396 F397 F398 F399 F400 F401 F402 F403 F404 F405 F406 F407 F408 F409 F410 F411 F412 F413 F414 F415 F416 F417 F418 F419 F420 F421 F422 F423 F424 F425 F426 F427 F428 F429 F430 F431 F432 F433 F434 F435 F436 F437 F438 F439 F440 F441 F442 F443 F444 F445 F446 F447 F448 F449 F450 F451 F452 F453 F454 F455 F456 F457 F458 F459 F460 F461 F462 F463 F464 F465 F466 F467 F468 F469 F470 F471 F472 F473 F474 F475 F476 F477 F478 F479 F480 F481 F482 F483 F484 F485 F486 F487 F488 F489 F490 F491 F492 F493 F494 F495 F496 F497 F498 F499 F500 F501 F502 F503 F504 F505 F506 F507 F508 F509 F510 F511 F512 F513 F514 F515 F516 F517 F518 F519 F520 F521 F522 F523 F524 F525 F526 F527 F528 F529 F530 F531 F532 F533 F534 F535 F536 F537 F538 F539 F540 F541 F542 F543 F544 F545 F546 F547 F548 F549 F550 F551 F552 F553 F554 F555 F556 F557 F558 F559 F560 F561 F562 F563 F564 F565 F566 F567 F568 F569 F570 F571 F572 F573 F574 F575 F576 F577 F578 F579 F580 F581 F582 F583 F584 F585 F586 F587 F588 F589 F590 F591 F592 F593 F594 F595 F596 F597 F598 F599 F600 F601 F602 F603 F604 F605 F606 F607 F608 F609 F610 F611 F612 F613 F614 F615 F616 F617 F618 F619 F620 F621 F622 F623 F624 F625 F626 F627 F628 F629 F630 F631 F632 F633 F634 F635 F636 F637 F638 F639 F640 F641 F642 F643 F644 F645 F646 F647 F648 F649 F650 F651 F652 F653 F654 F655 F656 F657 F658 F659 F660 F661 F662 F663 F664 F665 F666 F667 F668 F669 F670 F671 F672 F673 F674 F675 F676 F677 F678 F679 F680 F681 F682 F683 F684 F685 F686 F687 F688 F689 F690 F691 F692 F693 F694 F695 F696 F697 F698 F699 F700 F701 F702 F703 F704 F705 F706 F707 F708 F709 F710 F711 F712 F713 F714 F715 F716 F717 F718 F719 F720 F721 F722 F723 F724 F725 F726 F727 F728 F729 F730 F731 F732 F733 F734 F735 F736 F737 F738 F739 F740 F741 F742 F743 F744 F745 F746 F747 F748 F749 F750 F751 F752 F753 F754 F755 F756 F757 F758 F759 F760 F761 F762 F763 F764 F765 F766 F767 F768 F769 F770 F771 F772 F773 F774 F775 F776 F777 F778 F779 F780 F781 F782 F783 F784 F785 F786 F787 F788 F789 F790 F791 F792 F793 F794 F795 F796 F797 F798 F799 F800 F801 G112 G113 G114 G115 G116 G117 G118 G119 G120 G121 G122 G123 G124 G125 G126 G127 G128 G129 G130 G131 G132 G133 G134 G135 G136 G137 G138 G139 G140 G141 G142 G143 G144 G145 G146 G147 G148 G149 G150 G151 G152 G153 G154 G155 G156 G157 G158 G159 G160 G161 G162 G163 G164 G165 G166 G167 G168 G169 G170 G171 G172 G173 G174 G175 G176 G177 G178 G179 G180 G181 G182 G183 G184 G185 G186 G187 G188 G189 G190 G191 G192 G193 G194 G195 G196 G197 G198 G199 G200 G201 G202 G203 G204 G205 G206 G207 G208 G209 G210 G211 G212 G213 G214 G215 G216 G217 G218 G219 G220 G221 G222 G223 G224 G225 G226 G227 G228 G229 G230 G231 G232 G233 G234 G235 G236 G237 G238 G239 G240 G241 G242 G243 G244 G245 G246 G247 G248 G249 G250 G251 G252 G253 G254 G255 G256 G257 G258 G259 G260 G261 G262 G263 G264 G265 G266 G267 G268 G269 G270 G271 G272 G273 G274 G275 G276 G277 G278 G279 G280 G281 G282 G283 G284 G285 G286 G287 G288 G289 G290 G291 G292 G293 G294 G295 G296 G297 G298 G299 G300 G301 G302 G303 G304 G305 G306 G307 G308 G309 G310 G311 G312 G313 G314 G315 G316 G317 G318 G319 G320 G321 G322 G323 G324 G325 G326 G327 G328 G329 G330 G331 G332 G333 G334 G335 G336 G337 G338 G339 G340 G341 G342 G343 G344 G345 G346 G347 G348 G349 G350 G351 G352 G353 G354 G355 G356 G357 G358 G359 G360 G361 G362 G363 G364 G365 G366 G367 G368 G369 G370 G371 G372 G373 G374 G375 G376 G377 G378 G379 G380 G381 G382 G383 G384 G385 G386 G387 G388 G389 G390 G391 G392 G393 G394 G395 G396 G397 G398 G399 G400 G401 G402 G403 G404 G405 G406 G407 G408 G409 G410 G411 G412 G413 G414 G415 G416 G417 G418 G419 G420 G421 G422 G423 G424 G425 G426 G427 G428 G429 G430 G431 G432 G433 G434 G435 G436 G437 G438 G439 G440 G441 G442 G443 G444 G445 G446 G447 G448 G449 G450 G451 G452 G453 G454 G455 G456 G457 G458 G459 G460 G461 G462 G463 G464 G465 G466 G467 G468 G469 G470 G471 G472 G473 G474 G475 G476 G477 G478 G479
Anc4	Sp5(2):1-572	572	B155 B154 B153 B152 B151 B150 B149 B148 B147 B146 B145 B144 B143 B142 B141 B140 B139 B138 B137 B136 B135 B134 B133 B132 B131 B130 B129 B128 B127 B126 B125 B124 B123 B122 B121 B120 B119 B118 B117 B116 B115 B114 B113 B112 B111 B110 B109 B108 B107 B106 B105 B104 B103 B102 B101 B100 B99 B98 B97 B96 B95 B94 B93 B92 B91 B90 B89 B88 B87 B86 B85 B84 B83 B54 B55 B56 B57 B58 B59 B60 B61 B62 B63 B64 B65 B66 B67 B68 B69 B70 B71 B72 B73 B74 B75 B76 B77 B78 B79 B80 B81 B82 B53 B52 E177 E178 E179 E180 E181 E182 E183 E184 E185 E186 E187 E188 E189 E190 E191 E192 E193 E194 E195 E196 E197 E198 E199 E200 E201 E202 E203 E204 E205 E206 E207 E208 E209 E210 E211 E212 E213 E214 E215 E216 E217 E218 E219 E220 E221 E222 E223 E224 E225 E226 E227 E228 E229 E230 E231 E232 E233 E234 E235 E236 E237 E238 E239 E240 E241 E242 E243 E244 E245 E246 E247 E248 E249 E250 E251 E252 E253 E254 E255 E256 E257 E258 E259 E260 E261 E262 E263 E264 E265 E266 E267 E268 E269 E270 E271 E272 E273 E274 E275 E276 E277 E278 E279 E280 E281 E282 E283 E284 E285 E286 E287 E288 E289 E290 E291 E292 E293 E294 E295 E296 E297 E298 E299 E300 E301 E302 E303 E304 E305 E306 E307 E308 E309 E310 E311 E312 E313 E314 E315 E316 E317 E318 E319 E320 E321 E322 E323 E324 E325 E326 E327 E328 E329 E330 E331 E332 E333 E334 E335 E336 E337 E338 E339 E340 E341 E342 E343 E344 E345 E346 E347 E348 E349 E350 E351 E352 E353 E354 E355 E356 E464 E465 E466 E467 E468 E469 E470 E471 E472 E473 E474 E475 E476 E477 E478 E479 E480 E481 E482 E483 E484 E485 E486 E487 E488 E489 E490 E491 E492 E493 E494 E495 E496 E497 E498 E499 E500 E501 E502 E503 E504 E505 E506 E507 E508 E509 E510 E511 E512 E513 E514 E515 E516 E517 E518 E519 E520 E521 E522 E523 E524 E525 E526 E527 E528 E529 E530 E531 E532 E533 E534 E535 E536 E537 E538 E539 E540 E541 E542 E543 E544 E545 E546 E547 E548 E549 E550 E551 E552 E553 E554 E555 E556 E557 E558 E559 E560 E561 E562 E563 E564 E565 E566 E567 E568 E569 E570 E571 E572 E573 E574 E575 E576 E577 E578 E579 E580 E581 E582 E583 E584 E585 E586 E587 E588 E589 E590 E591 E592 E593 E594 E595 C156 C155 C154 C153 C152 C151 C150 C149 C148 C147 C146 C145 C144 C143 C142 C141 C140 C139 C138 C137 C136 C135 C134 C133 C132 C131 C130 C129 C128 C127 C126 C125 C124 C123 C122 C121 C120 C119 C118 C117 C116 C115 C114 C113 C112 C111 C110 C109 C108 C107 C106 C105 C104 C103 C102 C101 C100 C99 C98 C97 C96 C95 C94 C93 C92 C91 C90 C89 C88 C87 C86 C85 C84 C83 C82 C81 C80 C79 C78 C77 C76 C75 C74 C73 C72 C71 C70 C69 C68 C67 C66 C65 C64 C63 C62 C61 C60 C59 C58 C57 C56 C55 C54 C53 C52 C51 C50 C49 C48 C47 C46 C45 C44 C43 C42 C41 C40 C39 C38 C37 C36 C35 C34 C33 C32 C31 C30 C29 C28 C27 C26 C25 C24 C23 C22 C21 C20 C19 C18 C17 C16 C15 C14 C13 C12 C11 C10 C9 C8 C7 C6 C5 C4 C3 C2 C1
Anc4	Sp6(4)	285	G1 G2 G3 G4 G5 G6 G7 G8 G9 G10 G11 G12 G13 G14 G15 G16 G17 G18 G19 G20 G21 G22 G23 G24 G25 G26 G27 G28 G29 G30 G31 G32 G33 G34 G35 G36 G37 G38 G39 G40 G41 G42 G43 G44 G45 G46 G47 G48 G49 G50 G51 G52 G53 G54 G55 G56 G57 G58 G59 G60 G61 G62 G63 G64 G65 G66 G67 G68 G69 G70 G71 G72 G73 G74 G75 G76 G77 G78 G79 G80 G81 G82 G83 G84 G85 G86 G87 G88 G89 G90 G91 G92 G93 G94 G95 G96 G97 G98 G99 G100 G101 G102 G103 G104 G105 G106 G107 G108 G109 G110 G111 F802 F803 F804 F805 F806 F807 F808 F809 F810 F811 F812 F813 F814 F815 F816 F817 F818 F819 F820 F821 F822 F823 F824 F825 F826 F827 F828 F829 F830 F831 F832 F833 F834 F835 F836 F837 F838 F839 F840 F841 F842 F843 F844 F845 F846 F847 F848 F849 F850 F851 F852 F853 F854 F855 F856 F857 F858 F859 F860 F861 F862 F863 F864 F865 F866 F867 F868 F869 F870 F871 F872 F873 F874 F875 F876 F877 F878 F879 F880 F881 F882 F883 F884 F885 F886 F887 F888 F889 F890 F891 F892 F893 F894 F895 F896 F897 F898 F899 F900 F901 F902 F903 F904 F905 F906 F907 F908 F909 F910 F911 F912 F913 F914 F915 F916 F917 F918 F919 F920 F921 F922 F923 F924 F925 F926 F927 F928 F929 F930 F931 F932 F933 F934 F935 F936 F937 F938 F939 F940 F941 F942 F943 F944 F945 F946 F947 F948 F949 F950 F951 F952 F953 F954 F955 F956 F957 F958 F959 F960 F961 F962 F963 F964 F965 F966 F967 F968 F969 F970 F971 F972 F973 F974 F975
Anc5	Sp4(2):1-1048	1048	B1 B2 B3 B4 B5 B6 B7 B8 B9 B10 B11 B12 B13 B14 B15 B16 B17 B18 B19 B20 B21 B22 F826 F827 F828 F829 F830 F831 F832 F833 F834 F835 F836 F837 F838 F839 F840 F841 F842 F843 F844 F845 F846 F847 F848 F849 F850 F851 F852 F853 F854 F855 F856 F857 F858 F859 F860 F861 F862 F863 F864 F865 F866 F867 F868 F869 F870 F871 E186 E185 E184 E183 E182 E181 E180 E179 E178 E177 E176 E175 E174 E173 E172 E171 E170 E169 E168 E167 E166 E165 E164 E163 E162 E161 E160 E159 E158 E157 E156 E155 E154 E153 E152 E151 E150 E149 E148 E147 E146 E145 E144 E143 E142 E141 E140 E139 E138 E137 E136 E135 E134 E133 E132 E131 E130 E129 E128 E127 E126 E125 E124 E123 E122 E121 E120 E119 E118 E117 E116 E115 E114 E113 E112 E111 E110 E109 E108 E107 E106 E105 E104 E103 E102 E101 E100 E99 E98 E97 E96 E95 E94 E93 E92 E91 E90 E89 E88 E87 E86 E85 E84 E83 E82 E81 E80 E79 E78 E77 E76 E75 E440 E441 E442 E443 E444 E445 E446 E447 E448 E449 E450 E451 E452 E453 E454 E455 E456 E457 E458 E459 E460 E461 E462 E463 E357 E358 E359 E360 E361 E362 E363 E364 E365 E366 E367 E368 E369 E370 E371 E372 E373 E374 E375 E376 E377 E378 E379 E380 E381 E382 E383 E384 E385 E386 E387 E388 E389 E390 E391 E392 E393 E394 E395 E396 E397 E398 E399 E400 E401 E402 E403 E404 E405 E406 E407 E408 E409 E410 E411 E412 E413 E414 E415 E416 E417 E418 E419 E420 E421 E422 E423 E424 E425 E426 E427 E428 E429 E430 E431 E432 E433 E434 E435 E436 E437 E438 E439 E74 E73 E72 E71 E70 E69 E68 E67 E66 E65 E64 E63 E62 E61 E60 E59 E58 E57 E56 E55 E54 E53 E52 E51 E50 E49 E48 E47 E46 E45 E44 E43 E42 E41 E40 E39 E38 E37 E36 E35 E34 E33 E32 E31 E30 E29 E28 E27 E26 E25 E24 E23 E22 E21 E20 E19 E18 E17 E16 E15 E14 E13 E12 E11 E10 E9 E8 E7 E6 E5 E4 E3 E2 E1 C157 C158 C159 C160 C161 C162 C163 C164 C165 C166 C167 C168 C169 C170 C171 C172 C173 C174 C175 C176 C177 C178 C179 C180 C181 C182 C183 C184 C185 C186 C187 C188 C189 C190 C191 C192 C193 C194 C195 C196 C197 C198 C199 C200 C201 C202 C203 C204 C205 C206 C207 C208 C209 C210 C211 C212 C213 C214 C215 C216 C217 C218 C219 C220 C221 C222 C223 C224 C225 C226 C227 C228 C229 C230 C231 C232 C233 C234 C235 C236 C237 C238 C239 C240 C241 C242 C243 C244 C245 C246 C247 C248 C249 C250 C251 C252 C253 C254 C255 C256 C257 C258 C259 C260 C261 C262 C263 C264 C265 C266 C267 C268 C269 C270 C271 C272 C273 C274 C275 C276 C277 C278 C279 C280 C281 C282 C283 C284 C285 C286 C287 C288 C289 C290 C291 C292 C293 C294 C295 C296 C297 C298 C299 C300 C301 C302 C303 C304 C305 C306 C307 C308 C309 C310 C311 C312 C313 C314 C315 C316 C317 C318 C319 C320 C321 C322 C323 C324 C325 C326 C327 C328 C329 C330 C331 C332 C333 C334 C335 C336 C337 C338 C339 C340 C341 C342 C343 C344 C345 C346 C347 C348 C349 C350 C351 C352 C353 C354 C355 C356 C357 C358 C359 C360 C361 C362 C363 C364 C365 C366 C367 C368 C369 C370 C371 C372 C373 C374 C375 C376 C377 C378 C379 C380 C381 C382 C383 C384 C385 C386 C387 C388 C389 C390 C391 C392 C393 C394 C395 C396 C397 C398 C399 C400 C401 C402 C403 C404 C405 C406 C407 C408 C409 C410 C411 C412 C413 C414 C415 C416 C417 C418 C419 C420 C421 C422 C423 C424 C425 C426 C427 C428 C429 C430 C431 C432 C433 C434 C435 C436 C437 C438 C439 C440 C441 C442 C443 C444 C445 C446 C447 C448 C449 C450 C451 C452 C453 C454 C455 C456 C457 C458 C459 C460 C461 C462 C463 C464 C465 C466 C467 C468 C469 C470 C471 C472 C473 C474 C475 C476 C477 C478 C479 C480 C481 C482 C483 C484 C485 C486 C487 C488 C489 C490 C491 C492 C493 C494 C495 C496 C497 C498 C499 C500 C501 C502 C503 C504 C505 C506 C507 C508 C509 C510 C511 C512 C513 C514 C515 C516 C517 C518 C519 C520 C521 C522 C523 C524 C525 C526 C527 C528 C529 C530 C531 C532 C533 C534 C535 C536 C537 C538 C539 C540 C541 C542 C543 C544 C545 C546 C547 C548 C549 C550 C551 C552 C553 C554 C555 C556 C557 C558 C559 C560 C561 C562 C563 C564 C565 C566 C567 C568 C569 C570 C571 C572 C573 C574 C575 C576 C577 C578 C579 C580 C581 C582 C583 C584 C585 C586 C587 C588 C589 C590 C591 C592 C593 C594 C595 C596 C597 C598 C599 C600 C601 C602 C603 C604 C605 C606 C607 C608 C609 C610 C611 C612 C613 C614 C615 C616 C617 C618 C619 C620 C621 C622 C623 C624 C625 C626 C627 C628 C629 C630 C631 C632 C633 C634 C635 C636 C637 C638 C639 C640 C641 C642 C643 C644 C645 C646 C647 C648 C649 C650 C651 C652 C653 C654 C655 C656 C657 C658 C659 C660 C661 C662 C663 C664 C665 C666 C667 C668 C669 C670 C671 C672 C673 C674 C675 C676 C677 C678 C679 C680 C681 C682 C683 C684 C685 C686 C687 C688 C689 C690 C691 C692 C693 C694 C695 C696 C697 C698 C699 C700 C701 C702 C703 C704 C705 C706 C707 C708 C709 C710 C711 C712 C713 C714 C715 C716 C717 C718 C719 C720 C721 C722 C723 C724 C725 C726 C727 C728 C729 C730 C731 C732 C733 C734 C735 C736 C737 C738 C739 C740 C741 C742 C743 C744 C745 C746 C747 C748 C749 C750 C751 C752 C753 C754 C755 C756 C757 C758 C759 C760 C761 C762 C763 C764 C765 C766 C767 C768 C769 C770 C771 C772 C773 C774 C775 C776 C777 C778 C779 C780 C781 C782 C783 C784 C785 C786 C787 C788 C789 C790 C791 C792 C793 C794 C795 C796 C797 C798 C799 C800 C801 C802 C803 C804 C805 C806 C807 C808 C809 C810 C811 C812 C813 C814 C815 C816 C817 C818 C819 C820 C821 C822 C823 C824 C825 C826 C827 C828 C829 C830 C831 C832 C833 C834 C835 C836 C837 C838 C839 C840 C841 C842 C843
