Node	ChrID	GenesCount	Genes
Anc8	Sp1(1):1-388,1013-1095,2829-3292	935	G479 G478 G477 G476 G475 G474 G473 G472 G471 G470 G469 G468 G467 G466 G465 G464 G463 G462 G461 G460 G459 G458 G457 G456 G455 G454 G453 G452 G451 G450 G449 G448 G447 G446 G445 G444 G443 G442 G441 G440 G439 G438 G437 G436 G435 G434 G433 G432 G431 G430 G429 G428 G427 G426 G425 G424 G423 G422 G421 G420 G419 G418 G417 G416 G415 G414 G413 G412 G411 G410 G409 G408 G407 G406 G405 G404 G403 G402 G401 G400 G399 G398 G397 G396 G395 G394 G393 G392 G391 G390 G389 G388 G387 G386 G385 G384 G383 G382 G381 G380 G379 G378 G377 G376 G375 G374 G373 G372 G371 G370 G369 G368 G367 G366 G365 G364 G363 G362 G361 G360 G359 G358 G357 G356 G355 G354 G353 G352 G351 G350 G349 G348 G347 G346 G345 G344 G343 G342 G341 G340 G339 G338 G337 G336 G335 G334 G333 G332 G331 G330 G329 G328 G327 G326 G325 G324 G323 G322 G321 G320 G319 G318 G317 G316 G315 G314 G313 G312 G311 G310 G309 G308 G307 G306 G305 G304 G303 G302 G301 G300 G299 G298 G297 G296 G295 G294 G293 G292 G291 G290 G289 G288 G287 G286 G285 G284 G283 G282 G281 G280 G279 G278 G277 G276 G275 G274 G273 G272 G271 G270 G269 G268 G267 G266 G265 G264 G263 G262 G261 G260 G259 G258 G257 G256 G255 G254 G253 G252 G251 G250 G249 G248 G247 G246 G245 G244 G243 G242 G241 G240 G239 G238 G237 G236 G235 G234 G233 G232 G231 G230 G229 G228 G227 G226 G225 G224 G223 G222 G221 G220 G219 G218 G217 G216 G215 G214 G213 G212 G211 G210 G209 G208 G207 G206 G205 G204 G203 G202 G201 G200 G199 G198 G197 G196 G195 G194 G193 G192 G191 G190 G189 G188 G187 G186 G185 G184 G183 G182 G181 G180 G179 G178 G177 G176 G175 G174 G173 G172 G171 G170 G169 G168 G167 G166 G165 G164 G163 G162 G161 G160 G159 G158 G157 G156 G155 G154 G153 G152 G151 G150 G149 G148 G147 G146 G145 G144 G143 G142 G141 G140 G139 G138 G137 G136 G135 G134 G133 G132 G131 G130 G129 G128 G127 G126 G125 G124 G123 G122 G121 G120 G119 G118 G117 G116 G115 G114 G113 G112 F801 F800 F799 F798 F797 F796 F795 F794 F793 F792 F791 F790 F789 F788 F787 F786 F785 F784 F783 F782 F781 F780 F779 F778 F777 F776 F775 F774 F773 F772 F771 F770 F769 F768 F767 F766 F765 F764 F763 F762 F761 F760 F759 F758 F757 F756 F755 F754 F753 F752 F751 F275 F276 F277 F278 F279 F280 F281 F282 F283 F284 F285 F286 F287 F288 F289 F290 F291 F292 F293 F294 F295 F296 F297 F298 F299 F300 F301 F302 F303 F304 F305 F306 F307 F308 F309 F310 F311 F312 F313 F314 F315 F316 F317 F318 F319 F320 F321 F322 F323 F324 F325 F326 F327 F328 F329 F330 F331 F332 F333 F334 F335 F336 F337 F338 F339 F340 F341 F342 F343 F344 F345 F346 F347 F348 F349 F350 F351 F352 F353 F354 F355 F356 F357 F358 F359 F360 F361 F362 F363 F364 F365 F366 F367 F368 F369 F370 F371 F372 F373 F374 F375 F376 F377 F378 F379 F380 F381 F382 F383 F384 F385 F386 F387 F388 F389 F390 F391 F392 F393 F394 F395 F396 F397 F398 F399 F400 F401 F402 F403 F404 F405 F406 F407 F408 F409 F410 F411 F412 F413 F414 F415 F416 F417 F418 F419 F420 F421 F422 F423 F424 F425 F426 F427 F428 F429 F430 F431 F432 F433 F434 F435 F436 F437 F438 F439 F440 F441 F442 F443 F444 F445 F446 F447 F448 F449 F450 F451 F452 F453 F454 F455 F456 F457 F458 F459 F460 F461 F462 F463 F464 F465 F466 F467 F468 F469 F470 F471 F472 F473 F474 F475 F476 F477 F478 F479 F480 F481 F482 F483 F484 F485 F486 F487 F488 F489 F490 F491 F492 F493 F494 F495 F496 F497 F498 F499 F500 F501 F502 F503 F504 F505 F506 F507 F508 F509 F510 F511 F512 F513 F514 F515 F516 F517 F518 F519 F520 F521 F522 F523 F524 F525 F526 F527 F528 F529 F530 F531 F532 F533 F534 F535 F536 F537 F538 F539 F540 F541 F542 F543 F544 F545 F546 F547 F548 F549 F550 F551 F552 F553 F554 F555 F556 F557 F558 F559 F560 F561 F562 F563 F564 F565 F566 F567 F568 F569 F570 F571 F572 F573 F574 F575 F576 F577 F578 F579 F580 F581 F582 F583 F584 F585 F586 F587 F588 F589 F590 F591 G1 G2 G3 G4 G5 G6 G7 G8 G9 G10 G11 G12 G13 G14 G15 G16 G17 G18 G19 G20 G21 G22 G23 G24 G25 G26 G27 G28 G29 G30 G31 G32 G33 G34 G35 G36 G37 G38 G39 G40 G41 G42 G43 G44 G45 G46 G47 G48 G49 G50 G51 G52 G53 G54 G55 G56 G57 G58 G59 G60 G61 G62 G63 G64 G65 G66 G67 G68 G69 G70 G71 G72 G73 G74 G75 G76 G77 G78 G79 G80 G81 G82 G83 G84 G85 G86 B43 B44 B45 B46 B47 B48 B49 B50 B51 B52 B53 B54 B55 B56 B57 B58 B59 B60 B61 B62 B63 B64 B65 B66 B67 B68 B69 B70 B71 B72 B73 B74 B75 B76 B77 B78 B79 B80 B81 B82 B83 B84 B85 B86 B87 B88 B89 B90 B91 B92 B93 B94 B95 B96 B97 B98 B99 B100 B101 B102 B103 B104 B105 B106 B107 B108 B109 B110 B111 B112 B113 B114 B115 B116 B117 B118 B119 B120 B121 B122 B123 B124 B125 B126 B127 B128 B129 B130 B131 B132 B133 B134 B135 B136 B137 B138 B139 B140 B141 B142 B143 B144 B145 B146 B147 B148 B149 B150 B151 B152 B153 B154 B155
Anc8	Sp1(2)	595	E1 E2 E3 E4 E5 E6 E7 E8 E9 E10 E11 E12 E13 E14 E15 E16 E17 E18 E19 E20 E21 E22 E23 E24 E25 E26 E27 E28 E29 E30 E31 E32 E33 E34 E35 E36 E37 E38 E39 E40 E41 E42 E43 E44 E45 E46 E47 E48 E49 E50 E51 E52 E53 E54 E55 E56 E57 E58 E59 E60 E61 E62 E63 E64 E65 E66 E67 E68 E69 E70 E71 E72 E73 E74 E439 E438 E437 E436 E435 E434 E433 E432 E431 E430 E429 E428 E427 E426 E425 E424 E423 E422 E421 E420 E419 E418 E417 E416 E415 E414 E413 E412 E411 E410 E409 E408 E407 E406 E405 E404 E403 E402 E401 E400 E399 E398 E397 E396 E395 E394 E393 E392 E391 E390 E389 E388 E387 E386 E385 E384 E383 E382 E381 E380 E379 E378 E377 E376 E375 E374 E373 E372 E371 E370 E369 E368 E367 E366 E365 E364 E363 E362 E361 E360 E359 E358 E357 E356 E355 E354 E353 E352 E351 E350 E349 E348 E347 E346 E345 E344 E343 E342 E341 E340 E339 E338 E337 E336 E335 E334 E333 E332 E331 E330 E329 E328 E327 E326 E325 E324 E323 E322 E321 E320 E319 E318 E317 E316 E315 E314 E313 E312 E311 E310 E309 E308 E307 E306 E305 E304 E303 E302 E301 E300 E299 E298 E297 E296 E295 E294 E293 E292 E291 E290 E289 E288 E287 E286 E285 E284 E283 E282 E281 E280 E279 E278 E277 E276 E275 E274 E273 E272 E271 E270 E269 E268 E267 E266 E265 E264 E263 E262 E261 E260 E259 E258 E257 E256 E255 E254 E253 E252 E251 E250 E249 E248 E247 E246 E245 E244 E243 E242 E241 E240 E492 E491 E490 E489 E488 E487 E486 E485 E484 E483 E482 E481 E480 E479 E478 E477 E476 E475 E474 E473 E472 E471 E470 E469 E468 E467 E466 E465 E464 E463 E462 E461 E460 E459 E458 E457 E456 E455 E454 E453 E452 E451 E450 E449 E448 E447 E446 E445 E444 E443 E442 E441 E440 E75 E76 E77 E78 E79 E80 E81 E82 E83 E84 E85 E86 E87 E88 E89 E90 E91 E92 E93 E94 E95 E96 E97 E98 E99 E100 E101 E102 E103 E104 E105 E106 E107 E108 E109 E110 E111 E112 E113 E114 E115 E116 E117 E118 E119 E120 E121 E122 E123 E124 E125 E126 E127 E128 E129 E130 E131 E132 E133 E134 E135 E136 E137 E138 E139 E140 E141 E142 E143 E144 E145 E146 E147 E148 E149 E150 E151 E152 E153 E154 E155 E156 E157 E158 E159 E160 E161 E162 E163 E164 E165 E166 E167 E168 E169 E170 E171 E172 E173 E174 E175 E176 E177 E178 E179 E180 E181 E182 E183 E184 E185 E186 E187 E188 E189 E190 E191 E192 E193 E194 E195 E196 E197 E198 E199 E200 E201 E202 E203 E204 E205 E206 E207 E208 E209 E210 E211 E212 E213 E214 E215 E216 E217 E218 E219 E220 E221 E222 E223 E224 E225 E226 E227 E228 E229 E230 E231 E232 E233 E234 E235 E236 E237 E238 E239 E493 E494 E495 E496 E497 E498 E499 E500 E501 E502 E503 E504 E505 E506 E507 E508 E509 E510 E511 E512 E513 E514 E515 E516 E517 E518 E519 E520 E521 E522 E523 E524 E525 E526 E527 E528 E529 E530 E531 E532 E533 E534 E535 E536 E537 E538 E539 E540 E541 E542 E543 E544 E545 E546 E547 E548 E549 E550 E551 E552 E553 E554 E555 E556 E557 E558 E559 E560 E561 E562 E563 E564 E565 E566 E567 E568 E569 E570 E571 E572 E573 E574 E575 E576 E577 E578 E579 E580 E581 E582 E583 E584 E585 E586 E587 E588 E589 E590 E591 E592 E593 E594 E595
Anc8	Sp1(3)	674	F1 F2 F3 F4 F5 F6 F7 F8 F9 F10 F11 F12 F13 F14 F15 F16 F17 F18 F19 F20 F21 F22 F23 F24 F25 F26 F27 F28 F29 F30 F31 F32 F33 F34 F35 F36 F37 F38 F39 F40 F41 F42 F43 F44 F45 F46 F47 F48 F49 F50 F51 F52 F53 F54 F55 F56 F57 F58 F59 F60 F61 F62 F63 F64 F65 F66 F67 F68 F69 F70 F71 F72 F73 F74 F75 F76 F77 F78 F79 F80 F81 F82 F83 F84 F85 F86 F87 F88 F89 F90 F91 F92 F93 F94 F95 F96 F97 F98 F99 F100 F101 F102 F103 F104 F105 F106 F107 F108 F109 F110 F111 F112 F113 F114 F115 F116 F117 F118 F119 F120 F121 F122 F123 F124 F125 F126 F127 F128 F129 F130 F131 F132 F133 F134 F135 F136 F137 F138 F139 F140 F141 F142 F143 F144 F145 F146 F147 F148 F149 F150 F151 F152 F153 F154 F155 F156 F157 F158 F159 F160 F161 F162 F163 F164 F165 F166 F167 F168 F169 F170 F171 F172 F173 F174 F175 F176 F177 F178 F179 F180 F181 F182 F183 F184 F185 F186 F187 F188 F189 F190 F191 F192 F193 F194 F195 F196 F197 F198 F199 F200 F201 F202 F203 F204 F205 F206 F207 F208 F209 F210 F211 F212 F213 F214 F215 F216 F217 F218 F219 F220 F221 F222 F223 F224 F225 F226 F227 F228 F229 F230 F231 F232 F233 F234 F235 F236 F237 F238 F239 F240 F241 F242 F243 F244 F245 F246 F247 F248 F249 F250 F251 F252 F253 F254 F255 F256 F257 F258 F259 F260 F261 F262 F263 F264 F265 F266 F267 F268 F269 F270 F271 F272 F273 F274 F750 F749 F748 F747 F746 F745 F744 F743 F742 F741 F740 F739 F738 F737 F736 F735 F734 F733 F732 F731 F730 F729 F728 F727 F726 F725 F724 F723 F722 F721 F720 F719 F718 F717 F716 F715 F714 F713 F712 F711 F710 F709 F708 F707 F706 F705 F704 F703 F702 F701 F700 F699 F698 F697 F696 F695 F694 F693 F692 F691 F690 F689 F688 F687 F686 F685 F684 F683 F682 F681 F680 F679 F678 F677 F676 F675 F674 F673 F672 F671 F670 F669 F668 F667 F666 F665 F664 F663 F662 F661 F660 F659 F658 F657 F656 F655 F654 F653 F652 F651 F650 F649 F648 F647 F646 F645 F644 F643 F642 F641 F640 F639 F638 F637 F636 F635 F634 F633 F632 F631 F630 F629 F628 F627 F626 F625 F624 F623 F622 F621 F620 F619 F618 F617 F616 F615 F614 F613 F612 F611 F610 F609 F608 F607 F606 F605 F604 F603 F602 F601 F600 F599 F598 F597 F596 F595 F594 F593 F592 F975 F974 F973 F972 F971 F970 F969 F968 F967 F966 F965 F964 F963 F962 F961 F960 F959 F958 F957 F956 F955 F954 F953 F952 F951 F950 F949 F948 F947 F946 F945 F944 F943 F942 F941 F940 F939 F938 F937 F936 F935 F934 F933 F932 F931 F930 F929 F928 F927 F926 F925 F924 F923 F922 F921 F920 F919 F918 F917 F916 F915 F914 F913 F912 F911 F910 F909 F908 F907 F906 F905 F904 F903 F902 F901 F900 F899 F898 F897 F896 F895 F894 F893 F892 F891 F890 F889 F888 F887 F886 F885 F884 F883 F882 F881 F880 F879 F878 F877 F876 F875 F874 F873 F872 F871 F870 F869 F868 F867 F866 F865 F864 F863 F862 F861 F860 F859 F858 F857 F856 F855 F854 F853 F852 F851 F850 F849 F848 F847 F846 F845 F844 F843 F842 F841 F840 F839 F838 F837 F836 F835 F834 F833 F832 F831 F830 F829 F828 F827 F826 F825 F824 F823 F822 F821 F820 F819 F818 F817 F816 F815 F814 F813 F812 F811 F810 F809 F808 F807 F806 F805 F804 F803 F802 G111 G110 G109 G108 G107 G106 G105 G104 G103 G102 G101 G100 G99 G98 G97 G96 G95 G94 G93 G92 G91 G90 G89 G88 G87 B4 B5 B6 B7 B8 B9 B10 B11 B12 B13 B14 B15 B16 B17 B18 B19 B20 B21 B22 B23 B24 B25 B26 B27 B28 B29 B30 B31 B32 B33 B34 B35 B36 B37 B38 B39 B40 B41 B42 B3 B2 B1
Anc8	Sp3(1)	1458	A1 A2 A3 A4 A5 A6 A7 A8 A9 A10 A11 A12 A13 A14 A15 A16 A17 A18 A19 A20 A21 A22 A23 A24 A25 A26 A27 A28 A29 A30 A31 A32 A33 A34 A35 A36 A37 A38 A39 A40 A41 A42 A43 A44 A45 A46 A47 A48 A49 A50 A51 A52 A53 A54 A55 A56 A57 A58 A59 A60 A61 A62 A63 A64 A65 A66 A67 A68 A69 A70 A71 A72 A73 A74 A75 A76 A77 A78 A79 A80 A81 A82 A83 A84 A85 A86 A87 A88 A89 A90 A91 A92 A93 A94 A95 A96 A97 A98 A99 A100 A101 A102 A103 A104 A105 A106 A107 A108 A109 A110 A111 A112 A113 A114 A115 A116 A117 A118 A119 A120 A121 A122 A123 A124 A125 A126 A127 A128 A129 A130 A131 A132 A133 A134 A135 A136 A137 A138 A139 A140 A141 A142 A143 A144 A145 A146 A147 A148 A149 A150 A151 A152 A153 A154 A155 A156 A157 A158 A159 A160 A161 A162 A163 A164 A165 A166 A167 A168 A169 A170 A171 A172 A173 A174 A175 A176 A177 A178 A179 A180 A181 A182 A183 A184 A185 A186 A187 A188 A189 A190 A191 A192 A193 A194 A195 A196 A197 A198 A199 A200 A201 A202 A203 A204 A205 A206 A207 A208 A209 A210 A211 A212 A213 A214 A215 A216 A217 A218 A219 A220 A221 A222 A223 A224 A225 A226 A227 A228 A229 A230 A231 A232 A233 A234 A235 A236 A237 A238 A239 A240 A241 A242 A243 A244 A245 A246 A247 A248 C1 C2 C3 C4 C5 C6 C7 C8 C9 C10 C11 C12 C13 C14 C15 C16 C17 C18 C19 C20 C21 C22 C23 C24 C25 C26 C27 C28 C29 C30 C31 C32 C33 C34 C35 C36 C37 C38 C39 C40 C41 C42 C43 C44 C45 C46 C47 C48 C49 C50 C51 C52 C53 C54 C55 C56 C57 C58 C59 C60 C61 C62 C63 C64 C65 C66 C67 C68 C69 C70 C71 C72 C73 C74 C75 C76 C77 C78 C79 C80 C81 C82 C83 C84 C85 C86 C87 C88 C89 C90 C91 C92 C93 C94 C95 C96 C97 C98 C99 C100 C101 C102 C103 C104 C105 C106 C107 C108 C109 C110 C111 C112 C113 C114 C115 C116 C117 C118 C119 C120 C121 C122 C123 C124 C125 C126 C127 C128 C129 C130 C131 C132 C133 C134 C135 C136 C137 C138 C139 C140 C141 C142 C143 C144 C145 C146 C147 C148 C149 C150 C151 C152 C153 C154 C155 C156 C157 C158 C159 C160 C161 C162 C163 C164 C165 C166 C167 C168 C169 C170 C171 C172 C173 C174 C175 C176 C177 C178 C179 C180 C181 C182 C183 C184 C185 C186 C187 C188 C189 C190 C191 C192 C193 C194 C195 C196 C197 C198 C199 C200 C201 C202 C203 C204 C205 C206 C207 C208 C209 C210 C211 C212 C213 C214 C215 C216 C217 C218 C219 C220 C221 C222 C223 C224 C225 C226 C227 C228 C229 C230 C231 C232 C233 C234 C235 C236 C237 C238 C239 C240 C241 C242 C243 C244 C245 C246 C247 C248 C249 C250 C251 C252 C253 C254 C255 C256 C257 C258 C259 C260 C261 C262 C263 C264 C265 C266 C267 C268 C269 C270 C271 C272 C273 C274 C275 C276 C277 C278 C279 C280 C281 C282 C283 C284 C285 C286 C287 C288 C289 C290 C291 C292 C293 C294 C295 C296 C297 C298 C299 C300 C301 C302 C303 C304 C305 C306 C307 C308 C309 C310 C311 C312 C313 C314 C315 C316 C317 C318 C319 C320 C321 C322 C323 C324 C325 C326 C327 C328 C329 C330 C331 C332 C333 C334 C335 C336 C337 C338 C339 C340 C341 C342 C343 C344 C345 C346 C347 C348 C349 C350 C351 C352 C353 C354 C355 C356 C357 C358 C359 C360 C361 C362 C363 C364 C365 C366 C367 C368 C369 C370 C371 C372 C373 C374 C375 C376 C377 C378 C379 C380 C381 C382 C383 C384 C385 C386 C387 C388 C389 C390 C391 C392 C393 C794 C793 C792 C791 C790 C789 C788 C787 C786 C785 C784 C783 C782 C781 C780 C779 C778 C777 C776 C775 C774 C773 C772 C771 C770 C769 C768 C767 C766 C765 C764 C763 C762 C761 C760 C759 C758 C757 C756 C755 C754 C753 C752 C751 C750 C749 C748 C747 C746 C745 C744 C743 C742 C741 C740 C739 C738 C737 C736 C735 C734 C733 C732 C731 C730 C729 C728 C727 C726 C725 C724 C723 C722 C721 C720 C719 C718 C717 C716 C715 C714 C713 C712 C711 C710 C709 C708 C707 C706 C705 C704 C703 C702 C701 C700 C699 C698 C697 C696 C695 C694 C693 C692 C691 C690 C689 C688 C687 C686 C685 C684 C683 C682 C681 C680 C679 C678 C677 C676 C675 C674 C673 C672 C671 C670 C669 C668 C667 C666 C665 C664 C663 C662 C661 C660 C659 C658 C657 C656 C655 C654 C653 C652 C651 C650 C649 C648 C647 C646 C645 C644 C643 C642 C641 C640 C639 C638 C637 C636 C635 C634 C633 C632 C631 C630 C629 C628 C627 C626 C625 C624 C623 C622 C621 C620 C619 C618 C617 C616 C615 C614 C613 C612 C611 C610 C609 C608 C607 C606 C605 C604 C603 C602 C601 C600 C599 C598 C597 C596 C595 C594 C593 C592 C591 C590 C589 C588 C587 C586 C585 C584 C583 C582 C581 C580 C579 C578 C577 C576 C575 C574 C573 C572 C571 C570 C569 C568 C567 C566 C565 C564 C563 C562 C561 C560 C559 C558 C557 C556 C555 C554 C553 C552 C551 C550 C549 C548 C547 C546 C545 C544 C543 C542 C541 C540 C539 C538 C537 C536 C535 C534 C533 C532 C531 C530 C529 C528 C527 C526 C525 C524 C523 C522 C521 C520 C519 C518 C517 C516 C515 C514 C513 C512 C511 C510 C509 C508 C507 C506 C505 C504 C503 C502 C501 C500 C499 C498 C497 C496 D107 D108 D109 D110 D111 D112 D113 D114 D115 D116 D117 D118 D119 D120 D121 D122 D123 D124 D125 D126 D127 D128 D129 D130 D131 D132 D133 D134 D135 D136 D137 D138 D139 D140 D141 D142 D143 D144 D145 D146 D147 D148 D149 D150 D151 D152 D153 D154 D155 D156 D157 D158 D159 D160 D161 D162 D163 D164 D165 D166 D167 D168 D169 D170 D171 D172 D173 D174 D175 D176 D177 D178 D179 D180 D181 D182 D183 D184 D185 D186 D187 D188 D189 D190 D191 D192 D193 D194 D195 D196 D197 D198 D199 D200 D201 D202 D203 D204 D205 D206 D207 D208 D209 D210 D211 D212 D213 D214 D215 D216 D217 D218 D219 D220 D221 D222 D223 D224 D225 D226 D227 D228 D229 D230 D231 D232 D233 D234 D235 D236 D237 D238 D239 D240 D241 D242 D243 D244 D245 D246 D247 D248 D249 D250 D251 D252 D253 D254 D255 D256 D257 D258 D259 D260 D261 D262 D263 D264 D265 D266 D267 D268 D269 D270 D271 D272 D273 D274 D275 D276 D277 D278 D279 D280 D281 D282 D283 D284 D285 D286 D287 D288 D289 D290 D291 D292 D293 D294 D295 D296 D297 D298 D299 D300 D301 D302 D303 D304 D305 D306 D307 D308 D309 D310 D311 D312 D313 D314 D315 D316 D317 D318 D319 D320 D321 D322 D323 D324 D325 D326 D327 D328 D329 D330 D331 D332 D333 D334 D335 D336 D337 D338 D339 D340 D341 D342 D343 D344 D345 D346 D347 D348 D349 D350 D351 D352 D353 D354 D355 D356 D357 D358 D359 D360 D361 D362 D363 D364 D365 D366 D367 D368 D369 D370 D371 D372 D373 D374 D375 D376 D377 D378 D379 D380 D381 D382 D383 D384 D385 D386 D387 D388 D389 D390 D391 D392 D393 D394 D395 D396 D397 D398 D399 D400 D401 D402 D403 D404 D405 D406 D407 D408 D409 D410 D411 D412 D413 D414 D415 D416 D417 D418 D419 D420 D421 D422 D423 D424 D425 D426 D427 D428 D429 D430 D431 D432 D433 D434 D435 D436 D437 D438 D439 D440 D441 D442 D443 D444 D445 D446 D447 D448 D449 D450 D451 D452 D453 D454 D455 D456 D457 D458 D459 D460 D461 D462 D463 D464 D465 D466 D467 D468 D469 D470 D471 D472 D473 D474 D475 D476 D477 D478 D479 D480 D481 D482 D483 D484 D485 D486 D487 D488 D489 D490 D491 D492 D493 D494 D495 D496 D497 D498 D499 D500 D501 D502 D503 D504 D505 D506 D507 D508 D509 D510 D511 D512 D513 D514 D515 D516 D517 D518 D519 D520 D521 D522 D523 D524 D525 D526 D527 D528 D529 D530 D531 D532 D533 D534 D535 D536 D537 D538 D539 D540 D541 D542 D543 D544 D545 D546 D547 D548 D549 D550 D551 D552 D553 D554 D555 D556 D557 D558 D559 D560 D561 D562 D563 D564 D565 D566 D567 D568 D569 D570 D571 D572 D573 D574 D575 D576 D577 D578 D579 D580 D581 D582 D583 D584 D585 D586 D587 D588 D589 D590 D591 D592 D593 D594 D595 D596 D597 D598 D599 D600 D601 D602 D603 D604 D605 D606 D607 D608 D609 D610 D611 D612 D613 D614 D615 D616 D617 D618 D619 D620 D621 D622 D623 D624
Anc8	Sp3(3):1-257,774-899	383	D1 D2 D3 D4 D5 D6 D7 D8 D9 D10 D11 D12 D13 D14 D15 D16 D17 D18 D19 D20 D21 D22 D23 D24 D25 D26 D27 D28 D29 D30 D31 D32 D33 D34 D35 D36 D37 D38 D39 D40 D41 D42 D43 D44 D45 D46 D47 D48 D49 D50 D51 D52 D53 D54 D55 D56 D57 D58 D59 D60 D61 D62 D63 D64 D65 D66 D67 D68 D69 D70 D71 D72 D73 D74 D75 D76 D77 D78 D79 D80 D81 D82 D83 D84 D85 D86 D87 D88 D89 D90 D91 D92 D93 D94 D95 D96 D97 D98 D99 D100 D101 D102 D103 D104 D105 D106 C495 C494 C493 C492 C491 C490 C489 C488 C487 C486 C485 C484 C483 C482 C481 C480 C479 C478 C477 C476 C475 C474 C473 C472 C471 C470 C469 C468 C467 C466 C465 C464 C463 C462 C461 C460 C459 C458 C457 C456 C455 C454 C453 C452 C451 C450 C449 C448 C447 C446 C445 C444 C443 C442 C441 C440 C439 C438 C437 C436 C435 C434 C433 C432 C431 C430 C429 C428 C427 C426 C425 C424 C423 C422 C421 C420 C419 C418 C417 C416 C415 C414 C413 C412 C411 C410 C409 C408 C407 C406 C405 C404 C403 C402 C401 C400 C399 C398 C397 C396 C395 C394 C795 C796 C797 C798 C799 C800 C801 C802 C803 C804 C805 C806 C807 C808 C809 C810 C811 C812 C813 C814 C815 C816 C817 C818 C819 C820 C821 C822 C823 C824 C825 C826 C827 C828 C829 C830 C831 C832 C833 C834 C835 C836 C837 C838 C839 C840 C841 C842 C843 A249 A250 A251 A252 A253 A254 A255 A256 A257 A258 A259 A260 A261 A262 A263 A264 A265 A266 A267 A268 A269 A270 A271 A272 A273 A274 A275 A276 A277 A278 A279 A280 A281 A282 A283 A284 A285 A286 A287 A288 A289 A290 A291 A292 A293 A294 A295 A296 A297 A298 A299 A300 A301 A302 A303 A304 A305 A306 A307 A308 A309 A310 A311 A312 A313 A314 A315 A316 A317 A318 A319 A320 A321 A322 A323 A324 A325 A326 A327 A328 A329 A330 A331 A332 A333 A334 A335 A336 A337 A338 A339 A340 A341 A342 A343 A344 A345 A346 A347 A348 A349 A350 A351 A352 A353 A354 A355 A356 A357 A358 A359 A360 A361 A362 A363 A364 A365 A366 A367 A368 A369 A370 A371 A372 A373 A374
Anc10	Sp1(1):1-388,1013-1095,2829-3292	935	G479 G478 G477 G476 G475 G474 G473 G472 G471 G470 G469 G468 G467 G466 G465 G464 G463 G462 G461 G460 G459 G458 G457 G456 G455 G454 G453 G452 G451 G450 G449 G448 G447 G446 G445 G444 G443 G442 G441 G440 G439 G438 G437 G436 G435 G434 G433 G432 G431 G430 G429 G428 G427 G426 G425 G424 G423 G422 G421 G420 G419 G418 G417 G416 G415 G414 G413 G412 G411 G410 G409 G408 G407 G406 G405 G404 G403 G402 G401 G400 G399 G398 G397 G396 G395 G394 G393 G392 G391 G390 G389 G388 G387 G386 G385 G384 G383 G382 G381 G380 G379 G378 G377 G376 G375 G374 G373 G372 G371 G370 G369 G368 G367 G366 G365 G364 G363 G362 G361 G360 G359 G358 G357 G356 G355 G354 G353 G352 G351 G350 G349 G348 G347 G346 G345 G344 G343 G342 G341 G340 G339 G338 G337 G336 G335 G334 G333 G332 G331 G330 G329 G328 G327 G326 G325 G324 G323 G322 G321 G320 G319 G318 G317 G316 G315 G314 G313 G312 G311 G310 G309 G308 G307 G306 G305 G304 G303 G302 G301 G300 G299 G298 G297 G296 G295 G294 G293 G292 G291 G290 G289 G288 G287 G286 G285 G284 G283 G282 G281 G280 G279 G278 G277 G276 G275 G274 G273 G272 G271 G270 G269 G268 G267 G266 G265 G264 G263 G262 G261 G260 G259 G258 G257 G256 G255 G254 G253 G252 G251 G250 G249 G248 G247 G246 G245 G244 G243 G242 G241 G240 G239 G238 G237 G236 G235 G234 G233 G232 G231 G230 G229 G228 G227 G226 G225 G224 G223 G222 G221 G220 G219 G218 G217 G216 G215 G214 G213 G212 G211 G210 G209 G208 G207 G206 G205 G204 G203 G202 G201 G200 G199 G198 G197 G196 G195 G194 G193 G192 G191 G190 G189 G188 G187 G186 G185 G184 G183 G182 G181 G180 G179 G178 G177 G176 G175 G174 G173 G172 G171 G170 G169 G168 G167 G166 G165 G164 G163 G162 G161 G160 G159 G158 G157 G156 G155 G154 G153 G152 G151 G150 G149 G148 G147 G146 G145 G144 G143 G142 G141 G140 G139 G138 G137 G136 G135 G134 G133 G132 G131 G130 G129 G128 G127 G126 G125 G124 G123 G122 G121 G120 G119 G118 G117 G116 G115 G114 G113 G112 F801 F800 F799 F798 F797 F796 F795 F794 F793 F792 F791 F790 F789 F788 F787 F786 F785 F784 F783 F782 F781 F780 F779 F778 F777 F776 F775 F774 F773 F772 F771 F770 F769 F768 F767 F766 F765 F764 F763 F762 F761 F760 F759 F758 F757 F756 F755 F754 F753 F752 F751 F275 F276 F277 F278 F279 F280 F281 F282 F283 F284 F285 F286 F287 F288 F289 F290 F291 F292 F293 F294 F295 F296 F297 F298 F299 F300 F301 F302 F303 F304 F305 F306 F307 F308 F309 F310 F311 F312 F313 F314 F315 F316 F317 F318 F319 F320 F321 F322 F323 F324 F325 F326 F327 F328 F329 F330 F331 F332 F333 F334 F335 F336 F337 F338 F339 F340 F341 F342 F343 F344 F345 F346 F347 F348 F349 F350 F351 F352 F353 F354 F355 F356 F357 F358 F359 F360 F361 F362 F363 F364 F365 F366 F367 F368 F369 F370 F371 F372 F373 F374 F375 F376 F377 F378 F379 F380 F381 F382 F383 F384 F385 F386 F387 F388 F389 F390 F391 F392 F393 F394 F395 F396 F397 F398 F399 F400 F401 F402 F403 F404 F405 F406 F407 F408 F409 F410 F411 F412 F413 F414 F415 F416 F417 F418 F419 F420 F421 F422 F423 F424 F425 F426 F427 F428 F429 F430 F431 F432 F433 F434 F435 F436 F437 F438 F439 F440 F441 F442 F443 F444 F445 F446 F447 F448 F449 F450 F451 F452 F453 F454 F455 F456 F457 F458 F459 F460 F461 F462 F463 F464 F465 F466 F467 F468 F469 F470 F471 F472 F473 F474 F475 F476 F477 F478 F479 F480 F481 F482 F483 F484 F485 F486 F487 F488 F489 F490 F491 F492 F493 F494 F495 F496 F497 F498 F499 F500 F501 F502 F503 F504 F505 F506 F507 F508 F509 F510 F511 F512 F513 F514 F515 F516 F517 F518 F519 F520 F521 F522 F523 F524 F525 F526 F527 F528 F529 F530 F531 F532 F533 F534 F535 F536 F537 F538 F539 F540 F541 F542 F543 F544 F545 F546 F547 F548 F549 F550 F551 F552 F553 F554 F555 F556 F557 F558 F559 F560 F561 F562 F563 F564 F565 F566 F567 F568 F569 F570 F571 F572 F573 F574 F575 F576 F577 F578 F579 F580 F581 F582 F583 F584 F585 F586 F587 F588 F589 F590 F591 G1 G2 G3 G4 G5 G6 G7 G8 G9 G10 G11 G12 G13 G14 G15 G16 G17 G18 G19 G20 G21 G22 G23 G24 G25 G26 G27 G28 G29 G30 G31 G32 G33 G34 G35 G36 G37 G38 G39 G40 G41 G42 G43 G44 G45 G46 G47 G48 G49 G50 G51 G52 G53 G54 G55 G56 G57 G58 G59 G60 G61 G62 G63 G64 G65 G66 G67 G68 G69 G70 G71 G72 G73 G74 G75 G76 G77 G78 G79 G80 G81 G82 G83 G84 G85 G86 B43 B44 B45 B46 B47 B48 B49 B50 B51 B52 B53 B54 B55 B56 B57 B58 B59 B60 B61 B62 B63 B64 B65 B66 B67 B68 B69 B70 B71 B72 B73 B74 B75 B76 B77 B78 B79 B80 B81 B82 B83 B84 B85 B86 B87 B88 B89 B90 B91 B92 B93 B94 B95 B96 B97 B98 B99 B100 B101 B102 B103 B104 B105 B106 B107 B108 B109 B110 B111 B112 B113 B114 B115 B116 B117 B118 B119 B120 B121 B122 B123 B124 B125 B126 B127 B128 B129 B130 B131 B132 B133 B134 B135 B136 B137 B138 B139 B140 B141 B142 B143 B144 B145 B146 B147 B148 B149 B150 B151 B152 B153 B154 B155
